Authors,Title,Year,Source title,Volume,Issue,Art. No.,Page start,Page end,Page count,Cited by,DOI,Link,Document Type,Source,EID
"Blatt, M.R.","The action spectrum for chloroplast movements and evidence for blue-light-photoreceptor cycling in the alga Vaucheria",1983,"Planta","159","3",,"267","276",,10,10.1007/BF00397535,"http://www.scopus.com/inward/record.url?eid=2-s2.0-0005115599&partnerID=40&md5=f96d627dbe9c79170ded06590480761e",Article,Scopus,2-s2.0-0005115599
"Blatt, M.R., Slayman, C.L.","KCl leakage from microelectrodes and its impact on the membrane parameters of a nonexcitable cell",1983,"The Journal of Membrane Biology","72","3",,"223","234",,64,10.1007/BF01870589,"http://www.scopus.com/inward/record.url?eid=2-s2.0-0020582730&partnerID=40&md5=914860ad460d5ce7c31be71316a08c05",Article,Scopus,2-s2.0-0020582730
"Blatt, M.R., Weisenseel, M.H., Haupt, W.","A light-dependent current associated with chloroplast aggregation in the alga Vaucheria sessilis",1981,"Planta","152","6",,"513","526",,23,10.1007/BF00380822,"http://www.scopus.com/inward/record.url?eid=2-s2.0-0000687629&partnerID=40&md5=f9bb888bede38c44bc826a42bdd1778e",Article,Scopus,2-s2.0-0000687629
"Klein, K., Wagner, G., Blatt, M.R.","Heavy-meromyosin-decoration of microfilaments from Mougeotia protoplasts",1980,"Planta","150","5",,"354","356",,17,10.1007/BF00390169,"http://www.scopus.com/inward/record.url?eid=2-s2.0-0345246403&partnerID=40&md5=fdcc3a83b6886485e82422337dd1d767",Article,Scopus,2-s2.0-0345246403
"Blatt, M.R., Briggs, W.R.","Blue-light-induced cortical fiber reticulation concomitant with chloroplast aggregation in the alga Vaucheria sessilis",1980,"Planta","147","4",,"355","362",,36,10.1007/BF00379845,"http://www.scopus.com/inward/record.url?eid=2-s2.0-0000667249&partnerID=40&md5=7b0072bda35b49309b16c8da7ce77d46",Article,Scopus,2-s2.0-0000667249
"Blatt, M.R., Wessells, N.K., Briggs, W.R.","Actin and cortical fiber reticulation in the siphonaceous alga Vaucheria sessilis",1980,"Planta","147","4",,"363","375",,41,10.1007/BF00379846,"http://www.scopus.com/inward/record.url?eid=2-s2.0-0000667248&partnerID=40&md5=d2beaa9e8d4110829812f222995e85e2",Article,Scopus,2-s2.0-0000667248
