Authors,Title,Year,Source title,Volume,Issue,Art. No.,Page start,Page end,Page count,Cited by,DOI,Link,Document Type,Source,EID
"Garcia-Mata, C., Gay, R., Sokolovski, S., Hills, A., Lamattina, L., Blatt, M.R.","Nitric oxide regulates K+ and Cl- channels in guard cells through a subset of abscisic acid-evoked signaling pathways",2003,"Proceedings of the National Academy of Sciences of the United States of America","100","19",,"11116","11121",,199,10.1073/pnas.1434381100,"http://www.scopus.com/inward/record.url?eid=2-s2.0-0141702351&partnerID=40&md5=69c08116b3ac99bbd2cc24590f44ada6",Article,Scopus,2-s2.0-0141702351
"Köhler, B., Hills, A., Blatt, M.R.","Control of guard cell ion channels by hydrogen peroxide and abscisic acid indicates their action through alternate signaling pathways",2003,"Plant Physiology","131","2",,"385","388",,87,10.1104/pp.016014,"http://www.scopus.com/inward/record.url?eid=2-s2.0-12244259047&partnerID=40&md5=83a2de38801b27ee07284b410ee2e403",Letter,Scopus,2-s2.0-12244259047
"Köhler, B., Blatt, M.R.","Protein phosphorylation activates the guard cell Ca2+ channel and is a prerequisite for gating by abscisic acid",2002,"Plant Journal","32","2",,"185","194",,67,10.1046/j.1365-313X.2002.01414.x,"http://www.scopus.com/inward/record.url?eid=2-s2.0-0036776293&partnerID=40&md5=f3ca194da4d6f3c7eb40d5e1ce87ad1e",Article,Scopus,2-s2.0-0036776293
"Blatt, M.R.","Toward understanding vesicle traffic and the guard cell model",2002,"New Phytologist","153","3",,"405","413",,8,10.1046/j.0028-646X.2001.00341.x,"http://www.scopus.com/inward/record.url?eid=2-s2.0-0036189762&partnerID=40&md5=50a901772c2bdbfed7a1fb3461c84e00",Review,Scopus,2-s2.0-0036189762
"Geelen, D., Leyman, B., Batoko, H., Di Sansebastiano, G.-P., Moore, I., Blatt, M.R.","Erratum: The abscisic acid-related SNARE homolog NtSYr1 contributes to secretion and growth: Evidence from competition with its cytosolic domain (The Plant Cell (2002) 14 (387-406))",2002,"Plant Cell","14","4",,"963","",,,10.1105/TPC.cor000,"http://www.scopus.com/inward/record.url?eid=2-s2.0-0036096481&partnerID=40&md5=b7d7d5508f519a55953bca5943a48637",Erratum,Scopus,2-s2.0-0036096481
"Geelen, D., Leyman, B., Batoko, H., Di Sansabastiano, G.-P., Moore, I., Blatt, M.R.","The abscisic acid-related SNARE homolog NtSyr1 contributes to secretion and growth: Evidence from competition with its cytosolic domain",2002,"Plant Cell","14","2",,"387","406",,103,10.1105/tpc.010328,"http://www.scopus.com/inward/record.url?eid=2-s2.0-0036009778&partnerID=40&md5=5459ae388b3fe9ea028f84dd6aad973e",Article,Scopus,2-s2.0-0036009778
"Kargul, J., Gansel, X., Tyrrell, M., Sticher, L., Blatt, M.R.","Protein-binding partners of the tobacco syntaxin NtSyr1",2001,"FEBS Letters","508","2",,"253","258",,21,10.1016/S0014-5793(01)03089-7,"http://www.scopus.com/inward/record.url?eid=2-s2.0-0035900343&partnerID=40&md5=f94244776c17bd3cd01d21de58068742",Article,Scopus,2-s2.0-0035900343
"Hamilton, D.W.A., Hills, A., Blatt, M.R.","Extracellular Ba2+ and voltage interact to gate Ca2+ channels at the plasma membrane of stomatal guard cells",2001,"FEBS Letters","491","1-2",,"99","103",,17,10.1016/S0014-5793(01)02176-7,"http://www.scopus.com/inward/record.url?eid=2-s2.0-0035936679&partnerID=40&md5=e0fbb089162193d1912ead307b488a53",Article,Scopus,2-s2.0-0035936679
"Leyman, B., Geelen, D., Blatt, M.R.","Localization and control of expression of Nt-Syr1, a tobacco snare protein",2000,"Plant Journal","24","3",,"369","381",,57,10.1046/j.1365-313X.2000.00886.x,"http://www.scopus.com/inward/record.url?eid=2-s2.0-0033671251&partnerID=40&md5=05cf18e1f94fec2fcf892840945f550a",Article,Scopus,2-s2.0-0033671251
"Blatt, M.R.","Cellular signaling and volume control in stomatal movements in plants",2000,"Annual Review of Cell and Developmental Biology","16",,,"221","241",,197,10.1146/annurev.cellbio.16.1.221,"http://www.scopus.com/inward/record.url?eid=2-s2.0-0034518307&partnerID=40&md5=4249185577069a62460e0c75be9924e9",Review,Scopus,2-s2.0-0034518307
"Bauly, J.M., Sealy, I.M., Macdonald, H., Brearley, J., Droge, S., Hillmer, S., Robinson, D.G., Venis, M.A., Blatt, M.R., Lazarus, C.M., Napier, R.M.","Overexpression of auxin-binding protein enhances the sensitivity of guard cells to auxin",2000,"Plant Physiology","124","3",,"1229","1238",,57,,"http://www.scopus.com/inward/record.url?eid=2-s2.0-0033738566&partnerID=40&md5=d108f0aebd1f9278c1cb5d3f8551878d",Article,Scopus,2-s2.0-0033738566
"Blatt, M.R.","Ca2+ signalling and control of guard-cell volume in stomatal movements",2000,"Current Opinion in Plant Biology","3","3",,"196","204",,76,10.1016/S1369-5266(00)00064-9,"http://www.scopus.com/inward/record.url?eid=2-s2.0-0034068684&partnerID=40&md5=2f2ddb27ba8065982b5fb216210d38d0",Review,Scopus,2-s2.0-0034068684
"Hamilton, D.W.A., Hills, A., Kohler, B., Blatt, M.R.","Ca2+ channels at the plasma membrane of stomatal guard cells are activated by hyperpolarization and abscisic acid",2000,"Proceedings of the National Academy of Sciences of the United States of America","97","9",,"4967","4972",,227,10.1073/pnas.080068897,"http://www.scopus.com/inward/record.url?eid=2-s2.0-0034712588&partnerID=40&md5=94fc18a8ddd43873f578a0490ca0bb00",Article,Scopus,2-s2.0-0034712588
"Quintero, F.J., Blatt, M.R., Pardo, J.M.","Functional conservation between yeast and plant endosomal Na+/H+ antiporters",2000,"FEBS Letters","471","2-3",,"224","228",,111,10.1016/S0014-5793(00)01412-5,"http://www.scopus.com/inward/record.url?eid=2-s2.0-0034647106&partnerID=40&md5=4797ae875df829d49d71463116f9aae6",Article,Scopus,2-s2.0-0034647106
"Romeis, T., Tang, S., Hammond-Kosack, K., Piedras, P., Blatt, M., Jones, J.D.G.","Early signalling events in the Avr9/Cf-9-dependent plant defence response",2000,"Molecular Plant Pathology","1","1",,"3","8",,8,,"http://www.scopus.com/inward/record.url?eid=2-s2.0-0008794143&partnerID=40&md5=f1b8f9ac2962cd222b870f5539cc9181",Article,Scopus,2-s2.0-0008794143
"Blatt, M.R., Leyman, B., Geelen, D.","Molecular events of vesicle trafficking and control by SNARE proteins in plants",1999,"New Phytologist","144","3",,"389","418",,30,10.1046/j.1469-8137.1999.00546.x,"http://www.scopus.com/inward/record.url?eid=2-s2.0-0033496926&partnerID=40&md5=f74510ce1ef023237092ead72e202804",Review,Scopus,2-s2.0-0033496926
"Frohnmeyer, H., Loyall, L., Blatt, M.R., Grabov, A.","Millisecond UV-B irradiation evokes prolonged elevation of cytosolic-free Ca2+ and stimulates gene expression in transgenic parsley cell cultures",1999,"Plant Journal","20","1",,"109","117",,56,10.1046/j.1365-313X.1999.00584.x,"http://www.scopus.com/inward/record.url?eid=2-s2.0-0032696439&partnerID=40&md5=34579af8e0e7f7a78a00685e5e5c12a4",Article,Scopus,2-s2.0-0032696439
"Vergani, P., Blatt, M.R.","Mutations in the yeast two pore K+ channel YKC1 identify functional differences between the pore domains",1999,"FEBS Letters","458","3",,"285","291",,5,10.1016/S0014-5793(99)01167-9,"http://www.scopus.com/inward/record.url?eid=2-s2.0-0032884148&partnerID=40&md5=a11948f1f6d384837af7dadff1192743",Article,Scopus,2-s2.0-0032884148
"Blatt, M.R., Grabov, A., Brearley, J., Hammond-Kosack, K., Jones, J.D.G.","K+ channels of Cf-9 transgenic tobacco guard cells as targets for Cladosporium fulvum Avr9 elicitor-dependent signal transduction",1999,"Plant Journal","19","4",,"453","462",,57,10.1046/j.1365-313X.1999.00534.x,"http://www.scopus.com/inward/record.url?eid=2-s2.0-0033179898&partnerID=40&md5=c03d65f8f4f4843cc91ef3d2cae807ab",Article,Scopus,2-s2.0-0033179898
"Blatt, M.R.","Reassessing roles for Ca2+ in guard cell signalling",1999,"Journal of Experimental Botany","50","SPEC. ISS.",,"989","999",,28,,"http://www.scopus.com/inward/record.url?eid=2-s2.0-0033043918&partnerID=40&md5=e29bb51af878d5ed713d7dcf0e14d4b6",Conference Paper,Scopus,2-s2.0-0033043918
"Leyman, B., Geelen, D., Quintero, F.J., Blatt, M.R.","A tobacco syntaxin with a role in hormonal control of guard cell ion channels",1999,"Science","283","5401",,"537","540",,141,10.1126/science.283.5401.537,"http://www.scopus.com/inward/record.url?eid=2-s2.0-0033593635&partnerID=40&md5=c52fe9a271458dff35234dc44a8b48e3",Article,Scopus,2-s2.0-0033593635
"Grabov, A., Blatt, M.R.","A steep dependence of inward-rectifying potassium channels on cytosolic free calcium concentration increase evoked by hyperpolarization in guard cells",1999,"Plant Physiology","119","1",,"277","287",,84,,"http://www.scopus.com/inward/record.url?eid=2-s2.0-0032868536&partnerID=40&md5=e1761de2dde0429fb642cde31b51bbee",Article,Scopus,2-s2.0-0032868536
"Vergani, P., Hamilton, D., Jarvis, S., Blatt, M.R.","Mutations in the pore regions of the yeast K+ channel YKC1 affect gating by extracellular K+",1998,"EMBO Journal","17","24",,"7190","7198",,21,10.1093/emboj/17.24.7190,"http://www.scopus.com/inward/record.url?eid=2-s2.0-0032535114&partnerID=40&md5=7a40bbfd1a274c2de39882600ee17d71",Article,Scopus,2-s2.0-0032535114
"Grabov, A., Blatt, M.R.","Co-ordination of signalling elements in guard cell ion channel control",1998,"Journal of Experimental Botany","49","SPEC. ISS.",,"351","360",,60,,"http://www.scopus.com/inward/record.url?eid=2-s2.0-0031896197&partnerID=40&md5=4bf0a5ae4d6ec90437536fc18808be0c",Article,Scopus,2-s2.0-0031896197
"Grabov, A., Blatt, M.R.","Membrane voltage initiates Ca2+ waves and potentiates Ca2+ increases with abscisic acid in stomatal guard cells",1998,"Proceedings of the National Academy of Sciences of the United States of America","95","8",,"4778","4783",,156,10.1073/pnas.95.8.4778,"http://www.scopus.com/inward/record.url?eid=2-s2.0-0032516044&partnerID=40&md5=9450077a2ac8fa838b9e299d4087def3",Article,Scopus,2-s2.0-0032516044
"Frohnmeyer, H., Grabov, A., Blatt, M.R.","A role for the vacuole in auxin-mediated control of cytosolic pH by Vicia mesophyll and guard cells",1998,"Plant Journal","13","1",,"109","116",,27,10.1046/j.1365-313X.1998.00013.x,"http://www.scopus.com/inward/record.url?eid=2-s2.0-0031951269&partnerID=40&md5=1296df95ed8ae9f3ebb382cf8f12962d",Article,Scopus,2-s2.0-0031951269
"Leung, J., Merlot, S., Gosti, F., Bertauche, N., Blatt, M.R., Giraudat, J.","The role of ABI1 in abscisic acid signal transduction: from gene to cell.",1998,"Symposia of the Society for Experimental Biology","51",,,"65","71",,5,,"http://www.scopus.com/inward/record.url?eid=2-s2.0-0032227076&partnerID=40&md5=995e759bf7ada6259a18623fc3a10844",Article,Scopus,2-s2.0-0032227076
"Blatt, M.R., Maurousset, L., Meharg, A.A.","High-affinity NO3 --H+ cotransport in the fungus Neurospora: Induction and control by pH and membrane voltate",1997,"Journal of Membrane Biology","160","1",,"59","76",,14,10.1007/s002329900295,"http://www.scopus.com/inward/record.url?eid=2-s2.0-0030775128&partnerID=40&md5=2d6fc44013177333bf02794ee4c722d0",Article,Scopus,2-s2.0-0030775128
"Quintero, F.J., Blatt, M.R.","A new family of K+ transporters from Arabidopsis that are conserved across phyla",1997,"FEBS Letters","415","2",,"206","211",,99,10.1016/S0014-5793(97)01125-3,"http://www.scopus.com/inward/record.url?eid=2-s2.0-0031590324&partnerID=40&md5=33129069876975f8f8d1c2d4195d853b",Article,Scopus,2-s2.0-0031590324
"Blatt, M.R., Gradmann, D.","K+-Sensitive gating of the K+ outward rectifier in Vicia guard cells",1997,"Journal of Membrane Biology","158","3",,"241","256",,51,10.1007/s002329900261,"http://www.scopus.com/inward/record.url?eid=2-s2.0-0030748507&partnerID=40&md5=71e4d757ce640e9e37c5b61bb1962f31",Article,Scopus,2-s2.0-0030748507
"Grabov, A., Leung, J., Giraudat, J., Blatt, M.R.","Alteration of anion channel kinetics in wild-type and abi1-1 transgenic Nicotiana benthamiana guard cells by abscisic acid",1997,"Plant Journal","12","1",,"203","213",,87,,"http://www.scopus.com/inward/record.url?eid=2-s2.0-0031194196&partnerID=40&md5=e15f7f38af36ad778bd88b7cae7fc999",Article,Scopus,2-s2.0-0031194196
"Blatt, M.R., Grabov, A.","Signalling gates in abscisic acid-mediated control of guard cell ion channels",1997,"Physiologia Plantarum","100","3",,"481","490",,45,10.1034/j.1399-3054.1997.1000309.x,"http://www.scopus.com/inward/record.url?eid=2-s2.0-0030746417&partnerID=40&md5=7d5ade3baa090665a3d35ac1b110e1b6",Article,Scopus,2-s2.0-0030746417
"Vergani, P., Miosga, T., Jarvis, S.M., Blatt, M.R.","Extracellular K+ and Ba2+ mediate voltage-dependent inactivation of the outward-rectifying K+ channel encoded by the yeast gene TOK1",1997,"FEBS Letters","405","3",,"337","344",,28,10.1016/S0014-5793(97)00211-1,"http://www.scopus.com/inward/record.url?eid=2-s2.0-0030615322&partnerID=40&md5=491ee75bd5c814aa6e32f27c8807ab46",Article,Scopus,2-s2.0-0030615322
"Blatt, M.R., Grabov, A.","Signal redundancy, gates and integration in the control of ion channels for stomatal movement",1997,"Journal of Experimental Botany","48","SPEC. ISS.",,"529","537",,21,,"http://www.scopus.com/inward/record.url?eid=2-s2.0-0030926479&partnerID=40&md5=b0a874574c2e541c0dd5b7430442b127",Conference Paper,Scopus,2-s2.0-0030926479
"Claussen, M., Lüthen, H., Blatt, M., Böttger, M.","Auxin-induced growth and its linkage to potassium channels",1997,"Planta","201","2",,"227","234",,74,,"http://www.scopus.com/inward/record.url?eid=2-s2.0-0030976715&partnerID=40&md5=7b1255079e77b54302682181cb51cb49",Article,Scopus,2-s2.0-0030976715
"Grabov, A., Blatt, M.R.","Parallel control of the inward-rectifier K+ channel by cytosolic free Ca2+ and pH Vicia guard cells",1997,"Planta","201","1",,"84","95",,115,,"http://www.scopus.com/inward/record.url?eid=2-s2.0-0031032038&partnerID=40&md5=6b2cd052366c8440f58d6afe0d2294f1",Article,Scopus,2-s2.0-0031032038
"Brearley, J., Venis, M.A., Blatt, M.R.","The effect of elevated CO2 concentrations on K+ and anion channels of Vicia faba L. guard cells",1997,"Planta","203","2",,"145","154",,54,10.1007/s004250050176,"http://www.scopus.com/inward/record.url?eid=2-s2.0-0030678498&partnerID=40&md5=f9721a7406040965277fbb4b82e8f486",Article,Scopus,2-s2.0-0030678498
"Butt, A.D., Blatt, M.R., Ainsworth, C.C.","Expression, evolution and genomic complexity of potassium ion channel genes of Arabidopsis thaliana",1997,"Journal of Plant Physiology","150","6",,"652","660",,16,,"http://www.scopus.com/inward/record.url?eid=2-s2.0-0030852257&partnerID=40&md5=48b7c20828a34173037f3214126f4b78",Article,Scopus,2-s2.0-0030852257
"Armstrong, F., Leung, J., Grabov, A., Brearley, J., Giraudat, J., Blatt, M.R.","Sensitivity to abscisic acid of guard-cell K+ channels is suppressed by abi1-1, a mutant Arabidopsis gene encoding a putative protein phosphatase",1995,"Proceedings of the National Academy of Sciences of the United States of America","92","21",,"9520","9524",,167,10.1073/pnas.92.21.9520,"http://www.scopus.com/inward/record.url?eid=2-s2.0-0028809852&partnerID=40&md5=4ef17df808e8485bcadf6e6c9cbc0ace",Article,Scopus,2-s2.0-0028809852
"Armstrong, F., Blatt, M.R.","Evidence for K+ channel control in Vicia guard cells coupled by G-proteins to a 7TMS receptor mimetic",1995,"Plant Journal","8","2",,"187","198",,66,,"http://www.scopus.com/inward/record.url?eid=2-s2.0-0028816607&partnerID=40&md5=ac974a34cfa17e3049552beddd7eaf08",Article,Scopus,2-s2.0-0028816607
"Meharg, A.A., Blatt, M.R.","NO3 - transport across the plasma membrane of Arabidopsis thaliana root hairs: Kinetic control by pH and membrane voltage",1995,"The Journal of Membrane Biology","145","1",,"49","66",,70,10.1007/BF00233306,"http://www.scopus.com/inward/record.url?eid=2-s2.0-0028978065&partnerID=40&md5=96590e507fa7e81c5640df3d59dc57b9",Article,Scopus,2-s2.0-0028978065
"Obermeyer, G., Blatt, M.R.","Electrical properties of intact pollen grains of Lilium longiflorum: Characteristics of the non-germinating pollen grain",1995,"Journal of Experimental Botany","46","288",,"803","813",,36,,"http://www.scopus.com/inward/record.url?eid=2-s2.0-0028878294&partnerID=40&md5=a014df3e976e849f2a316a630a59e247",Article,Scopus,2-s2.0-0028878294
"Fricker, M.D., White, N.S., Thiel, G., Millner, P., Blatt, M.R.","Peptides derived from the auxin binding protein elevate Ca2+ and pH in stomatal guard cells of Vicia faba: a confocal fluorescence ratio imaging study.",1994,"Symposia of the Society for Experimental Biology","48",,,"215","228",,6,,"http://www.scopus.com/inward/record.url?eid=2-s2.0-0028715661&partnerID=40&md5=4ebe3489cd99c118c6cce117b4db7dc5",Article,Scopus,2-s2.0-0028715661
"Blatt, M.R., Thiel, G.","K+ channels of stomatal guard cells: Bimodal control of the K+ inward-rectifier evoked by auxin",1994,"Plant Journal","5","1",,"55","68",,113,,"http://www.scopus.com/inward/record.url?eid=2-s2.0-0028035825&partnerID=40&md5=fc5c60d22c7462b36db3f8d965a9d404",Article,Scopus,2-s2.0-0028035825
"Thiel, G., Blatt, M.R.","Phosphatase antagonist okadaic acid inhibits steady-state K+ currents in guard cells of Vicia faba",1994,"Plant Journal","5","5",,"727","733",,60,,"http://www.scopus.com/inward/record.url?eid=2-s2.0-0028119816&partnerID=40&md5=2e29233029836b6a861a3cae09bd58de",Article,Scopus,2-s2.0-0028119816
"Millner, P.A., White, I.R., Groarke, D.A., Theil, G., Blatt, M.R.","Novel strategies to an auxin-evoked transport control.",1994,"Symposia of the Society for Experimental Biology","48",,,"203","213",,2,,"http://www.scopus.com/inward/record.url?eid=2-s2.0-0028716597&partnerID=40&md5=cd1fc97c540d077d36ce5e98699e99fb",Review,Scopus,2-s2.0-0028716597
"Obermeyer, G., Armstrong, F., Blatt, M.R.","Selective block by α-dendrotoxin of the K+ inward rectifier at the Vicia guard cell plasma membrane",1994,"The Journal of Membrane Biology","137","3",,"249","259",,10,10.1007/BF00232593,"http://www.scopus.com/inward/record.url?eid=2-s2.0-0028174510&partnerID=40&md5=86d8696a1c843edf1c6a23db94e7438d",Article,Scopus,2-s2.0-0028174510
"Meharg, A.A., Maurousset, L., Blatt, M.R.","Cable correction of membrane currents recorded from root hairs of Arabidopsis thaliana L.",1994,"Journal of Experimental Botany","45","1",,"1","6",,24,10.1093/jxb/45.1.1,"http://www.scopus.com/inward/record.url?eid=2-s2.0-0027975818&partnerID=40&md5=f4378e2532832191bcae567153d91562",Article,Scopus,2-s2.0-0027975818
"Thiel, G., Blatt, M.R., Fricker, M.D., White, I.R., Millner, P.","Modulation of K+ channels in Vicia stomatal guard cells by peptide homologs to the auxin-binding protein C terminus",1993,"Proceedings of the National Academy of Sciences of the United States of America","90","24",,"11493","11497",,108,,"http://www.scopus.com/inward/record.url?eid=2-s2.0-0027138233&partnerID=40&md5=c7b8ee83e558fabf31009dee698a7d8f",Article,Scopus,2-s2.0-0027138233
"Gradmann, D., Blatt, M.R., Thiel, G.","Electrocoupling of ion transporters in plants",1993,"The Journal of Membrane Biology","136","3",,"327","332",,69,10.1007/BF00233671,"http://www.scopus.com/inward/record.url?eid=2-s2.0-0027138857&partnerID=40&md5=bf2cba7107b3baa39d37572bef4689f3",Article,Scopus,2-s2.0-0027138857
"Blatt, M.R., Thiel, G.","Hormonal control of ion channel gating",1993,"Annual Review of Plant Physiology and Plant Molecular Biology","44","1",,"543","567",,99,,"http://www.scopus.com/inward/record.url?eid=2-s2.0-0000750091&partnerID=40&md5=e87f2d11ebeae1c1a5805fcad156b87e",Article,Scopus,2-s2.0-0000750091
"Blatt, M.R., Armstrong, F.","K+ channels of stomatal guard cells: Abscisic-acid-evoked control of the outward rectifier mediated by cytoplasmic pH",1993,"Planta","191","3",,"330","341",,196,10.1007/BF00195690,"http://www.scopus.com/inward/record.url?eid=2-s2.0-0000203805&partnerID=40&md5=4cea6e5d1a449947ce6939e52c2abeb7",Article,Scopus,2-s2.0-0000203805
"Blatt, M.R.","K+ channels of stomatal guard cells: Characteristics of the inward rectifier and its control by pH",1992,"Journal of General Physiology","99","4",,"615","644",,155,,"http://www.scopus.com/inward/record.url?eid=2-s2.0-0026579316&partnerID=40&md5=8d44aea58fa0ce418539bae107323e15",Article,Scopus,2-s2.0-0026579316
"Thiel, G., MacRobbie, E.A.C., Blatt, M.R.","Membrane transport in stomatal guard cells: The importance of voltage control",1992,"The Journal of Membrane Biology","126","1",,"1","18",,120,10.1007/BF00233456,"http://www.scopus.com/inward/record.url?eid=2-s2.0-0026544581&partnerID=40&md5=38ece9040090fc17d64fc497206f17ce",Article,Scopus,2-s2.0-0026544581
"Blatt, M.R.","Ion channel gating in plants: Physiological implications and integration for stomatal function",1991,"The Journal of Membrane Biology","124","2",,"95","112",,59,10.1007/BF01870455,"http://www.scopus.com/inward/record.url?eid=2-s2.0-0026052310&partnerID=40&md5=d8eba5f4d4320abef5f80a6a1920654f",Review,Scopus,2-s2.0-0026052310
"Blatt, M.R., Thiel, G., Trentham, D.R.","Reversible inactivation of K+ channels of Vicia stomatal guard cells following the photolysis of caged inositol 1,4,5-trisphosphate",1990,"Nature","346","6286",,"766","769",,171,,"http://www.scopus.com/inward/record.url?eid=2-s2.0-0025713327&partnerID=40&md5=c1162e924053c56cee9ea4e7cd890f38",Article,Scopus,2-s2.0-0025713327
"Blatt, M.R., Beilby, M.J., Tester, M.","Voltage dependence of the Chara proton pump revealed by current-voltage measurement during rapid metabolic blockade with cyanide",1990,"The Journal of Membrane Biology","114","3",,"205","223",,35,10.1007/BF01869215,"http://www.scopus.com/inward/record.url?eid=2-s2.0-0025240491&partnerID=40&md5=966c042fa7d16d7e9eb5d9c81436fd75",Article,Scopus,2-s2.0-0025240491
"Blatt, M.R.","Potassium channel currents in intact stomatal guard cells: rapid enhancement by abscisic acid",1990,"Planta","180","3",,"445","455",,75,10.1007/BF00198799,"http://www.scopus.com/inward/record.url?eid=2-s2.0-0001375275&partnerID=40&md5=2dfa8fd820dd4597dc32d1176e318d60",Article,Scopus,2-s2.0-0001375275
"Blatt, M.R., Clint, G.M.","Mechanisms of fusicoccin action: kinetic modification and inactivation of K+ channels in guard cells",1989,"Planta","178","4",,"509","523",,40,10.1007/BF00963821,"http://www.scopus.com/inward/record.url?eid=2-s2.0-0000909378&partnerID=40&md5=25508954a4632e5a2bdb50f7c5a71442",Article,Scopus,2-s2.0-0000909378
"Clint, G.M., Blatt, M.R.","Mechanisms of fusicoccin action: evidence for concerted modulations of secondary K+ transport in a higher plant cell",1989,"Planta","178","4",,"495","508",,32,10.1007/BF00963820,"http://www.scopus.com/inward/record.url?eid=2-s2.0-0000909379&partnerID=40&md5=1ac73aa22c434472e89ba7facaee5e73",Article,Scopus,2-s2.0-0000909379
"Knowles, B.H., Blatt, M.R., Tester, M., Horsnell, J.M., Carroll, J., Menestrina, G., Ellar, D.J.","A cytolytic δ-endotoxin from Bacillus thuringiensis var. israelensis forms cation-selective channels in planar lipid bilayers",1989,"FEBS Letters","244","2",,"259","262",,77,10.1016/0014-5793(89)80540-X,"http://www.scopus.com/inward/record.url?eid=2-s2.0-0024595787&partnerID=40&md5=c6fa152042946dcceded433cbacf9a35",Article,Scopus,2-s2.0-0024595787
"Blatt, M.R.","Potassium-dependent, bipolar gating of K+ channels in guard cells",1988,"The Journal of Membrane Biology","102","3",,"235","246",,75,10.1007/BF01925717,"http://www.scopus.com/inward/record.url?eid=2-s2.0-0023934786&partnerID=40&md5=5fbab24f45f27168f85d84a183cd38b2",Article,Scopus,2-s2.0-0023934786
"Blatt, M.R.","Mechanisms of fusicoccin action: A dominant role for secondary transport in a higher-plant cell",1988,"Planta","174","2",,"187","200",,25,10.1007/BF00394771,"http://www.scopus.com/inward/record.url?eid=2-s2.0-0003121790&partnerID=40&md5=2d3739f577ec7adb574881e99be0c6e3",Article,Scopus,2-s2.0-0003121790
"Blatt, M.R.","Electrical characteristics of stomatal guard cells: The contribution of ATP-dependent, ""Electrogenic"" transport revealed by current-voltage and difference-current-voltage analysis",1987,"The Journal of Membrane Biology","98","3",,"257","274",,68,10.1007/BF01871188,"http://www.scopus.com/inward/record.url?eid=2-s2.0-0001134834&partnerID=40&md5=e0529ddb18686591145bb233248b13c2",Article,Scopus,2-s2.0-0001134834
"Blatt, M.R., Rodriguez-Navarro, A., Slayman, C.L.","Potassium-proton symport in Neurospora: kinetic control by pH and membrane potential",1987,"The Journal of Membrane Biology","98","2",,"169","189",,62,10.1007/BF01872129,"http://www.scopus.com/inward/record.url?eid=2-s2.0-0023078709&partnerID=40&md5=6428ae1d27dab04f44684da4eabb6f47",Article,Scopus,2-s2.0-0023078709
"Blatt, M.R., Slayman, C.L.","Role of ""active"" potassium transport in the regulation of cytoplasmic pH by nonanimal cells.",1987,"Proceedings of the National Academy of Sciences of the United States of America","84","9",,"2737","2741",,47,,"http://www.scopus.com/inward/record.url?eid=2-s2.0-0023333894&partnerID=40&md5=07616f3702316a82de32d0251e97dd24",Article,Scopus,2-s2.0-0023333894
"Blatt, M.R.","Electrical characteristics of stomatal guard cells: The ionic basis of the membrane potential and the consequence of potassium chlorides leakage from microelectrodes",1987,"Planta","170","2",,"272","287",,51,10.1007/BF00397898,"http://www.scopus.com/inward/record.url?eid=2-s2.0-0001509265&partnerID=40&md5=c602eb11bf3a0529b87ae6c7c235d2b1",Article,Scopus,2-s2.0-0001509265
"Blatt, M.R.","Interpretation of steady-state current-voltage curves: Consequences and implications of current subtraction in transport studies",1986,"The Journal of Membrane Biology","92","1",,"91","110",,18,10.1007/BF01869018,"http://www.scopus.com/inward/record.url?eid=2-s2.0-0022447454&partnerID=40&md5=51ee40144141fcadc28db6cd577e6579",Article,Scopus,2-s2.0-0022447454
"Rodriguez-Navarro, A., Blatt, M.R., Slayman, C.L.","A potassium-proton symport in Neurospora crassa",1986,"Journal of General Physiology","87","5",,"649","674",,95,,"http://www.scopus.com/inward/record.url?eid=2-s2.0-0022467755&partnerID=40&md5=9d788ada814b7351ef5ce93252beca05",Article,Scopus,2-s2.0-0022467755
"Blatt, M.R.","Extracellular potassium activity in attached leaves and its relation to stomatal function",1985,"Journal of Experimental Botany","36","2",,"240","251",,21,10.1093/jxb/36.2.240,"http://www.scopus.com/inward/record.url?eid=2-s2.0-0000360578&partnerID=40&md5=58e75a47b9a646bf393ba26939f4ce69",Article,Scopus,2-s2.0-0000360578
