Authors,Title,Year,Source title,Volume,Issue,Art. No.,Page start,Page end,Page count,Cited by,DOI,Link,Document Type,Source,EID
"Zhang, Y., Ding, Z., Ma, F., Chauhan, R.D., Allen, D.K., Brutnell, T.P., Wang, W., Peng, M., Li, P.","Transcriptional response to petiole heat girdling in cassava",2015,"Scientific Reports","5",,,"8414","",,,10.1038/srep08414,"http://www.scopus.com/inward/record.url?eid=2-s2.0-84923036767&partnerID=40&md5=ba5c3781c4b587973b4ed571d07bdb08",Article,Scopus,2-s2.0-84923036767
"Fahlgren, N., Feldman, M., Gehan, M.A., Wilson, M.S., Shyu, C., Bryant, D.W., Hill, S.T., McEntee, C.J., Warnasooriya, S.N., Kumar, I., Ficor, T., Turnipseed, S., Gilbert, K.B., Brutnell, T.P., Carrington, J.C., Mockler, T.C., Baxter, I.","A versatile phenotyping system and analytics platform reveals diverse temporal responses to water availability in Setaria",2015,"Molecular Plant","8","10",,"1520","1535",,,10.1016/j.molp.2015.06.005,"http://www.scopus.com/inward/record.url?eid=2-s2.0-84943450041&partnerID=40&md5=88ee6dde3c4996dcf0160342fff332b2",Article,Scopus,2-s2.0-84943450041
"Patron, N.J., Orzaez, D., Marillonnet, S., Warzecha, H., Matthewman, C., Youles, M., Raitskin, O., Leveau, A., Farré, G., Rogers, C., Smith, A., Hibberd, J., Webb, A.A.R., Locke, J., Schornack, S., Ajioka, J., Baulcombe, D.C., Zipfel, C., Kamoun, S., Jones, J.D.G., Kuhn, H., Robatzek, S., Van Esse, H.P., Sanders, D., Oldroyd, G., Martin, C., Field, R., O'Connor, S., Fox, S., Wulff, B., Miller, B., Breakspear, A., Radhakrishnan, G., Delaux, P.-M., Loqué, D., Granell, A., Tissier, A., Shih, P., Brutnell, T.P., Quick, W.P., Rischer, H., Fraser, P.D., Aharoni, A., Raines, C., South, P.F., Ané, J.-M., Hamberger, B.R., Langdale, J., Stougaard, J., Bouwmeester, H., Udvardi, M., Murray, J.A.H., Ntoukakis, V., Schäfer, P., Denby, K., Edwards, K.J., Osbourn, A., Haseloff, J.","Standards for plant synthetic biology: A common syntax for exchange of DNA parts",2015,"New Phytologist","208","1",,"13","19",,,10.1111/nph.13532,"http://www.scopus.com/inward/record.url?eid=2-s2.0-84939807175&partnerID=40&md5=59fe7af03bede43344832739140e37b0",Article,Scopus,2-s2.0-84939807175
"Shyu, C., Brutnell, T.P.","Growth-defence balance in grass biomass production: The role of jasmonates",2015,"Journal of Experimental Botany","66","14",,"4165","4176",,2,10.1093/jxb/erv011,"http://www.scopus.com/inward/record.url?eid=2-s2.0-84938427236&partnerID=40&md5=2276a1ecadc323e0ba16f68275a31ab7",Review,Scopus,2-s2.0-84938427236
"Zhang, N., Gibon, Y., Wallace, J.G., Lepak, N., Li, P., Dedow, L., Chen, C., So, Y.-S., Kremling, K., Bradbury, P.J., Brutnell, T., Stitt, M., Buckler, E.S.","Genome-wide association of carbon and nitrogen metabolism in the maize nested association mapping population",2015,"Plant Physiology","168","2",,"575","583",,2,10.1104/pp.15.00025,"http://www.scopus.com/inward/record.url?eid=2-s2.0-84933038004&partnerID=40&md5=96dd2ce8dbe302defca3791a893a82d9",Article,Scopus,2-s2.0-84933038004
"Brutnell, T.P., Bennetzen, J.L., Vogel, J.P.","Brachypodium distachyon and Setaria viridis: Model Genetic Systems for the Grasses",2015,"Annual Review of Plant Biology","66",,,"465","485",,,10.1146/annurev-arplant-042811-105528,"http://www.scopus.com/inward/record.url?eid=2-s2.0-84928893009&partnerID=40&md5=3f0fc8ee11d51676255924b01bc90011",Article,Scopus,2-s2.0-84928893009
"Si, Y., Liu, P., Li, P., Brutnell, T.P.","Model-based clustering for RNA-seq data",2014,"Bioinformatics","30","2",,"197","205",,8,10.1093/bioinformatics/btt632,"http://www.scopus.com/inward/record.url?eid=2-s2.0-84892683120&partnerID=40&md5=2929e3b9bdb7c6fb5094c351b60b99c2",Article,Scopus,2-s2.0-84892683120
"O'Connor, S.E., Brutnell, T.P.","Editorial overview: Growing the future: Synthetic biology in plants",2014,"Current Opinion in Plant Biology","19",,,"iv","v",,2,10.1016/j.pbi.2014.05.005,"http://www.scopus.com/inward/record.url?eid=2-s2.0-84902545744&partnerID=40&md5=30f672a6786d79d29a5001516656e743",Editorial,Scopus,2-s2.0-84902545744
"Lori Tausta, S., Li, P., Si, Y., Gandotra, N., Liu, P., Sun, Q., Brutnell, T.P., Nelson, T.","Developmental dynamics of Kranz cell transcriptional specificity in maize leaf reveals early onset of C<inf>4</inf>-related processes",2014,"Journal of Experimental Botany","65","13",,"3543","3555",,7,10.1093/jxb/eru152,"http://www.scopus.com/inward/record.url?eid=2-s2.0-84908143081&partnerID=40&md5=3c858ff289b24f86d998219ed83b8852",Article,Scopus,2-s2.0-84908143081
"Mertz, R.A., Brutnell, T.P.","Bundle sheath suberization in grass leaves: Multiple barriers to characterization",2014,"Journal of Experimental Botany","65","13",,"3371","3380",,5,10.1093/jxb/eru108,"http://www.scopus.com/inward/record.url?eid=2-s2.0-84911376257&partnerID=40&md5=5116948a88c4013a1960e48e41aace24",Review,Scopus,2-s2.0-84911376257
"Warnasooriya, S.N., Brutnell, T.P.","Enhancing the productivity of grasses under high-density planting by engineering light responses: From model systems to feedstocks",2014,"Journal of Experimental Botany","65","11",,"2825","2834",,2,10.1093/jxb/eru221,"http://www.scopus.com/inward/record.url?eid=2-s2.0-84902491299&partnerID=40&md5=474148e839db8f62053ddaa067b2ff2c",Review,Scopus,2-s2.0-84902491299
"Studer, A.J., Gandin, A., Kolbe, A.R., Wang, L., Cousins, A.B., Brutnell, T.P.","A limited role for carbonic anhydrase in C4 photosynthesis as revealed by a ca1ca2 double mutant in maize",2014,"Plant Physiology","165","2",,"608","617",,4,10.1104/pp.114.237602,"http://www.scopus.com/inward/record.url?eid=2-s2.0-84901767194&partnerID=40&md5=96ef11ff6fdf69e18ea9a07484c0b3e0",Article,Scopus,2-s2.0-84901767194
"Jiang, H., Barbier, H., Brutnell, T.","Methods for performing crosses in Setaria viridis, a new model system for the grasses.",2013,"Journal of visualized experiments : JoVE",,"80",,"","",,,,"http://www.scopus.com/inward/record.url?eid=2-s2.0-84899037837&partnerID=40&md5=d111fbdf276d48b1ca96c60aaceeeb46",Article,Scopus,2-s2.0-84899037837
"Petti, C., Shearer, A., Tateno, M., Ruwaya, M., Nokes, S., Brutnell, T., DeBolt, S.","Comparative feedstock analysis in Setaria viridis L. as a model for C4 bioenergy grasses and panicoid crop species",2013,"Frontiers in Plant Science","4","JUN", 181,"","",,5,10.3389/fpls.2013.00181,"http://www.scopus.com/inward/record.url?eid=2-s2.0-84900856677&partnerID=40&md5=f648abe7d3d69f0d9ff4f6574a493ff9",Article,Scopus,2-s2.0-84900856677
"Mauro-Herrera, M., Wang, X., Barbier, H., Brutnell, T.P., Devos, K.M., Doust, A.N.","Genetic control and comparative genomic analysis of flowering time in Setaria (Poaceae).",2013,"G3 (Bethesda, Md.)","3","2",,"283","295",,1,10.1534/g3.112.005207,"http://www.scopus.com/inward/record.url?eid=2-s2.0-84881409144&partnerID=40&md5=f9eb8f640a490929d86172fa01eb0be4",Article,Scopus,2-s2.0-84881409144
"Mauro-Herrera, M., Wang, X., Barbier, H., Brutnell, T.P., Devos, K.M., Doust, A.N.","Genetic control and comparative genomic analysis of flowering time in Setaria (Poaceae)",2013,"G3: Genes, Genomes, Genetics","3","2",,"283","295",,12,10.1534/g3.112.005207,"http://www.scopus.com/inward/record.url?eid=2-s2.0-84883180760&partnerID=40&md5=e668a43e08facbfe9e6e3988262884c2",Article,Scopus,2-s2.0-84883180760
"Jiang, H., Barbier, H., Brutnell, T.","Methods for performing crosses in Setaria viridis, a new model system for the grasses",2013,"Journal of visualized experiments : JoVE",,"80",,"","",,2,10.3791/50527,"http://www.scopus.com/inward/record.url?eid=2-s2.0-84899687594&partnerID=40&md5=35b9afb45c36744a3c941da5fe2d2a9d",Article,Scopus,2-s2.0-84899687594
"Weissmann, S., Brutnell, T.P.","Engineering C 4 photosynthetic regulatory networks",2012,"Current Opinion in Biotechnology","23","3",,"298","304",,10,10.1016/j.copbio.2011.12.018,"http://www.scopus.com/inward/record.url?eid=2-s2.0-84861988565&partnerID=40&md5=490e0610db18b9f966ac316d6e354705",Review,Scopus,2-s2.0-84861988565
"Brutnell, T., Frommer, W.B.","Foods for thought",2012,"Scientist","26","6",,"","",,,,"http://www.scopus.com/inward/record.url?eid=2-s2.0-84867561993&partnerID=40&md5=a4deb20180ec563af2268b469336f622",Article,Scopus,2-s2.0-84867561993
"Bennetzen, J.L., Schmutz, J., Wang, H., Percifield, R., Hawkins, J., Pontaroli, A.C., Estep, M., Feng, L., Vaughn, J.N., Grimwood, J., Jenkins, J., Barry, K., Lindquist, E., Hellsten, U., Deshpande, S., Wang, X., Wu, X., Mitros, T., Triplett, J., Yang, X., Ye, C.-Y., Mauro-Herrera, M., Wang, L., Li, P., Sharma, M., Sharma, R., Ronald, P.C., Panaud, O., Kellogg, E.A., Brutnell, T.P., Doust, A.N., Tuskan, G.A., Rokhsar, D., Devos, K.M.","Reference genome sequence of the model plant Setaria",2012,"Nature Biotechnology","30","6",,"555","561",,136,10.1038/nbt.2196,"http://www.scopus.com/inward/record.url?eid=2-s2.0-84862018035&partnerID=40&md5=bfae6e96a764b84fcf3dadadb44beb30",Article,Scopus,2-s2.0-84862018035
"Wang, L., Si, Y., Dedow, L.K., Shao, Y., Liu, P., Brutnell, T.P.","A low-cost library construction protocol and data analysis pipeline for illumina-based strand-specific multiplex RNA-seq",2011,"PLoS ONE","6","10", e26426,"","",,35,10.1371/journal.pone.0026426,"http://www.scopus.com/inward/record.url?eid=2-s2.0-80054789260&partnerID=40&md5=934c93a14188eecd8f7827a20bb3567a",Article,Scopus,2-s2.0-80054789260
"Brkljacic, J., Grotewold, E., Scholl, R., Mockler, T., Garvin, D.F., Vain, P., Brutnell, T., Sibout, R., Bevan, M., Budak, H., Caicedo, A.L., Gao, C., Gu, Y., Hazen, S.P., Holt, B.F., Hong, S.-Y., Jordan, M., Manzaneda, A.J., Mitchell-Olds, T., Mochida, K., Mur, L.A.J., Park, C.-M., Sedbrook, J., Watt, M., Zheng, S.J., Vogel, J.P.","Brachypodium as a model for the grasses: Today and the future",2011,"Plant Physiology","157","1",,"3","13",,79,10.1104/pp.111.179531,"http://www.scopus.com/inward/record.url?eid=2-s2.0-80052419753&partnerID=40&md5=e4987f22dd029da821d3aa274b15ff60",Article,Scopus,2-s2.0-80052419753
"Whipple, C.J., Kebrom, T.H., Weber, A.L., Yang, F., Hall, D., Meeley, R., Schmidt, R., Doebley, J., Brutnell, T.P., Jackson, D.P.","Grassy tillers1 promotes apical dominance in maize and responds to Shade signals in the grasses",2011,"Proceedings of the National Academy of Sciences of the United States of America","108","33",,"E506","E512",,31,10.1073/pnas.1102819108,"http://www.scopus.com/inward/record.url?eid=2-s2.0-80051958470&partnerID=40&md5=9a63b3a6d958fa99d900f621991fd5df",Article,Scopus,2-s2.0-80051958470
"Goff, S.A., Vaughn, M., McKay, S., Lyons, E., Stapleton, A.E., Gessler, D., Matasci, N., Wang, L., Hanlon, M., Lenards, A., Muir, A., Merchant, N., Lowry, S., Mock, S., Helmke, M., Kubach, A., Narro, M., Hopkins, N., Micklos, D., Hilgert, U., Gonzales, M., Jordan, C., Skidmore, E., Dooley, R., Cazes, J., McLay, R., Lu, Z., Pasternak, S., Koesterke, L., Piel, W.H., Grene, R., Noutsos, C., Gendler, K., Feng, X., Tang, C., Lent, M., Kim, S.-J., Kvilekval, K., Manjunath, B.S., Tannen, V., Stamatakis, A., Sanderson, M., Welch, S.M., Cranston, K.A., Soltis, P., Soltis, D., O'Meara, B., Ane, C., Brutnell, T., Kleibenstein, D.J., White, J.W., Leebens-Mack, J., Donoghue, M.J., Spalding, E.P., Vision, T.J., Myers, C.R., Lowenthal, D., Enquist, B.J., Boyle, B., Akoglu, A., Andrews, G., Ram, S., Ware, D., Stein, L., Stanzione, D.","The iPlant collaborative: Cyberinfrastructure for plant biology",2011,"Frontiers in Plant Science","2","JUL", 34,"","",,92,10.3389/fpls.2011.00034,"http://www.scopus.com/inward/record.url?eid=2-s2.0-84858593012&partnerID=40&md5=1e6e16f7254041f6659ddce2a66de17b",Article,Scopus,2-s2.0-84858593012
"Sharma, M., Cortes-Cruz, M., Ahern, K.R., McMullen, M., Brutnell, T.P., Chopra, S.","Identification of the Pr1 Gene Product Completes the Anthocyanin Biosynthesis Pathway of Maize",2011,"Genetics","188","1",,"69","79",,15,10.1534/genetics.110.126136,"http://www.scopus.com/inward/record.url?eid=2-s2.0-79955935217&partnerID=40&md5=9f47de1a36af4a5cba4556c08e5f2dc0",Article,Scopus,2-s2.0-79955935217
"Li, P., Brutnell, T.P.","Setaria viridis and Setaria italica, model genetic systems for the Panicoid grasses",2011,"Journal of Experimental Botany","62","9",,"3031","3037",,48,10.1093/jxb/err096,"http://www.scopus.com/inward/record.url?eid=2-s2.0-79958774172&partnerID=40&md5=350f9bc2ef4f5d2b82f24a24390c01ad",Review,Scopus,2-s2.0-79958774172
"Dubois, P.G., Brutnell, T.P.","Topology of a maize field: Distinguishing the influence of end-of-day far-red light and shade avoidance syndrome on plant height",2011,"Plant Signaling and Behavior","6","4",,"467","470",,1,10.4161/psb.6.4.14305,"http://www.scopus.com/inward/record.url?eid=2-s2.0-79955587978&partnerID=40&md5=1024fdc25dfd0c6af00273c47762b3cf",Article,Scopus,2-s2.0-79955587978
"Wang, L., Peterson, R.B., Brutnell, T.P.","Regulatory mechanisms underlying C4 photosynthesis",2011,"New Phytologist","190","1",,"9","20",,14,10.1111/j.1469-8137.2011.03649.x,"http://www.scopus.com/inward/record.url?eid=2-s2.0-79951986028&partnerID=40&md5=6aa5e254e416af64d649dfee6487d88b",Review,Scopus,2-s2.0-79951986028
"Bai, L., Brutnell, T.P.","The Activator/Dissociation transposable elements comprise a two-component gene regulatory switch that controls endogenous gene expression in maize",2011,"Genetics","187","3",,"749","759",,1,10.1534/genetics.110.124149,"http://www.scopus.com/inward/record.url?eid=2-s2.0-79953218383&partnerID=40&md5=a8185d2b32c72fecf8f0db778a6d0b6c",Article,Scopus,2-s2.0-79953218383
"Li, P., Ponnala, L., Gandotra, N., Wang, L., Si, Y., Tausta, S.L., Kebrom, T.H., Provart, N., Patel, R., Myers, C.R., Reidel, E.J., Turgeon, R., Liu, P., Sun, Q., Nelson, T., Brutnell, T.P.","The developmental dynamics of the maize leaf transcriptome",2010,"Nature Genetics","42","12",,"1060","1067",,245,10.1038/ng.703,"http://www.scopus.com/inward/record.url?eid=2-s2.0-78649488563&partnerID=40&md5=409c94edf251e6a72773e0ccde902b45",Article,Scopus,2-s2.0-78649488563
"Dubois, P.G., Olsefski, G.T., Flint-Garcia, S., Setter, T.L., Hoekenga, O.A., Brutnell, T.P.","Physiological and genetic characterization of end-of-day far-red light response in maize seedlings",2010,"Plant Physiology","154","1",,"173","186",,11,10.1104/pp.110.159830,"http://www.scopus.com/inward/record.url?eid=2-s2.0-77956687916&partnerID=40&md5=ff7dd7fcc6909e89e516d74f37f215f2",Article,Scopus,2-s2.0-77956687916
"Vollbrecht, E., Duvick, J., Schares, J.P., Ahern, K.R., Deewatthanawong, P., Xu, L., Conrad, L.J., Kikuchi, K., Kubinec, T.A., Hall, B.D., Weeks, R., Unger-Wallace, E., Muszynski, M., Brendel, V.P., Brutnell, T.P.","Genome-wide distribution of transposed Dissociation elements in maize",2010,"Plant Cell","22","6",,"1667","1685",,42,10.1105/tpc.109.073452,"http://www.scopus.com/inward/record.url?eid=2-s2.0-77955884311&partnerID=40&md5=b0df3a406f6fe2a67135266fbb36f202",Article,Scopus,2-s2.0-77955884311
"Kebrom, T.H., Brutnell, T.P., Hays, D.B., Finlayson, S.A.","Vegetative axillary bud dormancy induced by shade and defoliation signals in the grasses",2010,"Plant Signaling and Behavior","5","3",,"317","319",,7,10.4161/psb.5.3.11186,"http://www.scopus.com/inward/record.url?eid=2-s2.0-77955006426&partnerID=40&md5=d426b26340e9a1b9dccfd1ccdb5df978",Article,Scopus,2-s2.0-77955006426
"Brutnell, T.P., Wang, L., Swartwood, K., Goldschmidt, A., Jackson, D., Zhu, X.-G., Kellogg, E., van Eck, J.","Setaria viridis: A model for C4 photosynthesis",2010,"Plant Cell","22","8",,"2537","2544",,71,10.1105/tpc.110.075309,"http://www.scopus.com/inward/record.url?eid=2-s2.0-77957767706&partnerID=40&md5=388836b6ab24e009e0876dd0f0388ea2",Article,Scopus,2-s2.0-77957767706
"Yan, J., Kandianis, C.B., Harjes, C.E., Bai, L., Kim, E.-H., Yang, X., Skinner, D.J., Fu, Z., Mitchell, S., Li, Q., Fernandez, M.G.S., Zaharieva, M., Babu, R., Fu, Y., Palacios, N., Li, J., Dellapenna, D., Brutnell, T., Buckler, E.S., Warburton, M.L., Rocheford, T.","Rare genetic variation at Zea mays crtRB1 increases Β-carotene in maize grain",2010,"Nature Genetics","42","4",,"322","327",,153,10.1038/ng.551,"http://www.scopus.com/inward/record.url?eid=2-s2.0-77950299027&partnerID=40&md5=f8e112c48dad41aa17f6db91ea8e2496",Article,Scopus,2-s2.0-77950299027
"Vogel, J.P., Garvin, D.F., Mockler, T.C., Schmutz, J., Rokhsar, D., Bevan, M.W., Barry, K., Lucas, S., Harmon-Smith, M., Lail, K., Tice, H., Grimwood, J., McKenzie, N., Huo, N., Gu, Y.Q., Lazo, G.R., Anderson, O.D., You, F.M., Luo, M.-C., Dvorak, J., Wright, J., Febrer, M., Idziak, D., Hasterok, R., Lindquist, E., Wang, M., Fox, S.E., Priest, H.D., Filichkin, S.A., Givan, S.A., Bryant, D.W., Chang, J.H., Wu, H., Wu, W., Hsia, A.-P., Schnable, P.S., Kalyanaraman, A., Barbazuk, B., Michael, T.P., Hazen, S.P., Bragg, J.N., Laudencia-Chingcuanco, D., Weng, Y., Haberer, G., Spannagl, M., Mayer, K., Rattei, T., Mitros, T., Lee, S.-J., Rose, J.K.C., Mueller, L.A., York, T.L., Wicker, T., Buchmann, J.P., Tanskanen, J., Schulman, A.H., Gundlach, H., Beven, M., Costa De Oliveira, A., Da C. Maia, L., Belknap, W., Jiang, N., Lai, J., Zhu, L., Ma, J., Sun, C., Pritham, E., Salse, J., Murat, F., Abrouk, M., Bruggmann, R., Messing, J., Fahlgren, N., Sullivan, C.M., Carrington, J.C., Chapman, E.J., May, G.D., Zhai, J., Ganssmann, M., Gurazada, S.G.R., German, M., Meyers, B.C., Green, P.J., Tyler, L., Wu, J., Thomson, J., Chen, S., Scheller, H.V., Harholt, J., Ulvskov, P., Kimbrel, J.A., Bartley, L.E., Cao, P., Jung, K.-H., Sharma, M.K., Vega-Sanchez, M., Ronald, P., Dardick, C.D., De Bodt, S., Verelst, W., Inzé, D., Heese, M., Schnittger, A., Yang, X., Kalluri, U.C., Tuskan, G.A., Hua, Z., Vierstra, R.D., Cui, Y., Ouyang, S., Sun, Q., Liu, Z., Yilmaz, A., Grotewold, E., Sibout, R., Hematy, K., Mouille, G., Höfte, H., Micheel, T., Pelloux, J., O'Connor, D., Schnable, J., Rowe, S., Harmon, F., Cass, C.L., Sedbrook, J.C., Byrne, M.E., Walsh, S., Higgins, J., Li, P., Brutnell, T., Unver, T., Budak, H., Belcram, H., Charles, M., Chalhoub, B., Baxter, I.","Genome sequencing and analysis of the model grass Brachypodium distachyon",2010,"Nature","463","7282",,"763","768",,675,10.1038/nature08747,"http://www.scopus.com/inward/record.url?eid=2-s2.0-76749150030&partnerID=40&md5=77e451cd24c7bd5ae8edb8f22686824e",Article,Scopus,2-s2.0-76749150030
"Wang, L., Li, P., Brutnell, T.P.","Exploring plant transcriptomes using ultra high-throughput sequencing",2010,"Briefings in Functional Genomics and Proteomics","9","2", elp057,"118","128",,48,10.1093/bfgp/elp057,"http://www.scopus.com/inward/record.url?eid=2-s2.0-77951998724&partnerID=40&md5=bf9887b69d096f9edba51be27fd91194",Article,Scopus,2-s2.0-77951998724
"Kebrom, T.H., Brutnell, T.P., Finlayson, S.A.","Suppression of sorghum axillary bud outgrowth by shade, phyB and defoliation signalling pathways",2010,"Plant, Cell and Environment","33","1",,"48","58",,31,10.1111/j.1365-3040.2009.02050.x,"http://www.scopus.com/inward/record.url?eid=2-s2.0-72049120953&partnerID=40&md5=34f1f31cab76deb35fde83fbffdc5fff",Article,Scopus,2-s2.0-72049120953
"Schnable, P.S., Ware, D., Fulton, R.S., Stein, J.C., Wei, F., Pasternak, S., Liang, C., Zhang, J., Fulton, L., Graves, T.A., Minx, P., Reily, A.D., Courtney, L., Kruchowski, S.S., Tomlinson, C., Strong, C., Delehaunty, K., Fronick, C., Courtney, B., Rock, S.M., Belter, E., Du, F., Kim, K., Abbott, R.M., Cotton, M., Levy, A., Marchetto, P., Ochoa, K., Jackson, S.M., Gillam, B., Chen, W., Yan, L., Higginbotham, J., Cardenas, M., Waligorski, J., Applebaum, E., Phelps, L., Falcone, J., Kanchi, K., Thane, T., Scimone, A., Thane, N., Henke, J., Wang, T., Ruppert, J., Shah, N., Rotter, K., Hodges, J., Ingenthron, E., Cordes, M., Kohlberg, S., Sgro, J., Delgado, B., Mead, K., Chinwalla, A., Leonard, S., Crouse, K., Collura, K., Kudrna, D., Currie, J., He, R., Angelova, A., Rajasekar, S., Mueller, T., Lomeli, R., Scara, G., Ko, A., Delaney, K., Wissotski, M., Lopez, G., Campos, D., Braidotti, M., Ashley, E., Golser, W., Kim, H., Lee, S., Lin, J., Dujmic, Z., Kim, W., Talag, J., Zuccolo, A., Fan, C., Sebastian, A., Kramer, M., Spiegel, L., Nascimento, L., Zutavern, T., Miller, B., Ambroise, C., Muller, S., Spooner, W., Narechania, A., Ren, L., Wei, S., Kumari, S., Faga, B., Levy, M.J., McMahan, L., Van Buren, P., Vaughn, M.W., Ying, K., Yeh, C.-T., Emrich, S.J., Jia, Y., Kalyanaraman, A., Hsia, A.-P., Barbazuk, W.B., Baucom, R.S., Brutnell, T.P., Carpita, N.C., Chaparro, C., Chia, J.-M., Deragon, J.-M., Estill, J.C., Fu, Y., Jeddeloh, J.A., Han, Y., Lee, H., Li, P., Lisch, D.R., Liu, S., Liu, Z., Nagel, D.H., McCann, M.C., Sanmiguel, P., Myers, A.M., Nettleton, D., Nguyen, J., Penning, B.W., Ponnala, L., Schneider, K.L., Schwartz, D.C., Sharma, A., Soderlund, C., Springer, N.M., Sun, Q., Wang, H., Waterman, M., Westerman, R., Wolfgruber, T.K., Yang, L., Yu, Y., Zhang, L., Zhou, S., Zhu, Q., Bennetzen, J.L., Dawe, R.K., Jiang, J., Jiang, N., Presting, G.G., Wessler, S.R., Aluru, S., Martienssen, R.A., Clifton, S.W., McCombie, W.R., Wing, R.A., Wilson, R.K.","The B73 maize genome: Complexity, diversity, and dynamics",2009,"Science","326","5956",,"1112","1115",,1291,10.1126/science.1178534,"http://www.scopus.com/inward/record.url?eid=2-s2.0-70450202132&partnerID=40&md5=c429257f62279b271a0d03bc9ede1a30",Article,Scopus,2-s2.0-70450202132
"Ahern, K.R., Deewatthanawong, P., Schares, J., Muszynski, M., Weeks, R., Vollbrecht, E., Duvick, J., Brendel, V.P., Brutnell, T.P.","Regional mutagenesis using Dissociation in maize",2009,"Methods","49","3",,"248","254",,21,10.1016/j.ymeth.2009.04.009,"http://www.scopus.com/inward/record.url?eid=2-s2.0-70349758341&partnerID=40&md5=21ba1b49b4b00d44df34d0d305422907",Article,Scopus,2-s2.0-70349758341
"Bai, L., Kim, E.-H., Dellapenna, D., Brutnell, T.P.","Novel lycopene epsilon cyclase activities in maize revealed through perturbation of carotenoid biosynthesis",2009,"Plant Journal","59","4",,"588","599",,36,10.1111/j.1365-313X.2009.03899.x,"http://www.scopus.com/inward/record.url?eid=2-s2.0-68849123385&partnerID=40&md5=ef1cb96320b65bec4cb9877a8b593311",Article,Scopus,2-s2.0-68849123385
"Zelitch, I., Schultes, N.P., Peterson, R.B., Brown, P., Brutnell, T.P.","High glycolate oxidase activity is required for survival of maize in normal air",2009,"Plant Physiology","149","1",,"195","204",,62,10.1104/pp.108.128439,"http://www.scopus.com/inward/record.url?eid=2-s2.0-58449134896&partnerID=40&md5=950bff48a87816e928c3fae16ced903b",Article,Scopus,2-s2.0-58449134896
"Gray, J., Bevan, M., Brutnell, T., Buell, C.R., Cone, K., Hake, S., Jackson, D., Kellogg, E., Lawrence, C., McCouch, S., Mockler, T., Moose, S., Paterson, A., Peterson, T., Rokshar, D., Souza, G.M., Springer, N., Stein, N., Timmermans, M., Wang, G.-L., Grotewold, E.","A recommendation for naming transcription factor proteins in the grasses",2009,"Plant Physiology","149","1",,"4","6",,19,10.1104/pp.108.128504,"http://www.scopus.com/inward/record.url?eid=2-s2.0-58449136100&partnerID=40&md5=0be0119966dab2971db9bd4a90d49107",Letter,Scopus,2-s2.0-58449136100
"Conrad, L.J., Kikuchi, K., Brutnell, T.P.","Transposon Tagging in Cereal Crops",2008,"The Handbook of Plant Functional Genomics: Concepts and Protocols",,,,"267","290",,,10.1002/9783527622542.ch13,"http://www.scopus.com/inward/record.url?eid=2-s2.0-84889963298&partnerID=40&md5=63a71173d44b0218157821c572756059",Book Chapter,Scopus,2-s2.0-84889963298
"Covshoff, S., Majeran, W., Liu, P., Kolkman, J.M., Van Wijk, K.J., Brutnell, T.P.","Deregulation of maize C4 photosynthetic development in a mesophyll cell-defective mutant",2008,"Plant Physiology","146","4",,"1469","1481",,31,10.1104/pp.107.113423,"http://www.scopus.com/inward/record.url?eid=2-s2.0-48549098736&partnerID=40&md5=1f03d7848173d5a5fb2ab29515cf8e7e",Article,Scopus,2-s2.0-48549098736
"Harjes, C.E., Rocheford, T.R., Bai, L., Brutnell, T.P., Kandianis, C.B., Sowinski, S.G., Stapleton, A.E., Vallabhaneni, R., Williams, M., Wurtzel, E.T., Yan, J., Buckler, E.S.","Natural genetic variation in lycopene epsilon cyclase tapped for maize biofortification",2008,"Science","319","5861",,"330","333",,294,10.1126/science.1150255,"http://www.scopus.com/inward/record.url?eid=2-s2.0-38349114236&partnerID=40&md5=981a4d2c8b358e0cc6b8d862ae0f20eb",Article,Scopus,2-s2.0-38349114236
"Kebrom, T.H., Brutnell, T.P.","The molecular analysis of the shade avoidance syndrome in the grasses has begun",2007,"Journal of Experimental Botany","58","12",,"3079","3089",,33,10.1093/jxb/erm205,"http://www.scopus.com/inward/record.url?eid=2-s2.0-35848938942&partnerID=40&md5=99cfdc19f94eb0d9b98d524da2caddcc",Review,Scopus,2-s2.0-35848938942
"Conrad, L.J., Bai, L., Ahern, K., Dusinberre, K., Kane, D.P., Brutnell, T.P.","State II Dissociation element formation following Activator excision in maize",2007,"Genetics","177","2",,"737","747",,8,10.1534/genetics.107.075770,"http://www.scopus.com/inward/record.url?eid=2-s2.0-35548966573&partnerID=40&md5=fe1836d8bcbc0943175d9b60b9554d17",Article,Scopus,2-s2.0-35548966573
"Qiu, Q.-S., Hardin, S.C., Mace, J., Brutnell, T.P., Huber, S.C.","Light and metabolic signals control the selective degradation of sucrose synthase in maize leaves during deetiolation",2007,"Plant Physiology","144","1",,"468","478",,8,10.1104/pp.106.095182,"http://www.scopus.com/inward/record.url?eid=2-s2.0-34250667871&partnerID=40&md5=536ed667ce07ff5545a17c241428f361",Article,Scopus,2-s2.0-34250667871
"Sawers, R.J.H., Liu, P., Anufrikova, K., Gene, J.T.G., Brutnell, T.P.","A multi-treatment experimental system to examine photosynthetic differentiation in the maize leaf",2007,"BMC Genomics","8",, 12,"","",,40,10.1186/1471-2164-8-12,"http://www.scopus.com/inward/record.url?eid=2-s2.0-33846974709&partnerID=40&md5=8d6c22babc8c1ca89d0ccca4995bc1ed",Article,Scopus,2-s2.0-33846974709
