Authors,Title,Year,Source title,Volume,Issue,Art. No.,Page start,Page end,Page count,Cited by,DOI,Link,Document Type,Source,EID
"Garbers, C., DeLong, A., Deruére, J., Bernasconi, P., Söll, D.","A mutation in protein phosphatase 2A regulatory subunit A affects auxin transport in Arabidopsis",1996,"EMBO Journal","15","9",,"2115","2124",,174,,"http://www.scopus.com/inward/record.url?eid=2-s2.0-0029940505&partnerID=40&md5=6a8be534a09a18fd223bad9f90b9ddb6",Article,Scopus,2-s2.0-0029940505
"DeLong, A., Calderon-Urrea, A., Dellaporta, S.L.","Sex determination gene TASSELSEED2 of maize encodes a short-chain alcohol dehydrogenase required for stage-specific floral organ abortion",1993,"Cell","74","4",,"757","768",,187,10.1016/0092-8674(93)90522-R,"http://www.scopus.com/inward/record.url?eid=2-s2.0-0027268202&partnerID=40&md5=4f0381b58f7e1ccfa2e206b0b9b6143d",Article,Scopus,2-s2.0-0027268202
"Dellaporta, S.L., Moreno, M.A., Delong, A.","Cell lineage analysis of the gynoecium of maize using the transposable element Ac",1991,"Development","112","1 SUPPL.",,"141","147",,10,,"http://www.scopus.com/inward/record.url?eid=2-s2.0-0025824081&partnerID=40&md5=6ad9b3f15cc20573fb3e647dcd8d258f",Article,Scopus,2-s2.0-0025824081
"Delong, A., Syvanen, M.","Trans-acting transposase mutant from Tn5",1991,"Proceedings of the National Academy of Sciences of the United States of America","88","14",,"6072","6076",,11,,"http://www.scopus.com/inward/record.url?eid=2-s2.0-0025819799&partnerID=40&md5=b6090f71a18ad2b7e5b92cde3e1bac09",Article,Scopus,2-s2.0-0025819799
"DeLong, A., Syvanen, M.","Membrane association of the Tnp and Inh proteins of IS50(R)",1990,"Journal of Bacteriology","172","9",,"5516","5519",,1,,"http://www.scopus.com/inward/record.url?eid=2-s2.0-0025183124&partnerID=40&md5=78aa7c45e4b60e82b565300797242f77",Article,Scopus,2-s2.0-0025183124
