Authors,Title,Year,Source title,Volume,Issue,Art. No.,Page start,Page end,Page count,Cited by,DOI,Link,Document Type,Source,EID
"Russell, T.A., Stefanovic, T., Tscharke, D.C.","Engineering herpes simplex viruses by infection-transfection methods including recombination site targeting by CRISPR/Cas9 nucleases",2015,"Journal of Virological Methods","213",,,"18","25",,2,10.1016/j.jviromet.2014.11.009,"http://www.scopus.com/inward/record.url?eid=2-s2.0-84916912019&partnerID=40&md5=b77a0cba6cf8d6ae6b0051a4267dea26",Article,Scopus,2-s2.0-84916912019
"Macleod, B.L., Bedoui, S., Hor, J.L., Mueller, S.N., Russell, T.A., Hollett, N.A., Heath, W.R., Tscharke, D.C., Brooks, A.G., Gebhardt, T.","Distinct APC subtypes drive spatially segregated CD4+ and CD8+ T-cell effector activity during skin infection with HSV-1",2014,"PLoS Pathogens","10","8", e1004303,"1","15",,5,10.1371/journal.ppat.1004303.g001,"http://www.scopus.com/inward/record.url?eid=2-s2.0-84908126655&partnerID=40&md5=57f9277d1b8ebe7feb39b6d31e00bda9",Article,Scopus,2-s2.0-84908126655
"Ma, J.Z., Russell, T.A., Spelman, T., Carbone, F.R., Tscharke, D.C.","Lytic Gene Expression Is Frequent in HSV-1 Latent Infection and Correlates with the Engagement of a Cell-Intrinsic Transcriptional Response",2014,"PLoS Pathogens","10","7", e1004237,"","",,3,10.1371/journal.ppat.1004237,"http://www.scopus.com/inward/record.url?eid=2-s2.0-84905367433&partnerID=40&md5=b9eb9d8691d1e0b769c449e631015f59",Article,Scopus,2-s2.0-84905367433
"Russell, T.A., Tscharke, D.C.","Strikingly poor CD8 + T-cell immunogenicity of vaccinia virus strain MVA in BALB/c mice",2014,"Immunology and Cell Biology","92","5",,"466","469",,3,10.1038/icb.2014.10,"http://www.scopus.com/inward/record.url?eid=2-s2.0-84901653193&partnerID=40&md5=eff8500dde3a91ae3075e239d9e85c81",Article,Scopus,2-s2.0-84901653193
"Yuen, T.J., Flesch, I.E.A., Hollett, N.A., Dobson, B.M., Russell, T.A., Fahrer, A.M., Tscharke, D.C.","Analysis of A47, an immunoprevalent protein of vaccinia virus, leads to a reevaluation of the total antiviral CD8+ T cell response",2010,"Journal of Virology","84","19",,"10220","10229",,18,10.1128/JVI.01281-10,"http://www.scopus.com/inward/record.url?eid=2-s2.0-77956806285&partnerID=40&md5=b140dc7beb03c99e413a5bcf729e8bde",Article,Scopus,2-s2.0-77956806285
