Authors,Title,Year,Source title,Volume,Issue,Art. No.,Page start,Page end,Page count,Cited by,DOI,Link,Document Type,Source,EID
"Van Moerkercke, A., Steensma, P., Schweizer, F., Pollier, J., Gariboldi, I., Payne, R., Vanden Bossche, R., Miettinen, K., Espoz, J., Purnama, P.C., Kellner, F., Seppänen-Laakso, T., O'Connor, S.E., Rischer, H., Memelink, J., Goossens, A.","The bHLH transcription factor BIS1 controls the iridoid branch of the monoterpenoid indole alkaloid pathway in Catharanthus roseus",2015,"Proceedings of the National Academy of Sciences of the United States of America","112","26",,"8130","8135",,3,10.1073/pnas.1504951112,"http://www.scopus.com/inward/record.url?eid=2-s2.0-84937947390&partnerID=40&md5=0b588debad7453dbfb6411c33a324067",Article,Scopus,2-s2.0-84937947390
"Munkert, J., Pollier, J., Miettinen, K., Van Moerkercke, A., Payne, R., Müller-Uri, F., Burlat, V., O'Connor, S.E., Memelink, J., Kreis, W., Goossens, A.","Iridoid synthase activity is common among the plant progesterone 5β-reductase family",2015,"Molecular Plant","8","1",,"136","152",,4,10.1016/j.molp.2014.11.005,"http://www.scopus.com/inward/record.url?eid=2-s2.0-84925059997&partnerID=40&md5=22b567addcdf04261f045feff2ac88ea",Article,Scopus,2-s2.0-84925059997
"Van Moerkercke, A., Fabris, M., Pollier, J., Baart, G.J.E., Rombauts, S., Hasnain, G., Rischer, H., Memelink, J., Oksman-Caldentey, K.-M., Goossens, A.","CathaCyc, a metabolic pathway database built from catharanthus roseus RNA-seq data",2013,"Plant and Cell Physiology","54","5",,"673","685",,37,10.1093/pcp/pct039,"http://www.scopus.com/inward/record.url?eid=2-s2.0-84877978998&partnerID=40&md5=c19707cc38ee6064ffa0574114b07909",Article,Scopus,2-s2.0-84877978998
"Colquhoun, T.A., Marciniak, D.M., Wedde, A.E., Kim, J.Y., Schwieterman, M.L., Levin, L.A., Van Moerkercke, A., Schuurink, R.C., Clark, D.G.","A peroxisomally localized acyl-activating enzyme is required for volatile benzenoid formation in a Petunia×hybrida cv. 'Mitchell Diploid' flower",2012,"Journal of Experimental Botany","63","13",,"4821","4833",,9,10.1093/jxb/ers153,"http://www.scopus.com/inward/record.url?eid=2-s2.0-84865454034&partnerID=40&md5=a0cf68eb5a563c959d671ce9e725d896",Article,Scopus,2-s2.0-84865454034
"Van Moerkercke, A., Galván-Ampudia, C.S., Verdonk, J.C., Haring, M.A., Schuurink, R.C.","Regulators of floral fragrance production and their target genes in petunia are not exclusively active in the epidermal cells of petals",2012,"Journal of Experimental Botany","63","8",,"3157","3171",,6,10.1093/jxb/ers034,"http://www.scopus.com/inward/record.url?eid=2-s2.0-84861388522&partnerID=40&md5=e457546c520d75e956ea0ad2d8bb913e",Article,Scopus,2-s2.0-84861388522
"Van Moerkercke, A., Haring, M.A., Schuurink, R.C.","A model for combinatorial regulation of the petunia R2R3-MYB transcription factor ODORANT1",2012,"Plant Signaling and Behavior","7","4",,"518","520",,1,10.4161/psb.19311,"http://www.scopus.com/inward/record.url?eid=2-s2.0-84862893924&partnerID=40&md5=907c8ae11834a8ce145141631d5f7d4d",Article,Scopus,2-s2.0-84862893924
"Van Moerkercke, A., Haring, M.A., Schuurink, R.C.","The transcription factor EMISSION of BENZENOIDS II activates the MYB ODORANT1 promoter at a MYB binding site specific for fragrant petunias",2011,"Plant Journal","67","5",,"917","928",,16,10.1111/j.1365-313X.2011.04644.x,"http://www.scopus.com/inward/record.url?eid=2-s2.0-80052268286&partnerID=40&md5=941bf13f5f9596650bf2122799386c39",Article,Scopus,2-s2.0-80052268286
