Authors,Title,Year,Source title,Volume,Issue,Art. No.,Page start,Page end,Page count,Cited by,DOI,Link,Document Type,Source,EID
"Papadopoulos, Y.A., Christie, B.R., McRae, K.B., Gehl, D., Fillmore, S.A.","Pratt timothy [La fléole Pratt]",2015,"Canadian Journal of Plant Science","95","5",,"1047","1048",,,10.4141/CJPS-2015-054,"http://www.scopus.com/inward/record.url?eid=2-s2.0-84941367422&partnerID=40&md5=283917e37c658483253aa7d3b8492d94",Article,Scopus,2-s2.0-84941367422
"Papadopoulos, Y.A., Christie, B.R., Choo, T.M., Michaud, R., McRae, K.B., Gehl, D., Fillmore, S.A.E.","Tapani red clover",2008,"Canadian Journal of Plant Science","88","6",,"1091","1092",,2,,"http://www.scopus.com/inward/record.url?eid=2-s2.0-57149091380&partnerID=40&md5=b857403db2e8a5e628fba5ce083a7d01",Article,Scopus,2-s2.0-57149091380
"Van Den Berg, N., Serfontein, S., Christie, B., Munro, C.","First report of raceme blight caused by Cladosporium cladosporioides on Macadamia nuts in South Africa",2008,"Plant Disease","92","3",,"484","",,1,10.1094/PDIS-92-3-0484C,"http://www.scopus.com/inward/record.url?eid=2-s2.0-40849111992&partnerID=40&md5=5d4bc05cb1e8d3e768027b9c2e4f6958",Note,Scopus,2-s2.0-40849111992
"Sturz, A.V., Peters, R.D., Carter, M.R., Sanderson, J.B., Matheson, B.G., Christie, B.R.","Variation in antibiosis ability, against potato pathogens, of bacterial communities recovered from the endo- and exoroots of potato crops produced under conventional versus minimum tillage systems",2005,"Canadian Journal of Microbiology","51","8",,"643","654",,11,10.1139/w05-041,"http://www.scopus.com/inward/record.url?eid=2-s2.0-29144486107&partnerID=40&md5=889cf1a53de807bac49c2ad1190c20b1",Article,Scopus,2-s2.0-29144486107
"Arsenault, W.J., Christie, B.R.","Effect of whole seed tuber size and pre-plant storage conditions on yield and tuber size distribution of Russet Burbank",2004,"American Journal of Potato Research","81","6",,"371","376",,3,,"http://www.scopus.com/inward/record.url?eid=2-s2.0-11244311977&partnerID=40&md5=e8843b82bae008a75a65b0d5a3064e7e",Article,Scopus,2-s2.0-11244311977
"Sturz, A.V., Ryan, D.A.J., Coffin, A.D., Matheson, B.G., Arsenault, W.J., Kimpinski, J., Christie, B.R.","Stimulating disease suppression in soils: Sulphate fertilizers can increase biodiversity and antibiosis ability of root zone bacteria against Streptomyces scabies",2004,"Soil Biology and Biochemistry","36","2",,"343","352",,11,10.1016/j.soilbio.2003.10.009,"http://www.scopus.com/inward/record.url?eid=2-s2.0-1042267473&partnerID=40&md5=39b2ba37244e155c89e6ed34de9ded5d",Article,Scopus,2-s2.0-1042267473
"Sturz, A.V., Arsenault, W., Christie, B.R.","Red Clover-Potato Cultivar Combinations for Improved Potato Yield",2003,"Agronomy Journal","95","5",,"1089","1092",,3,,"http://www.scopus.com/inward/record.url?eid=2-s2.0-0141615040&partnerID=40&md5=bb1311b8cff740327c011b4ab5ab1b15",Article,Scopus,2-s2.0-0141615040
"Sturz, A.V., Christie, B.R.","Beneficial microbial allelopathies in the root zone: The management of soil quality and plant disease with rhizobacteria",2003,"Soil and Tillage Research","72","2",,"107","123",,74,10.1016/S0167-1987(03)00082-5,"http://www.scopus.com/inward/record.url?eid=2-s2.0-0038159677&partnerID=40&md5=1609efc795bce0cb97f7980a95025592",Article,Scopus,2-s2.0-0038159677
"Sturz, A.V., Christie, B.R.","Rationale for an holistic approach to soil quality and crop health",2003,"Soil and Tillage Research","72","2",,"105","106",,3,10.1016/S0167-1987(03)00081-3,"http://www.scopus.com/inward/record.url?eid=2-s2.0-0037810362&partnerID=40&md5=11d3015da6ed949dd4637f8158a2d521",Editorial,Scopus,2-s2.0-0037810362
"Papadopoulos, Y.A., Kimpinski, J., McRae, K.B., Christie, B.R., Gallant, C.E., Fillmore, S.A.E.","Invasion and reproduction by root-lesion nematode (Pratylenchus penetrans) differs among selected lines of red clover (Trifolium pratense)",2002,"Phytoprotection","83","1",,"41","45",,4,,"http://www.scopus.com/inward/record.url?eid=2-s2.0-23844473679&partnerID=40&md5=44a2f19b56e7c04d43cb2ebbbea0e766",Article,Scopus,2-s2.0-23844473679
"Katepa-Mupondwa, F.M., Christie, B.R., Michaels, T.E.","An improved breeding strategy for autotetraploid Alfalfa (Medicago sativa L.)",2002,"Euphytica","123","1",,"139","146",,4,10.1023/A:1014488307000,"http://www.scopus.com/inward/record.url?eid=2-s2.0-0036121655&partnerID=40&md5=dea72dbb013fb2d8e53e4bbb0c6bd687",Article,Scopus,2-s2.0-0036121655
"Sturz, A.V., Matheson, B.G., Arsenault, W., Kimpinski, J., Christie, B.R.","Weeds as a source of plant growth promoting rhizobacteria in agricultural soils",2001,"Canadian Journal of Microbiology","47","11",,"1013","1024",,29,10.1139/cjm-47-11-1013,"http://www.scopus.com/inward/record.url?eid=2-s2.0-0035665247&partnerID=40&md5=110a91c86e7a1891bd4b0f87c56a7bd3",Article,Scopus,2-s2.0-0035665247
"Christie, B.R., Bowley, S.R.","Jay Orchardgrass",2000,"Canadian Journal of Plant Science","80","4",,"839","840",,,,"http://www.scopus.com/inward/record.url?eid=2-s2.0-0034483721&partnerID=40&md5=0c0aa82ec2a395706cbe79483187005f",Article,Scopus,2-s2.0-0034483721
"Sturz, A.V., Christie, B.R., Nowak, J.","Bacterial endophytes: Potential role in developing sustainable systems of crop production",2000,"Critical Reviews in Plant Sciences","19","1",,"1","30",,327,10.1080/07352680091139169,"http://www.scopus.com/inward/record.url?eid=2-s2.0-0033982720&partnerID=40&md5=9d962e3330d163ef4f0ac62db665953c",Review,Scopus,2-s2.0-0033982720
"Christie, B.R., Martin, R.A.","Selection for persistence in red clover",1999,"Canadian Journal of Plant Science","79","3",,"357","359",,3,,"http://www.scopus.com/inward/record.url?eid=2-s2.0-0032727640&partnerID=40&md5=d48f1f7c7ff7fda70098323e071b3edc",Article,Scopus,2-s2.0-0032727640
"Sturz, A.V., Christie, B.R., Matheson, B.G., Arsenault, W.J., Buchanan, N.A.","Endophytic bacterial communities in the periderm of potato tubers and their potential to improve resistance to soil-borne plant pathogens",1999,"Plant Pathology","48","3",,"360","369",,81,10.1046/j.1365-3059.1999.00351.x,"http://www.scopus.com/inward/record.url?eid=2-s2.0-0032978830&partnerID=40&md5=dc5cc88bb7c5e46fed7049c37aacfe59",Article,Scopus,2-s2.0-0032978830
"Martin, R.A., Christie, B.R., Papadopoulos, Y.A., Martin, R.C.","AC Christie red clover",1999,"Canadian Journal of Plant Science","79","2",,"257","258",,3,,"http://www.scopus.com/inward/record.url?eid=2-s2.0-0033015538&partnerID=40&md5=96c9ab6d82a7a3aacf9b23056288695d",Short Survey,Scopus,2-s2.0-0033015538
"Bélanger, G., Kunelius, T., McKenzie, D., Papadopoulos, Y., Thomas, B., McRae, K., Fillmore, S., Christie, B.","Fall cutting management affects yield and persistence of alfalfa in Atlantic Canada",1999,"Canadian Journal of Plant Science","79","1",,"57","63",,16,,"http://www.scopus.com/inward/record.url?eid=2-s2.0-0344197561&partnerID=40&md5=8652736369cafa74e97c4515d744e76f",Article,Scopus,2-s2.0-0344197561
"Sturz, A.V., Christie, B.R.","The potential benefits from cultivar specific red clover potato crop rotations",1998,"Annals of Applied Biology","133","3",,"365","373",,8,,"http://www.scopus.com/inward/record.url?eid=2-s2.0-0032417264&partnerID=40&md5=aca22001e4685c917a59c0c74d4e359a",Article,Scopus,2-s2.0-0032417264
"Sturz, A.V., Christie, B.R., Matheson, B.C.","Associations of bacterial endophyte populations from red clover and potato crops with potential for beneficial allelopathy",1998,"Canadian Journal of Microbiology","44","2",,"162","167",,92,10.1139/cjm-44-2-162,"http://www.scopus.com/inward/record.url?eid=2-s2.0-0031976777&partnerID=40&md5=e978bc2cd93455b563eaee9d798731ce",Article,Scopus,2-s2.0-0031976777
"Christie, B.R., Choo, T.M., Papadopoulos, Y.A., Lewis, J., Michaud, R.","AC endure red clover",1998,"Canadian Journal of Plant Science","78","1",,"113","114",,1,,"http://www.scopus.com/inward/record.url?eid=2-s2.0-0031806995&partnerID=40&md5=26c4b9cb9b9fc4b5788d1ac8515b61d1",Article,Scopus,2-s2.0-0031806995
"Caradus, J.R., Christie, B.R.","Winterhardiness and artificial frost tolerance of white clover ecotypes and selected breeding lines",1998,"Canadian Journal of Plant Science","78","2",,"251","255",,10,,"http://www.scopus.com/inward/record.url?eid=2-s2.0-0031870293&partnerID=40&md5=c6bf62cc95235b4f900be799d5318c1f",Article,Scopus,2-s2.0-0031870293
"Sturz, A.V., Christie, B.R., Matheson, B.G., Nowak, J.","Biodiversity of endophytic bacteria which colonize red clover nodules, roots, stems and foliage and their influence on host growth",1997,"Biology and Fertility of Soils","25","1",,"13","19",,123,10.1007/s003740050273,"http://www.scopus.com/inward/record.url?eid=2-s2.0-0030613398&partnerID=40&md5=eb898c20986d4b3a6748c92445df9f03",Article,Scopus,2-s2.0-0030613398
"Papadopoulos, Y.A., Choo, T.M., Christie, B.R., Thomas, W.G., McKenzie, D.B., Bélanger, G., Sutherland, K., McRae, K.B., Fillmore, S.A.E.","AC Langille birdsfoot trefoil",1997,"Canadian Journal of Plant Science","77","4",,"653","654",,1,,"http://www.scopus.com/inward/record.url?eid=2-s2.0-0031402021&partnerID=40&md5=04711b59fcf7b3157de1eda8d788a77d",Article,Scopus,2-s2.0-0031402021
"LeBlanc, P.V., Gupta, U.C., Christie, B.R.","Zinc nutrition of silage corn grown on acid podzols",1997,"Journal of Plant Nutrition","20","2-3",,"345","353",,3,,"http://www.scopus.com/inward/record.url?eid=2-s2.0-0030843248&partnerID=40&md5=5aab5c97013a3dd16e10ffd996744ed7",Article,Scopus,2-s2.0-0030843248
"Ann Clark, E., Christie, B.R., Weise, S.F.","The structure and function of agricultural research [Structure et fonction de la recherche agricole]",1996,"Canadian Journal of Plant Science","76","4",,"603","610",,4,,"http://www.scopus.com/inward/record.url?eid=2-s2.0-12644300637&partnerID=40&md5=fcf9bc4bac1b72a7175261e7175c48f0",Article,Scopus,2-s2.0-12644300637
"Sturz, A.V., Christie, B.R.","Endophytic bacteria of red clover as agents of allelopathic clover- maize syndromes",1996,"Soil Biology and Biochemistry","28","4-5",,"583","588",,26,10.1016/0038-0717(95)00168-9,"http://www.scopus.com/inward/record.url?eid=2-s2.0-0030111887&partnerID=40&md5=e15b783119ea730a8454e6aed338f4cf",Article,Scopus,2-s2.0-0030111887
"Shattuck, V.I., Christie, B., Corso, C.","Principles for Griffing's combining ability analysis",1993,"Genetica","90","1",,"73","77",,9,10.1007/BF01435180,"http://www.scopus.com/inward/record.url?eid=2-s2.0-0027132906&partnerID=40&md5=8ad9a9371fd8f903595eedc23cee891a",Article,Scopus,2-s2.0-0027132906
"Loiselle, F., Tai, G.C.C., Christie, B.R.","Pedigree, agronomic and molecular divergence of parents in relation to progeny performance in potato",1991,"Potato Research","34","3",,"305","316",,8,10.1007/BF02360504,"http://www.scopus.com/inward/record.url?eid=2-s2.0-0345693319&partnerID=40&md5=2ead1dd874c583857089141ed87db95f",Article,Scopus,2-s2.0-0345693319
"Christie, B.R., Choo, T.M.","Morphological characteristics associated with winter survival of five growth types of tetraploid red clover",1991,"Euphytica","54","3",,"275","278",,5,10.1007/BF00023003,"http://www.scopus.com/inward/record.url?eid=2-s2.0-34249927170&partnerID=40&md5=1f7adcd98a6c2a2fa16d2774add5cf7c",Article,Scopus,2-s2.0-34249927170
"Frame, B., Yu, K.-f., Christie, B.R., Pauls, K.P.","In vitro selection for resistance to verticillium wilt in alfalfa (Medicago sativa L.) using a fungal culture filtrate",1991,"Physiological and Molecular Plant Pathology","38","5",,"325","340",,9,10.1016/S0885-5765(05)80134-1,"http://www.scopus.com/inward/record.url?eid=2-s2.0-0038564836&partnerID=40&md5=ff7f7b2a3e5946ebb32152953aca8c73",Article,Scopus,2-s2.0-0038564836
"Loiselle, F., Tai, G.C.C., Christie, B.R.","Genetic components of chip color evaluated after harvest, cold storage and reconditioning",1990,"American Potato Journal","67","9",,"633","646",,20,10.1007/BF03043449,"http://www.scopus.com/inward/record.url?eid=2-s2.0-0008639316&partnerID=40&md5=2b0441abe29c9d7c6212595cc7a8acfe",Article,Scopus,2-s2.0-0008639316
"Yu, K., Christie, B.R., Pauls, K.P.","Effects of Verticillium albo-atrum culture filtrate on somatic embryogenesis in alfalfa",1990,"Plant Cell Reports","8","9",,"509","511",,4,10.1007/BF00820197,"http://www.scopus.com/inward/record.url?eid=2-s2.0-0006958181&partnerID=40&md5=81de3edc20d74c7fed3c8b0039569c28",Article,Scopus,2-s2.0-0006958181
"Loiselle, F., Tai, G.C.C., Christie, B.R., Tarn, T.R.","Relationship between inbreeding coefficient and clonal selection in a potato cultivar development program",1989,"American Potato Journal","66","11",,"747","753",,5,10.1007/BF02896831,"http://www.scopus.com/inward/record.url?eid=2-s2.0-44349120471&partnerID=40&md5=d65a004d303c6f4fa7663428f055acbc",Article,Scopus,2-s2.0-44349120471
"Clark, E.A., Christie, B.R.","A forage-based vision of Ontario agriculture",1988,"Journal of Agricultural Ethics","1","2",,"109","121",,3,10.1007/BF01827029,"http://www.scopus.com/inward/record.url?eid=2-s2.0-0037494626&partnerID=40&md5=8ca2475c4adf1f3e9b7447ac3741ada6",Article,Scopus,2-s2.0-0037494626
"Busch, L.V., Christie, B.R., Smith, E.A., Boland, G.","Testing alfalfa cultivars for resistance to an alfalfa strain of verticillium albo-atrum",1985,"Canadian Journal of Plant Pathology","7","2",,"203","205",,4,10.1080/07060668509501504,"http://www.scopus.com/inward/record.url?eid=2-s2.0-33644699152&partnerID=40&md5=f6dd3c66285769cddb6e86acfee02b8f",Article,Scopus,2-s2.0-33644699152
"Christie, B.R., Papadopoulos, Y.A., Busch, L.V.","Genetics and breeding for resistance to verticillium wilt in alfalfa",1985,"Canadian Journal of Plant Pathology","7","2",,"206","210",,4,10.1080/07060668509501505,"http://www.scopus.com/inward/record.url?eid=2-s2.0-36048980376&partnerID=40&md5=0237a0063eb1c84b1936bfd989086073",Article,Scopus,2-s2.0-36048980376
"Choo, T.M., Christie, B.R., Reinbergs, E.","Doubled haploids for estimating genetic variances and a scheme for population improvement in self-pollinating crops",1979,"Theoretical and Applied Genetics","54","6",,"267","271",,9,10.1007/BF00281208,"http://www.scopus.com/inward/record.url?eid=2-s2.0-0344913873&partnerID=40&md5=70aca8b24ac54057bca39fdf94de81b2",Article,Scopus,2-s2.0-0344913873
"Sandha, G.S., Twamley, B.E., Christie, B.R.","Analysis of quantitative variability for seed yield and related characters in Lotus corniculatus L. cv. Leo",1977,"Euphytica","26","1",,"113","122",,4,10.1007/BF00032076,"http://www.scopus.com/inward/record.url?eid=2-s2.0-2542475867&partnerID=40&md5=639f63958cea19ffa009c6bc2714a7bd",Article,Scopus,2-s2.0-2542475867
