Authors,Title,Year,Source title,Volume,Issue,Art. No.,Page start,Page end,Page count,Cited by,DOI,Link,Document Type,Source,EID
"Schröder, W., Pesch, R., Zechmeister, H., Kratz, W., Holy, M., Harmens, H., Fagerli, H., Ilyin, I.","Atmospheric deposition and accumulation of heavy metals and nitrogen in natura 2000 sites in Germany [Atmosphärische deposition und anreicherung von schwermetallen und stickstoff in natura-2000-gebieten Deutschlands]",2010,"Umweltwissenschaften und Schadstoff-Forschung","22","6",,"711","720",,1,10.1007/s12302-010-0145-2,"http://www.scopus.com/inward/record.url?eid=2-s2.0-79954472494&partnerID=40&md5=8bf091e18ec63efd625a52de17aaf41a",Article,Scopus,2-s2.0-79954472494
"Hofmann, F., Epp, R., Kalchschmid, A., Kratz, W., Kruse, L., Kuhn, U., Maisch, B., Müller, E., Ober, S., Radtke, J., Schlechtriemen, U., Schmidt, G., Schröder, W., Von Der Ohe, W., Vögel, R., Wedl, N., Wosniok, W.","Monitoring of Bt-Maize pollen exposure in the vicinity of the nature reserve Ruhlsdorfer Bruch in northeast Germany 2007 to 2008",2010,"Umweltwissenschaften und Schadstoff-Forschung","22","3",,"229","251",,11,10.1007/s12302-010-0133-6,"http://www.scopus.com/inward/record.url?eid=2-s2.0-77956590126&partnerID=40&md5=debc81e2b6f6b91249b1763cf252d682",Article,Scopus,2-s2.0-77956590126
"Kratz, W., Schröder, W.","Moss monitoring: Against reason at the end of a program on effective environmental data collection in federal government-state cooperation [Moosmonitoring : Wider die Vernunft - zum Ende eines Programms effektiver Umweltdatenerhebung in Bund-Länder-Kooperation]",2010,"Umweltwissenschaften und Schadstoff-Forschung","22","1",,"1","6",,,10.1007/s12302-009-0098-5,"http://www.scopus.com/inward/record.url?eid=2-s2.0-77951957714&partnerID=40&md5=e70729505aaa213c035a230654a52295",Review,Scopus,2-s2.0-77951957714
"Hanisch, B., Abbas, B., Kratz, W., Schüürmann, G.","Human drugs in aquatic ecosystems: Approach for the environmental risk assessment of drug residues [Humanarzneimittel im aquatischen ökosystem: Bewertungsansatz zur abschätzung des ökotoxikologischen risikos von arzneimittelrü ckständen]",2004,"Umweltwissenschaften und Schadstoff-Forschung","16","4",,"223","238",,14,org/10.1065/uwsf2004.02.076,"http://www.scopus.com/inward/record.url?eid=2-s2.0-7744220960&partnerID=40&md5=ad703f07a2620de267b3da5408623195",Article,Scopus,2-s2.0-7744220960
"McTiernan, K.B., Coûteaux, M.-M., Berg, B., Berg, M.P., De Anta, R.C., Gallardo, A., Kratz, W., Piussi, P., Remacle, J., De Santo, A.V.","Changes in chemical composition of Pinus sylvestris needle litter during decomposition along a European coniferous forest climatic transect",2003,"Soil Biology and Biochemistry","35","6",,"801","812",,51,10.1016/S0038-0717(03)00107-X,"http://www.scopus.com/inward/record.url?eid=2-s2.0-0038685659&partnerID=40&md5=6357bbb013ca5c2671775ffc2724ddaa",Article,Scopus,2-s2.0-0038685659
"Abbas, B., Jurkutat, B., Kratz, W.","Palladium from automobile catalysts - A health risk? [Palladium aus dem autokatalysator - Ein gesundheitsrisiko?]",2002,"Umweltmedizin in Forschung und Praxis","7","6",,"343","348",,,,"http://www.scopus.com/inward/record.url?eid=2-s2.0-0036919594&partnerID=40&md5=f5393b13cb4617f8b11b7d5e44e66e81",Review,Scopus,2-s2.0-0036919594
"Abbas, B., Linke, I., Kratz, W.","Inquiry of drug agent quantities in the Land Brandenburg [Erhebung des verbrauchs von arzneimittelwirkstoffen im Land Brandenburg]",2001,"Umweltwissenschaften und Schadstoff-Forschung","13","4",,"197","203",,3,,"http://www.scopus.com/inward/record.url?eid=2-s2.0-0034903328&partnerID=40&md5=63a31fa8cc901efc26bd2a6ca5a7c1af",Review,Scopus,2-s2.0-0034903328
"Klose, H., Kratz, W.","The EU overall water policy concerning water pollution due to hazardous substances [Die EU-wasserrahmenrichtlinie zur belastung der gewässer mit gefährlichen stoffen]",2001,"Umweltwissenschaften und Schadstoff-Forschung","13","3",,"183","184",,,,"http://www.scopus.com/inward/record.url?eid=2-s2.0-0034959659&partnerID=40&md5=e3b1d881b6a43f5dddf013de89a0767a",Short Survey,Scopus,2-s2.0-0034959659
"Kratz, W., Abbas, B., Linke, I.","Pharmacenticals in the environment [Arzneimittelwirkstoffe in der umwelt]",2000,"Umweltwissenschaften und Schadstoff-Forschung","12","6",,"343","349",,5,,"http://www.scopus.com/inward/record.url?eid=2-s2.0-0034522146&partnerID=40&md5=e7b53736ab576ae8c789bbd124394f9f",Review,Scopus,2-s2.0-0034522146
"Sousa, J.P., Loureiro, S., Pieper, S., Frost, M., Kratz, W., Nogueira, A.J.A., Soares, A.M.V.M.","Soil and plant diet exposure routes and toxicokinetics of lindane in a terrestrial isopod",2000,"Environmental Toxicology and Chemistry","19","10",,"2557","2563",,24,,"http://www.scopus.com/inward/record.url?eid=2-s2.0-0033801601&partnerID=40&md5=35076db6461c771802a4695cc369f05b",Article,Scopus,2-s2.0-0033801601
"Ritschel, J., Kratz, W.","Environmentally-compatible use of land on former sewage farms [Konzept zu einer umweltvertraglichen Nachnutzung von Rieselfeldern]",2000,"Wasser und Boden","52","9",,"29","33",,1,,"http://www.scopus.com/inward/record.url?eid=2-s2.0-0033796524&partnerID=40&md5=5ee497b5b104ad6247952ac318e4ca64",Article,Scopus,2-s2.0-0033796524
"Kratz, W., Klepka, S.","The effect of BaP and PCB 52 in soil of irrigated fields on the growth of Avena sativa (oats) and Brassica rapa (rape) [Die wirkung von BaP und PCB 52 in gespikten rieselfeldboden auf das wachstum von Avena sativa (hafer) und Brassica rapa (stoppelrube)]",1998,"Umweltwissenschaften und Schadstoff-Forschung","10","4",,"197","",,1,,"http://www.scopus.com/inward/record.url?eid=2-s2.0-0032458775&partnerID=40&md5=17d637b8dfd7a5985295386d76fdab30",Article,Scopus,2-s2.0-0032458775
"Cotrufo, M.F., Berg, B., Kratz, W.","Increased atmospheric CO2 and litter quality",1998,"Environmental Reviews","6","1",,"1","12",,11,,"http://www.scopus.com/inward/record.url?eid=2-s2.0-0002189219&partnerID=40&md5=b43d0c8390884d75405e8923724b0823",Article,Scopus,2-s2.0-0002189219
"Berg, B., Johansson, M.-B., Meentemeyer, V., Kratz, W.","Decomposition of tree root litter in a climatic transect of coniferous forests in Northern Europe: A synthesis",1998,"Scandinavian Journal of Forest Research","13","4",,"402","412",,24,,"http://www.scopus.com/inward/record.url?eid=2-s2.0-0032434178&partnerID=40&md5=6d4d6446f570788b1c9a97a44b962948",Article,Scopus,2-s2.0-0032434178
"Staak, A., Frost, M., Kratz, W.","Ecotoxicological studies on the impact of the herbicide trifluralin on Porcellio scaber (Isopoda)",1998,"Applied Soil Ecology","9","1-3",,"405","409",,3,,"http://www.scopus.com/inward/record.url?eid=2-s2.0-0013011645&partnerID=40&md5=58ef103e76ec3dd5e30f50999fdc95c1",Article,Scopus,2-s2.0-0013011645
"Kratz, W.","The bait-lamina test: General aspects, applications and perspectives",1998,"Environmental Science and Pollution Research","5","2",,"94","96",,64,,"http://www.scopus.com/inward/record.url?eid=2-s2.0-0031805210&partnerID=40&md5=6209ca02d53aa4f3b488f507896ee649",Article,Scopus,2-s2.0-0031805210
"Kratz, W., Riesbeck, F.","The effects of explosive wastes in the soil of areas contaminated with military scrap on the population development of the springtail Folsomia candida (Willem 1902) (insects of the Order Collembola) [Die wirkung von sprengstoffen in boden einer militarischen altlast auf die populationsentwicklung von Folsomia candida (Willem 1902) (Collembola, Insecta)]",1998,"Umweltwissenschaften und Schadstoff-Forschung","10","3",,"143","146",,3,,"http://www.scopus.com/inward/record.url?eid=2-s2.0-0031718354&partnerID=40&md5=5a90647aedb2fb7b3cbdd431c96b5259",Article,Scopus,2-s2.0-0031718354
"Kratz, W.","Ecotoxicological bioindication: Heavy metals, PAH and PCB contents in scots pine needles [Ökotoxikologische Bioindikation - Schwermetallkonzentrationen, PAK und PCB in Kiefernnadeln]",1996,"Umweltwissenschaften und Schadstoff-Forschung","8","3",,"130","137",,4,10.1007/BF02939296,"http://www.scopus.com/inward/record.url?eid=2-s2.0-0009075686&partnerID=40&md5=bfdaf2484e7573f4277292db2b94a560",Article,Scopus,2-s2.0-0009075686
"Berg, B., Berg, M.P., Bottner, P., Box, E., Breymeyer, A., de Anta, R.C., Couteaux, M., Escudero, A., Gallardo, A., Kratz, W., Madeira, M., Mälkönen, E., McClaugherty, C., Meentemeyer, V., Muñoz, F., Piussi, P., Remacle, J., de Santo, A.V.","Litter mass loss rates in pine forests of Europe and Eastern United States: some relationships with climate and litter quality",1993,"Biogeochemistry","20","3",,"127","159",,283,10.1007/BF00000785,"http://www.scopus.com/inward/record.url?eid=2-s2.0-0027869930&partnerID=40&md5=4980b3e0b33ba3fca9f7032e5ee843b8",Article,Scopus,2-s2.0-0027869930
"Kratz, W., Gruttke, H.","Pentachlorophenol - a wood preservative - its distribution in an invertebrate food chain",1991,"Organic micropollutants in the aquatic environment. Proc. 6th European Symposium, Lisbon, 1990",,,,"428","431",,,,"http://www.scopus.com/inward/record.url?eid=2-s2.0-0026286509&partnerID=40&md5=d38bbca2620ccdb964db350cdea138c1",,Scopus,2-s2.0-0026286509
"Reh, U., Kratz, W., Kraepelin, G., Angehrn-Bettinazzi, C.","Analysis of leaf and needle litter decomposition by differential scanning calorimetry and differential thermogravimetry",1990,"Biology and Fertility of Soils","9","2",,"188","191",,17,10.1007/BF00335806,"http://www.scopus.com/inward/record.url?eid=2-s2.0-0004805198&partnerID=40&md5=ad1e0c1a950f58112c74050290572064",Article,Scopus,2-s2.0-0004805198
"Kratz, W.","Ecosystem studies on heavy metal accumulation of an immission-polluted forest edge on the Avus highway, West Berlin [Okosystemare Untersuchungen zur Schwermetallkontamination eines immissionsbelasteten Forstsaumes an der Autobahn Avus in Berlin (West)]",1988,"Verhandlungen - Gesellschaft fur Okologie","18",,,"409","413",,1,,"http://www.scopus.com/inward/record.url?eid=2-s2.0-0024182367&partnerID=40&md5=c1c1d130de69c6c93daed3e8220318f6",,Scopus,2-s2.0-0024182367
"Haque, A., Gruttke, H., Kratz, W., Kielhorn, U., Weigmann, G., Meyer, G., Bornkamm, R., Schuphan, I., Ebing, W.","Environmental fate and distribution of sodium [14C] pentachlorophenate in a section of urban wasteland ecosystem",1988,"Science of the Total Environment, The","68","C",,"127","139",,2,10.1016/0048-9697(88)90366-X,"http://www.scopus.com/inward/record.url?eid=2-s2.0-0023824170&partnerID=40&md5=61e2e7ae405dcaf44c66d4418641c746",Article,Scopus,2-s2.0-0023824170
"Gruttke, H., Kratz, W., Weigmann, G., Haque, A.","Terrestrial model food chain and environmental chemicals. I. Transfer of sodium [14C]pentachlorophenate between springtails and carabids",1988,"Ecotoxicology and Environmental Safety","15","3",,"253","259",,4,10.1016/0147-6513(88)90079-6,"http://www.scopus.com/inward/record.url?eid=2-s2.0-0023824349&partnerID=40&md5=1f8d1ca59467602dda73a0021e705597",Article,Scopus,2-s2.0-0023824349
"Kratz, W., Bielitz, K.","Litter decomposition and heavy metal dynamics (Pb, Cd) in leaf and needle litter in forest ecosystems close to urban areas [Streuabbau und Schwermetalldynamik (Pb, Cd) in Blatt- und Nadelstreu in ballungsraumnahen Waldokosystemen]",1987,"Verhandlungen - Gesellschaft fur Okologie","17",,,"473","478",,,,"http://www.scopus.com/inward/record.url?eid=2-s2.0-0023527774&partnerID=40&md5=e0a5f028552d74f8312d1da32743a760",,Scopus,2-s2.0-0023527774
"Weigmann, G., Kratz, W.","Oribatid mites in urban zones of West Berlin",1987,"Biology and Fertility of Soils","3","1-2",,"81","84",,10,10.1007/BF00260583,"http://www.scopus.com/inward/record.url?eid=2-s2.0-0011940951&partnerID=40&md5=2b5e1edf91ebf7f2488c013379868801",Article,Scopus,2-s2.0-0011940951
"Gruttke, H., Kratz, W., Weigmann, G.","The action of cadmium nitrate on the microfauna of a ruderal ecosystem [Zur Wirkung von Cadmiumnitrat auf die Makrofauna eines Ruderalokosystems]",1986,"Verhandlungen - Gesellschaft fur Okologie","16",,,"431","435",,1,,"http://www.scopus.com/inward/record.url?eid=2-s2.0-0022939169&partnerID=40&md5=8f26fff01b0e4050c6f805da94bf8617",,Scopus,2-s2.0-0022939169
"Gruttke, H., Kielhorn, U., Kratz, W., Weigmann, G., Haque, A.","Distribution of 14C-Na pentachlorophenol in a closed model ecosystem with particular consideration of the detrital food chain [Verteilung von 14C-Natriumpentachlorphenol in einem geschlossenen Modellokosystem unter besonderer Berucksichtigung der Detritusnahrungskette]",1985,"Verhandlungen - Gesellschaft fur Okologie","15",,,"351","357",,1,,"http://www.scopus.com/inward/record.url?eid=2-s2.0-0022274396&partnerID=40&md5=3a4acff933e073f3716dd650c3a8b92e",,Scopus,2-s2.0-0022274396
"Kratz, W., Gruttke, H., Papenhausen, U., Weigmann, G.","INFLUENCE OF CADMIUM ON THE LITTER DECOMPOSITION OF SOLIDAGO GIGANTEA AIT. IN A RUDERAL ECOSYSTEM.",1983,,,,,"814","817",,2,,"http://www.scopus.com/inward/record.url?eid=2-s2.0-0020990456&partnerID=40&md5=39e508c0a0eb802e850b2d1636ed4bf0",Conference Paper,Scopus,2-s2.0-0020990456
