Authors,Title,Year,Source title,Volume,Issue,Art. No.,Page start,Page end,Page count,Cited by,DOI,Link,Document Type,Source,EID
"Mertens, A.C., Yasui, Y., Neglia, J.P., Potter, J.D., Nesbit M.E., Jr., Ruccione, K., Smithson, W.A., Robison, L.L.","Late mortality experience in five-year survivors of childhood and adolescent cancer: The Childhood Cancer Survivor Study",2001,"Journal of Clinical Oncology","19","13",,"3163","3172",,474,,"http://www.scopus.com/inward/record.url?eid=2-s2.0-0035398020&partnerID=40&md5=bc00fb19aef6c28dff4ac4d293eb75f6",Article,Scopus,2-s2.0-0035398020
"Ulrich, C.M., Yasui, Y., Storb, R., Schubert, M.M., Wagner, J.L., Bigler, J., Ariail, K.S., Keener, C.L., Li, S., Liu, H., Farin, F.M., Potter, J.D.","Pharmacogenetics of methotrexate: Toxicity among marrow transplantation patients varies with the methylenetetrahydrofolate reductase C677T polymorphism",2001,"Blood","98","1",,"231","234",,228,10.1182/blood.V98.1.231,"http://www.scopus.com/inward/record.url?eid=2-s2.0-0035412398&partnerID=40&md5=aa666003f82789f277d95c2744680dbb",Article,Scopus,2-s2.0-0035412398
"Bigler, J., Whitton, J., Lampe, J.W., Fosdick, L., Bostick, R.M., Potter, J.D.","CYP2C9 and UGT1A6 genotypes modulate the protective effect of aspirin on colon adenoma risk",2001,"Cancer Research","61","9",,"3566","3569",,115,,"http://www.scopus.com/inward/record.url?eid=2-s2.0-0035328829&partnerID=40&md5=6ef7888636246a71618abe32d98025f4",Article,Scopus,2-s2.0-0035328829
"Slattery, M.L., Samowitz, W., Ballard, L., Sehaffer, D., Leppert, M., Potter, J.D.","A molecular variant of the APC gene at cod on 1822: Its association with diet, lifestyle, and risk of colon cancer",2001,"Cancer Research","61","3",,"1000","1004",,39,,"http://www.scopus.com/inward/record.url?eid=2-s2.0-0035116904&partnerID=40&md5=e2cf9bd8ae3f4cf3801590e1817dc81c",Article,Scopus,2-s2.0-0035116904
"Smith-Warner, S.A., Spiegelman, D., Yaun, S.-S., Adami, H.-O., Beeson, W.L., Van Den Brandt, P.A., Folsom, A.R., Fraser, G.E., Freudenheim, J.L., Goldbohm, R.A., Graham, S., Miller, A.B., Potter, J.D., Rohan, T.E., Speizer, F.E., Toniolo, P., Willett, W.C., Wolk, A., Zeleniuch-Jacquotte, A., Hunter, D.J.","Intake of fruits and vegetables and risk of breast cancer: A pooled analysis of cohort studies",2001,"Journal of the American Medical Association","285","6",,"769","776",,314,,"http://www.scopus.com/inward/record.url?eid=2-s2.0-0035857365&partnerID=40&md5=93b524a9aac9ca56a1af2dec3c11e43e",Review,Scopus,2-s2.0-0035857365
"Yasui, Y., Potter, J.D., Stanford, J.L., Rossing, M.A., Winget, M.D., Bronner, M., Daling, J.","Breast cancer risk and ""delayed"" primary Epstein-Barr virus infection",2001,"Cancer Epidemiology Biomarkers and Prevention","10","1",,"9","16",,48,,"http://www.scopus.com/inward/record.url?eid=2-s2.0-0035132133&partnerID=40&md5=a5c94e493cd4536c9e70e3daa9eaf5e3",Article,Scopus,2-s2.0-0035132133
"Potter, J.D.","At the interfaces of epidemiology, genetics and genomics",2001,"Nature Reviews Genetics","2","2",,"142","147",,57,10.1038/35052575,"http://www.scopus.com/inward/record.url?eid=2-s2.0-0035257025&partnerID=40&md5=cac86621663c4cc9cd22985acd59069a",Review,Scopus,2-s2.0-0035257025
"Ulrich, C.M., Bigler, J., Whitton, J.A., Bostick, R., Fosdick, L., Potter, J.D.","Epoxide hydrolase Tyr1 13His polymorphism is associated with elevated risk of colorectal polyps in the presence of smoking and high meat intake",2001,"Cancer Epidemiology Biomarkers and Prevention","10","8",,"875","882",,63,,"http://www.scopus.com/inward/record.url?eid=2-s2.0-0034742518&partnerID=40&md5=a45f790baff78690381bd6893e48ef2f",Article,Scopus,2-s2.0-0034742518
"Slattery, M.L., Potter, J.D., Curtin, K., Edwards, S., Ma, K.-H., Anderson, K., Schaffer, D., Samowitz, W.S.","Estrogens reduce and withdrawal of estrogens increase risk of microsatellite instability-positive colon cancer",2001,"Cancer Research","61","1",,"126","130",,139,,"http://www.scopus.com/inward/record.url?eid=2-s2.0-0035138814&partnerID=40&md5=f20fb9a0fb10ae9cf273f2f1c6e06b9b",Article,Scopus,2-s2.0-0035138814
"Slattery, M.L., Curtin, K., Anderson, K., Ma, K.-N., Edwards, S., Leppert, M., Potter, J., Schaffer, D., Samowitz, W.S.","Associations between dietary intake and Ki-ras mutations in colon tumors: A population-based study",2000,"Cancer Research","60","24",,"6935","6941",,84,,"http://www.scopus.com/inward/record.url?eid=2-s2.0-0034671388&partnerID=40&md5=d050a12a6ce1b115a25fbf344f607ef6",Article,Scopus,2-s2.0-0034671388
"Ulrich, C.M., Bigler, J., Velicer, C.M., Greene, E.A., Farin, F.M., Potter, J.D.","Searching expressed sequence tag databases: Discovery and confirmation of a common polymorphism in the thymidylate synthase gene",2000,"Cancer Epidemiology Biomarkers and Prevention","9","12",,"1381","1385",,223,,"http://www.scopus.com/inward/record.url?eid=2-s2.0-0034518362&partnerID=40&md5=35af7e37c90e67b877203dba97fb81ad",Article,Scopus,2-s2.0-0034518362
"Slattery, M.L., Potter, J.D., Ma, K.-N., Caan, B.J., Leppert, M., Samowitz, W.","Western diet, family history of colorectal cancer, NAT2, GSTM-1 and risk of colon cancer",2000,"Cancer Causes and Control","11","1",,"1","8",,45,,"http://www.scopus.com/inward/record.url?eid=2-s2.0-0033628904&partnerID=40&md5=4b9e034ce48817114e86ce8669e05950",Article,Scopus,2-s2.0-0033628904
"Potter, J.D.","Your mother was right: Eat your vegetables",2000,"Asia Pacific Journal of Clinical Nutrition","9","SUPPL.",,"S10","S12",,11,,"http://www.scopus.com/inward/record.url?eid=2-s2.0-23044524903&partnerID=40&md5=592b6dc70fa8e95e5bec82acefc54d01",Article,Scopus,2-s2.0-23044524903
"Slattery, M.L., Curtin, K., Anderson, K., Ma, K.-N., Ballard, L., Edwards, S., Schaffer, D., Potter, J., Leppert, M., Samowitz, W.S.","Associations between cigarette smoking, lifestyle factors, and microsatellite instability in colon tumors",2000,"Journal of the National Cancer Institute","92","22",,"1831","1836",,239,,"http://www.scopus.com/inward/record.url?eid=2-s2.0-0034669076&partnerID=40&md5=2ca2c43075a40c20f3c8c455b416ef4a",Article,Scopus,2-s2.0-0034669076
"Lampe, J.W., Chen, C., Li, S., Prunty, J., Grate, M.T., Meehan, D.E., Barale, K.V., Dightman, D.A., Feng, Z., Potter, J.D.","Modulation of human glutathione S-transferases by botanically defined vegetable diets",2000,"Cancer Epidemiology Biomarkers and Prevention","9","8",,"787","793",,96,,"http://www.scopus.com/inward/record.url?eid=2-s2.0-0033839333&partnerID=40&md5=e7b01f4544cc4595533abc072e84e469",Article,Scopus,2-s2.0-0033839333
"Slattery, M.L., Kampman, E., Samowitz, W., Caan, B.J., Potter, J.D.","Interplay between dietary inducers of GST and the GSTM-1 genotype in colon cancer",2000,"International Journal of Cancer","87","5",,"728","733",,63,10.1002/1097-0215(20000901)87:5<728::AID-IJC16>3.0.CO;2-G,"http://www.scopus.com/inward/record.url?eid=2-s2.0-0033855218&partnerID=40&md5=38447a78e1d331980b135b16bb3d4579",Article,Scopus,2-s2.0-0033855218
"Gao, Y.-T., Shu, X.-O., Dai, Q., Potter, J.D., Brinton, L.A., Wen, W., Sellers, T.A., Kushi, L.H., Ruan, Z., Bostick, R.M., Jin, F., Zheng, W.","Association of menstrual and reproductive factors with breast cancer risk: Results from the Shanghai breast cancer study",2000,"International Journal of Cancer","87","2",,"295","300",,188,10.1002/1097-0215(20000715)87:2<295::AID-IJC23>3.0.CO;2-7,"http://www.scopus.com/inward/record.url?eid=2-s2.0-0034662320&partnerID=40&md5=7d9f1296c3a4f5857dda4b02857a4327",Article,Scopus,2-s2.0-0034662320
"Lampe, J.W., King, I.B., Li, S., Grate, M.T., Barale, K.V., Chen, C., Feng, Z., Potter, J.D.","Brassica vegetables increase and apiaceous vegetables decrease cytochrome P450 1A2 activity in humans: Changes in caffeine metabolite ratios in response to controlled vegetable diets",2000,"Carcinogenesis","21","6",,"1157","1162",,125,,"http://www.scopus.com/inward/record.url?eid=2-s2.0-0034051263&partnerID=40&md5=c9bbdc2444350b6f90ce690ee9fee390",Article,Scopus,2-s2.0-0034051263
"Kampman, E., Slattery, M.L., Caan, B., Potter, J.D.","Calcium, vitamin D, sunshine exposure, dairy products and colon cancer risk (United States)",2000,"Cancer Causes and Control","11","5",,"459","466",,156,10.1023/A:1008914108739,"http://www.scopus.com/inward/record.url?eid=2-s2.0-0034088554&partnerID=40&md5=6b0ba11a8ae408d37a760cb7167e9469",Article,Scopus,2-s2.0-0034088554
"Flood, D.M., Weiss, N.S., Cook, L.S., Emerson, J.C., Schwartz, S.M., Potter, J.D.","Colorectal cancer incidence in Asian migrants to the United States and their descendants",2000,"Cancer Causes and Control","11","5",,"403","411",,104,10.1023/A:1008955722425,"http://www.scopus.com/inward/record.url?eid=2-s2.0-0034046569&partnerID=40&md5=2a8f8a394aedad26ed564d7b9d023bf2",Article,Scopus,2-s2.0-0034046569
"Wen, W., Shu, X.O., Linet, M.S., Neglia, J.P., Potter, J.D., Trigg, M.E., Robison, L.L.","Allergic disorders and the risk of childhood acute lymphoblastic leukemia (United States)",2000,"Cancer Causes and Control","11","4",,"303","307",,53,10.1023/A:1008958724739,"http://www.scopus.com/inward/record.url?eid=2-s2.0-0034061420&partnerID=40&md5=a7fbad4a866fa8cfaf2acb3e9ed32859",Article,Scopus,2-s2.0-0034061420
"Ulrich, C.M., Kampman, E., Bigler, J., Schwartz, S.M., Chen, C., Bostick, R., Fosdick, L., Beresford, S.A.A., Yasui, Y., Potter, J.D.","Lack of association between the C677T MTHFR polymorphism and colorectal hyperplastic polyps",2000,"Cancer Epidemiology Biomarkers and Prevention","9","4",,"427","433",,34,,"http://www.scopus.com/inward/record.url?eid=2-s2.0-0034064209&partnerID=40&md5=7c5a910f2cff3a7c4bb280d66753fe3b",Article,Scopus,2-s2.0-0034064209
"Smith-Warner, S.A., Elmer, P.J., Tharp, T.M., Fosdick, L., Randall, B., Gross, M., Wood, J., Potter, J.D.","Increasing vegetable and fruit intake: Randomized intervention and monitoring in an at-risk population",2000,"Cancer Epidemiology Biomarkers and Prevention","9","3",,"307","317",,82,,"http://www.scopus.com/inward/record.url?eid=2-s2.0-0034022891&partnerID=40&md5=de4c12754483b2ba8da3036f5420a904",Article,Scopus,2-s2.0-0034022891
"Lampe, J.W., Bigler, J., Bush, A.C., Potter, J.D.","Prevalence of polymorphisms in the human UDP-glucuronosyltransferase 2B family: UGT2B4(D458E), UGT2B7(H268Y, and UGT2B15(D85Y)",2000,"Cancer Epidemiology Biomarkers and Prevention","9","3",,"329","333",,69,,"http://www.scopus.com/inward/record.url?eid=2-s2.0-0034118356&partnerID=40&md5=da94a34c52a596d551b2d27f6b5a8000",Article,Scopus,2-s2.0-0034118356
"Slattery, M.L., Benson, J., Curtin, K., Ma, K.-N., Schaeffer, D., Potter, J.D.","Carotenoids and colon cancer",2000,"American Journal of Clinical Nutrition","71","2",,"575","582",,197,,"http://www.scopus.com/inward/record.url?eid=2-s2.0-0033978051&partnerID=40&md5=90adddf71abc1d618aee9c05fe85e70c",Article,Scopus,2-s2.0-0033978051
"Neglia, J.P., Linet, M.S., Shu, X.O., Severson, R.K., Potter, J.D., Mertens, A.C., Wen, W., Kersey, J.H., Robison, L.L.","Patterns of infection and day care utilization and risk of childhood acute lymphoblastic leukaemia",2000,"British Journal of Cancer","82","1",,"234","240",,69,,"http://www.scopus.com/inward/record.url?eid=2-s2.0-0033988225&partnerID=40&md5=bde94a5bcb65707cc5093282f53e60d3",Article,Scopus,2-s2.0-0033988225
"Slattery, M.L., Edwards, S.L., Samowitz, W., Potter, J.","Associations between family history of cancer and genes coding for metabolizing enzymes (United States)",2000,"Cancer Causes and Control","11","9",,"799","803",,17,10.1023/A:1008912317909,"http://www.scopus.com/inward/record.url?eid=2-s2.0-0033788778&partnerID=40&md5=ce69e51eb5f5a51e7a6e2e2034d03ca9",Article,Scopus,2-s2.0-0033788778
"Ulrich, C.M., Kampman, E., Bigler, J., Schwartz, S.M., Chen, C., Bostick, R., Fosdick, L., Beresford, S.A.A., Yasui, Y., Potter, J.D.","Colorectal adenomas and the C677T MTHFR polymorphism: Evidence for gene- environment interaction?",1999,"Cancer Epidemiology Biomarkers and Prevention","8","8",,"659","668",,201,,"http://www.scopus.com/inward/record.url?eid=2-s2.0-0033370552&partnerID=40&md5=c9f39e584a929998bbca77869caa63fd",Article,Scopus,2-s2.0-0033370552
"Patterson, R.E., Eaton, D.L., Potter, J.D.","The genetic revolution: Change and challenge for the dietetics profession",1999,"Journal of the American Dietetic Association","99","11",,"1412","1420",,24,10.1016/S0002-8223(99)00341-7,"http://www.scopus.com/inward/record.url?eid=2-s2.0-0032694533&partnerID=40&md5=189f4896857b9109a46f4224d92c0de6",Review,Scopus,2-s2.0-0032694533
"Shu, X.O., Linet, M.S., Steinbuch, M., Wen, W.Q., Buckley, J.D., Neglia, J.P., Potter, J.D., Reaman, G.H., Robison, L.L.","Breast-feeding and risk of childhood acute leukemia",1999,"Journal of the National Cancer Institute","91","20",,"1765","1772",,119,,"http://www.scopus.com/inward/record.url?eid=2-s2.0-0033589325&partnerID=40&md5=32536699c9a5736363c80b68b70834fc",Article,Scopus,2-s2.0-0033589325
"Slattery, M.L., Anderson, K., Samowitz, W., Edwards, S.L., Curtin, K., Caan, B., Potter, J.D.","Hormone replacement therapy and improved survival among postmenopausal women diagnosed with colon cancer (USA)",1999,"Cancer Causes and Control","10","5",,"467","473",,46,10.1023/A:1008974215622,"http://www.scopus.com/inward/record.url?eid=2-s2.0-0032827975&partnerID=40&md5=9925a428920a6c271ce2013301012147",Article,Scopus,2-s2.0-0032827975
"Yasui, Y., Potter, J.D.","The shape of age-incidence curves of female breast cancer by hormone-receptor status",1999,"Cancer Causes and Control","10","5",,"431","437",,103,10.1023/A:1008970121595,"http://www.scopus.com/inward/record.url?eid=2-s2.0-0032879195&partnerID=40&md5=4814e82515f63a28f9e89ff37e994e3d",Article,Scopus,2-s2.0-0032879195
"Sturmer, T., Brenner, H., Potter, J.D., Terry, M.B., Neugut, A.I.","Re: 'Cigarette smoking and the colorectal adenoma-carcinoma sequence: A hypothesis to explain the paradox' [1] (multiple letters)",1999,"American Journal of Epidemiology","150","5",,"541","543",,1,,"http://www.scopus.com/inward/record.url?eid=2-s2.0-0033199479&partnerID=40&md5=0cab7a536d1b9bad244adc77316efc6c",Letter,Scopus,2-s2.0-0033199479
"Shu, X.O., Stewart, P., Wen, W.-Q., Han, D., Potter, J.D., Buckley, J.D., Heineman, E., Robison, L.L.","Parental occupational exposure to hydrocarbons and risk of acute lymphocytic leukemia in offspring",1999,"Cancer Epidemiology Biomarkers and Prevention","8","9",,"783","791",,76,,"http://www.scopus.com/inward/record.url?eid=2-s2.0-0344563528&partnerID=40&md5=7dc1b71765e655aef428ab7ff4eea595",Article,Scopus,2-s2.0-0344563528
"Lampe, J.W., Bigler, J., Horner, N.K., Potter, J.D.","UDP-glucuronosyltransferase (UGT1A1*28 and UGT1A6*2) polymorphisms in Caucasians and Asians: Relationships to serum bilirubin concentrations",1999,"Pharmacogenetics","9","3",,"341","349",,161,,"http://www.scopus.com/inward/record.url?eid=2-s2.0-0032767352&partnerID=40&md5=24372fa0598f67d2796e3c73bb978a26",Article,Scopus,2-s2.0-0032767352
"Lampe, J.W., Gustafson, D.R., Hutchins, A.M., Martini, M.C., Li, S., Wähälä, K., Grandits, G.A., Potter, J.D., Slavin, J.L.","Urinary isoflavonoid and lignan excretion on a Western diet: Relation to soy, vegetable, and fruit intake",1999,"Cancer Epidemiology Biomarkers and Prevention","8","8",,"699","707",,106,,"http://www.scopus.com/inward/record.url?eid=2-s2.0-0033388760&partnerID=40&md5=d94521d30a2c46a4a258c34141013053",Article,Scopus,2-s2.0-0033388760
"Chiu, B.C.-H., Cerhan, J.R., Gapstur, S.M., Sellers, T.A., Zheng, W., Lutz, C.T., Wallace, R.B., Potter, J.D.","Alcohol consumption and non-Hodgkin lymphoma in a cohort of older women",1999,"British Journal of Cancer","80","9",,"1476","1482",,52,10.1038/sj.bjc.6690547,"http://www.scopus.com/inward/record.url?eid=2-s2.0-0033058640&partnerID=40&md5=f448a5e98ad5e3a95da54bbe507cb608",Article,Scopus,2-s2.0-0033058640
"Potter, J.D.","Colorectal cancer: Molecules and populations",1999,"Journal of the National Cancer Institute","91","11",,"916","932",,647,,"http://www.scopus.com/inward/record.url?eid=2-s2.0-0033516320&partnerID=40&md5=425d85dab84667dc76b84dfb7d091979",Review,Scopus,2-s2.0-0033516320
"Slattery, M.L., Caan, B.J., Anderson, K.E., Potter, J.D.","Intake of fluids and methylxanthine-containing beverages: Association with colon cancer",1999,"International Journal of Cancer","81","2",,"199","204",,42,10.1002/(SICI)1097-0215(19990412)81:2<199::AID-IJC6>3.0.CO;2-7,"http://www.scopus.com/inward/record.url?eid=2-s2.0-0032911223&partnerID=40&md5=8c406e67b9098df7886b4e87e00d4556",Article,Scopus,2-s2.0-0032911223
"Brondum, J., Shu, X.-O., Steinbuch, M., Severson, R.K., Potter, J.D., Robison, L.L.","Parental cigarette smoking and the risk of acute leukemia in children",1999,"Cancer","85","6",,"1380","1388",,70,10.1002/(SICI)1097-0142(19990315)85:6<1380::AID-CNCR23>3.0.CO;2-O,"http://www.scopus.com/inward/record.url?eid=2-s2.0-0033559596&partnerID=40&md5=ff91e1719ce27652c7c6f01e0f6529d7",Article,Scopus,2-s2.0-0033559596
"McTiernan, A., Schwartz, R.S., Potter, J., Bowen, D.","Exercise clinical trials in cancer prevention research: A call to action",1999,"Cancer Epidemiology Biomarkers and Prevention","8","3",,"201","207",,41,,"http://www.scopus.com/inward/record.url?eid=2-s2.0-0032963656&partnerID=40&md5=ac336f971ce2383d488d48552501b54e",Article,Scopus,2-s2.0-0032963656
"Potter, J.D.","Fiber and colorectal cancer - Where to now?",1999,"New England Journal of Medicine","340","3",,"223","224",,16,10.1056/NEJM199901213400309,"http://www.scopus.com/inward/record.url?eid=2-s2.0-0033590551&partnerID=40&md5=f32fd0b1589beb49731d720ad8be1c2b",Editorial,Scopus,2-s2.0-0033590551
"Kampman, E., Slattery, M.L., Bigler, J., Leppert, M., Samowitz, W., Caan, B.J., Potter, J.D.","Meat consumption, genetic susceptibility, and colon cancer risk: A United States multicenter case-control study",1999,"Cancer Epidemiology Biomarkers and Prevention","8","1",,"15","24",,159,,"http://www.scopus.com/inward/record.url?eid=2-s2.0-0033024334&partnerID=40&md5=1083acfe47902c4d633d6048483ac50b",Article,Scopus,2-s2.0-0033024334
"Slattery, M.L., Potter, J.D., Samowitz, W., Schaffer, D., Leppert, M.","Methylenetetrahydrofolate reductase, diet, and risk of colon cancer",1999,"Cancer Epidemiology Biomarkers and Prevention","8","6",,"513","518",,288,,"http://www.scopus.com/inward/record.url?eid=2-s2.0-0033014832&partnerID=40&md5=1b8ab640a416dcf23be32f04d0454e13",Article,Scopus,2-s2.0-0033014832
"Zhao, L.P., Aragaki, C., Hsu, L., Potter, J., Elston, R., Malone, K.E., Daling, J.R., Prentice, R.","Integrated designs for gene discovery and characterization.",1999,"Journal of the National Cancer Institute. Monographs",,"26",,"71","80",,1,,"http://www.scopus.com/inward/record.url?eid=2-s2.0-0033291590&partnerID=40&md5=8e3f4cdfd2684e0510cd68cbde701201",Review,Scopus,2-s2.0-0033291590
"McTiernan, A., Ulrich, C.M., Yancey, D., Slate, S., Nakamura, H., Oestreicher, N., Bowen, D., Yasui, Y., Potter, J., Schwartz, R.","The Physical Activity for Total Health (PATH) study: Rationale and Design",1999,"Medicine and Science in Sports and Exercise","31","9",,"1307","1312",,76,10.1097/00005768-199909000-00012,"http://www.scopus.com/inward/record.url?eid=2-s2.0-0032850412&partnerID=40&md5=f3654c4967e021077d67809b5ec91fa0",Article,Scopus,2-s2.0-0032850412
"Todoroki, I., Friedman, G.D., Slattery, M.L., Potter, J.D., Samowitz, W., Tassios, P.","Cholecystectomy and risk of colon cancer",1999,"Hellenic Journal of Gastroenterology","12","2",,"133","",,,,"http://www.scopus.com/inward/record.url?eid=2-s2.0-0032725404&partnerID=40&md5=29370e89d463fafd6d2a52948fd05b00",Note,Scopus,2-s2.0-0032725404
"Samowitz, W.S., Slattery, M.L., Potter, J.D., Leppert, M.F.","BAT-26 and BAT-40 instability in colorectal adenomas and carcinomas and germline polymorphisms",1999,"American Journal of Pathology","154","6",,"1637","1641",,90,,"http://www.scopus.com/inward/record.url?eid=2-s2.0-0033023005&partnerID=40&md5=1e04d8fff699b7d968db9856eeee1fd3",Article,Scopus,2-s2.0-0033023005
"Potter, J.D., Bigler, J., Fosdick, L., Bostick, R.M., Kampman, E., Chen, C., Louis, T.A., Grambsch, P.","Colorectal adenomatous and hyperplastic polyps: Smoking and N- acetyltransferase 2 polymorphisms",1999,"Cancer Epidemiology Biomarkers and Prevention","8","1",,"69","75",,82,,"http://www.scopus.com/inward/record.url?eid=2-s2.0-0032996413&partnerID=40&md5=54b6ca4d34b089efa63ef7991b338d29",Article,Scopus,2-s2.0-0032996413
"Todoroki, I., Friedman, G.D., Slattery, M.L., Potter, J.D., Samowitz, W.","Cholecystectomy and the risk of colon cancer",1999,"American Journal of Gastroenterology","94","1",,"41","46",,32,10.1111/j.1572-0241.1999.00769.x,"http://www.scopus.com/inward/record.url?eid=2-s2.0-0032922246&partnerID=40&md5=c63965633aab0b19d691e334e345ccf2",Article,Scopus,2-s2.0-0032922246
"Ulrich, C.M., Kristal, A.R., White, E., Hunt, J.R., Durfy, S.J., Potter, J.D.","Genetic testing for cancer risk: a population survey on attitudes and intention.",1998,"Community genetics","1","4",,"213","222",,45,,"http://www.scopus.com/inward/record.url?eid=2-s2.0-0032227550&partnerID=40&md5=d5cd468475b9811fa522df9a9d3d5d9f",Article,Scopus,2-s2.0-0032227550
"Slattery, M.L., Potter, J.D., Samowitz, W., Bigler, J., Caan, B., Leppert, M.","NAT2, GSTM-1, cigarette smoking, and risk of colon cancer",1998,"Cancer Epidemiology Biomarkers and Prevention","7","12",,"1079","1084",,73,,"http://www.scopus.com/inward/record.url?eid=2-s2.0-0032408020&partnerID=40&md5=2bb19b758a6267f4b0d0928867e91786",Article,Scopus,2-s2.0-0032408020
"McTiernan, A., Ulrich, C., Slate, S., Potter, J.","Physical activity and cancer etiology: Associations and mechanisms",1998,"Cancer Causes and Control","9","5",,"487","509",,230,10.1023/A:1008853601471,"http://www.scopus.com/inward/record.url?eid=2-s2.0-0032432951&partnerID=40&md5=5ff183c322c3d07b23c0d2121b9f0340",Article,Scopus,2-s2.0-0032432951
"Mertens, A.C., Wen, W., Davies, S.M., Steinbuch, M., Buckley, J.D., Potter, J.D., Robison, L.L.","Congenital abnormalities in children with acute leukemia: A report from the Children's Cancer Group",1998,"Journal of Pediatrics","133","5",,"617","623",,49,,"http://www.scopus.com/inward/record.url?eid=2-s2.0-0031771859&partnerID=40&md5=f7c7f72c274dd690bad98d13c7db9ef6",Article,Scopus,2-s2.0-0031771859
"Yang, G., Zheng, W., Sun, Q.-R., Shu, X.-O., Li, W.-D., Yu, H., Shen, G.-F., Shen, Y.-Z., Potter, J.D., Zheng, S.","Pathologic features of initial adenomas as predictors for metachronous adenomas of the rectum",1998,"Journal of the National Cancer Institute","90","21",,"1661","1665",,62,,"http://www.scopus.com/inward/record.url?eid=2-s2.0-0032483680&partnerID=40&md5=21bb6aae069c73dd2566eb7dfa5d4e99",Article,Scopus,2-s2.0-0032483680
"Kerber, R.A., Slattery, M.L., Potter, J.D., Caan, B.J., Edwards, S.L.","Risk of colon cancer associated with a family history of cancer or colorectal polyps: The Diet, Activity, and Reproduction in Colon Cancer Study",1998,"International Journal of Cancer","78","2",,"157","160",,31,10.1002/(SICI)1097-0215(19981005)78:2<157::AID-IJC6>3.0.CO;2-Y,"http://www.scopus.com/inward/record.url?eid=2-s2.0-0031660124&partnerID=40&md5=dd8909f12ef1e4313363b86280db45cf",Article,Scopus,2-s2.0-0031660124
"Patterson, R.E., Neuhouser, M.L., White, E., Kristal, A.R., Potter, J.D.","Measurement error from assessing use of vitamin supplements at one point in time",1998,"Epidemiology","9","5",,"567","569",,24,,"http://www.scopus.com/inward/record.url?eid=2-s2.0-0031841937&partnerID=40&md5=d9673a0dea65693095a565c1f7cfc7c5",Article,Scopus,2-s2.0-0031841937
"Potter, J.D.","Erratum: Old problem, new wrinkles: (American Journal of Epidemiology (1998) 147 (911-913))",1998,"American Journal of Epidemiology","148","3",,"314","",,,,"http://www.scopus.com/inward/record.url?eid=2-s2.0-0032147037&partnerID=40&md5=110f672eecc50406e23fca28383daf7d",Erratum,Scopus,2-s2.0-0032147037
"Slattery, M.L., Boucher, K.M., Caan, B.J., Potter, J.D., Ma, K.-N.","Eating patterns and risk of colon cancer",1998,"American Journal of Epidemiology","148","1",,"4","16",,363,,"http://www.scopus.com/inward/record.url?eid=2-s2.0-0032125773&partnerID=40&md5=4e5e1c3c80698fb59fc4a42a670de3a4",Article,Scopus,2-s2.0-0032125773
"McTiernan, A., Ulrich, C., Kumai, C., Bean, D., Schwartz, R., Mahloch, J., Hastings, R., Gralow, J., Potter, J.D.","Anthropometric and hormone effects of an eight-week exercise-diet intervention in breast cancer patients: Results of a pilot study",1998,"Cancer Epidemiology Biomarkers and Prevention","7","6",,"477","481",,46,,"http://www.scopus.com/inward/record.url?eid=2-s2.0-0031903631&partnerID=40&md5=8c2a6c286c0e4679ea54466d30369c1e",Article,Scopus,2-s2.0-0031903631
"Potter, J.D.","Invited commentary: Old problem, new wrinkles",1998,"American Journal of Epidemiology","147","10",,"911","913",,7,,"http://www.scopus.com/inward/record.url?eid=2-s2.0-0032523551&partnerID=40&md5=d7cf728e36c89bb44adc21731ac50894",Article,Scopus,2-s2.0-0032523551
"Lowenfels, A.B., Urbach, D.R., Bell, C.M., Thun, M.J., Peto, R., Heath C.W., Jr., Potter, J.D.","Alcohol consumption and mortality in U.S. adults [2] (multiple letters)",1998,"New England Journal of Medicine","338","19",,"1385","1386",,3,10.1056/NEJM199805073381913,"http://www.scopus.com/inward/record.url?eid=2-s2.0-0032493090&partnerID=40&md5=6641ad0cc8c5367ee4e44cb465eedc50",Letter,Scopus,2-s2.0-0032493090
"Smith-Warner, S.A., Spiegelman, D., Yaun, S.-S., Van Den Brandt, P.A., Folsom, A.R., Goldbohm, R.A., Graham, S., Holmberg, L., Howe, G.R., Marshall, J.R., Miller, A.B., Potter, J.D., Speizer, F.E., Willett, W.C., Wolk, A., Hunter, D.J.","Alcohol and breast cancer in women: A pooled analysis of cohort studies",1998,"Journal of the American Medical Association","279","7",,"535","540",,610,10.1001/jama.279.7.535,"http://www.scopus.com/inward/record.url?eid=2-s2.0-0032542542&partnerID=40&md5=e511d3e8b4b43032cdbc73c8e0b1e6e9",Review,Scopus,2-s2.0-0032542542
