Authors,Title,Year,Source title,Volume,Issue,Art. No.,Page start,Page end,Page count,Cited by,DOI,Link,Document Type,Source,EID
"Slattery, M.L., Sweeney, C., Murtaugh, M., Ma, K.N., Potter, J.D., Levin, T.R., Samowitz, W., Wolff, R.","Associations between apoE genotype and colon and rectal cancer",2005,"Carcinogenesis","26","8",,"1422","1429",,24,10.1093/carcin/bgi088,"http://www.scopus.com/inward/record.url?eid=2-s2.0-24944587311&partnerID=40&md5=b5e9af74248c8241ce5dba004453fb2b",Article,Scopus,2-s2.0-24944587311
"Greenberg, E.R., Alberts, D.S., Potter, J.D.","Introduction: What should we do now about H. pylori?",2005,"Cancer Epidemiology Biomarkers and Prevention","14","8",,"1851","1852",,2,10.1158/1055-9965.EPI-05-0455,"http://www.scopus.com/inward/record.url?eid=2-s2.0-23844503239&partnerID=40&md5=41bf690ee8404e82494f84991f7ab4dc",Editorial,Scopus,2-s2.0-23844503239
"Kolar, A.S., Patterson, R.E., White, E., Neuhouser, M.L., Frank, L.L., Standley, J., Potter, J.D., Kristal, A.R.","A practical method for collecting 3-day food records in a large cohort",2005,"Epidemiology","16","4",,"579","583",,36,10.1097/01.ede.0000165363.27323.ac,"http://www.scopus.com/inward/record.url?eid=2-s2.0-20544436739&partnerID=40&md5=529123389c1954cc805d9441d8b01cbd",Article,Scopus,2-s2.0-20544436739
"Weis, B.K., Balshaw, D., Barr, J.R., Brown, D., Ellisman, M., Lioy, P., Omenn, G., Potter, J.D., Smith, M.T., Sohn, L., Suk, W.A., Sumner, S., Swenberg, J., Walt, D.R., Watkins, S., Thompson, C., Wilson, S.H.","Personalized exposure assessment: Promising approaches for human environmental health research",2005,"Environmental Health Perspectives","113","7",,"840","848",,64,10.1289/ehp.7651,"http://www.scopus.com/inward/record.url?eid=2-s2.0-22144456709&partnerID=40&md5=e45e5036ed37af3f8c8b040e5e47e743",Review,Scopus,2-s2.0-22144456709
"Kuehl, G.E., Lampe, J.W., Potter, J.D., Bigler, J.","Glucuronidation of nonsteroidal anti-inflammatory drugs: identifying the enzymes responsible in human liver microsomes",2005,"Drug Metabolism and Disposition","33","7",,"1027","1035",,103,10.1124/dmd.104.002527,"http://www.scopus.com/inward/record.url?eid=2-s2.0-22344442057&partnerID=40&md5=35e166b297ac0d9656e85eb6f647a7eb",Article,Scopus,2-s2.0-22344442057
"Slattery, M.L., Murtaugh, M.A., Sweeney, C., Ma, K.-N., Potter, J.D., Caan, B.J., Samowitz, W.","PPARγ, energy balance, and associations with colon and rectal cancer",2005,"Nutrition and Cancer","51","2",,"155","161",,18,10.1207/s15327914nc5102_5,"http://www.scopus.com/inward/record.url?eid=2-s2.0-19544378683&partnerID=40&md5=18827693cf16c7f698e9e01000f70d3f",Article,Scopus,2-s2.0-19544378683
"Aiello, E.J., Tworoger, S.S., Yasui, Y., Stanczyk, F.Z., Potter, J., Ulrich, C.M., Irwin, M., McTiernan, A.","Associations among circulating sex hormones, insulin-like growth factor, lipids, and mammographic density in postmenopausal women",2005,"Cancer Epidemiology Biomarkers and Prevention","14","6",,"1411","1417",,58,10.1158/1055-9965.EPI-04-0920,"http://www.scopus.com/inward/record.url?eid=2-s2.0-20444394741&partnerID=40&md5=14556f5c2467ea428c79b37dbd85b2fa",Article,Scopus,2-s2.0-20444394741
"Morimoto, L.M., Newcomb, P.A., White, E., Bigler, J., Potter, J.D.","Variation in plasma insulin-like growth factor-1 and insulin-like growth factor binding protein-3: Genetic factors",2005,"Cancer Epidemiology Biomarkers and Prevention","14","6",,"1394","1401",,38,10.1158/1055-9965.EPI-04-0694,"http://www.scopus.com/inward/record.url?eid=2-s2.0-20444412679&partnerID=40&md5=d2811086b4c9bcc97242a651ae83f1ee",Article,Scopus,2-s2.0-20444412679
"Robien, K., Curtin, K., Ulrich, C.M., Bigler, J., Samowitz, W., Caan, B., Potter, J.D., Slattery, M.L.","Microsomal epoxide hydrolase polymorphisms are not associated with colon cancer risk",2005,"Cancer Epidemiology Biomarkers and Prevention","14","5",,"1350","1352",,19,10.1158/1055-9965.EPI-04-0877,"http://www.scopus.com/inward/record.url?eid=2-s2.0-18544371034&partnerID=40&md5=7dd89411b0724c35212e1ca203300335",Article,Scopus,2-s2.0-18544371034
"Peterson, S., Bigler, J., Horner, N.K., Potter, J.D., Lampe, J.W.","Cruciferase interact with the UGT1A1*28 polymorphism to determine serum bilirubin levels in humans",2005,"Journal of Nutrition","135","5",,"1051","1055",,21,,"http://www.scopus.com/inward/record.url?eid=2-s2.0-18344383946&partnerID=40&md5=ea23cf881f0ca5d9572e7ff65a5fe86a",Article,Scopus,2-s2.0-18344383946
"Murtaugh, M.A., Ma, K.-N., Caan, B.J., Sweeney, C., Wolff, R., Samowitz, W.S., Potter, J.D., Slattery, M.L.","Interactions of peroxisome proliferator-activated receptor γ and diet in etiology of colorectal cancer",2005,"Cancer Epidemiology Biomarkers and Prevention","14","5",,"1224","1229",,27,10.1158/1055-9965.EPI-04-0681,"http://www.scopus.com/inward/record.url?eid=2-s2.0-18544373384&partnerID=40&md5=a90735bde9d375a3f16f1d37022ff295",Article,Scopus,2-s2.0-18544373384
"Morimoto, L.M., Newcomb, P.A., White, E., Bigler, J., Potter, J.D.","Insulin-like growth factor polymorphisms and colorectal cancer risk",2005,"Cancer Epidemiology Biomarkers and Prevention","14","5",,"1204","1211",,47,10.1158/1055-9965.EPI-04-0695,"http://www.scopus.com/inward/record.url?eid=2-s2.0-18544371186&partnerID=40&md5=2502a8172966eab14f9f3d2fad497a95",Article,Scopus,2-s2.0-18544371186
"Lindor, N.M., Rabe, K., Petersen, G.M., Haile, R., Casey, G., Baron, J., Gallinger, S., Bapat, B., Aronson, M., Hopper, J., Jass, J., LeMarchand, L., Grove, J., Potter, J., Newcomb, P., Terdiman, J.P., Conrad, P., Moslein, G., Goldberg, R., Ziogas, A., Anton-Culver, H., De Andrade, M., Siegmund, K., Thibodeau, S.N., Boardman, L.A., Seminara, D.","Lower cancer incidence in Amsterdam-I criteria families without mismatch repair deficiency: Familial colorectal cancer type X",2005,"Journal of the American Medical Association","293","16",,"1979","1985",,341,10.1001/jama.293.16.1979,"http://www.scopus.com/inward/record.url?eid=2-s2.0-20244386256&partnerID=40&md5=4a220c88004bed508512e7f2cc06bf81",Article,Scopus,2-s2.0-20244386256
"McTiernan, A., Sorensen, B., Yasui, Y., Tworoger, S.S., Ulrich, C.M., Irwin, M.L., Rudolph, R.E., Stanczyk, F.Z., Schwartz, R.S., Potter, J.D.","No effect of exercise on insulin-like growth factor 1 and insulin-like growth factor binding protein 3 in postmenopausal women: A 12-month randomized clinical trial",2005,"Cancer Epidemiology Biomarkers and Prevention","14","4",,"1020","1021",,31,10.1158/1055-9965.EPI-04-0834,"http://www.scopus.com/inward/record.url?eid=2-s2.0-20144387693&partnerID=40&md5=be9ded40db0844c371c60153a501f092",Article,Scopus,2-s2.0-20144387693
"Ulrich, C.M., Whitton, J., Yu, J.-H., Sibert, J., Sparks, R., Potter, J.D., Bigler, J.","PTGS2 (COX-2) -765G > C promoter variant reduces risk of colorectal adenoma among nonusers of nonsteroidal anti-inflammatory drugs",2005,"Cancer Epidemiology Biomarkers and Prevention","14","3",,"616","619",,100,10.1158/1055-9965.EPI-04-0510,"http://www.scopus.com/inward/record.url?eid=2-s2.0-16844364790&partnerID=40&md5=286e9b9737fd27dd7382345589ad05bd",Article,Scopus,2-s2.0-16844364790
"Spector, L.G., Xie, Y., Robison, L.L., Heerema, N.A., Hilden, J.M., Lange, B., Felix, C.A., Davies, S.M., Slavin, J., Potter, J.D., Blair, C.K., Reaman, G.H., Ross, J.A.","Maternal diet and infant leukemia: The DNA topoisomerase II inhibitor hypothesis: A report from the Children's Oncology Group",2005,"Cancer Epidemiology Biomarkers and Prevention","14","3",,"651","655",,103,10.1158/1055-9965.EPI-04-0602,"http://www.scopus.com/inward/record.url?eid=2-s2.0-20144389914&partnerID=40&md5=f7a7d2e86abbcb0a4d857661d2f5dfca",Article,Scopus,2-s2.0-20144389914
"Rudolph, R.E., Dominitz, J.A., Lampe, J.W., Levy, L., Qu, P., Li, S.S., Lampe, P.D., Bronner, M.P., Potter, J.D.","Risk factors for colorectal cancer in relation to number and size of aberrant crypt foci in humans",2005,"Cancer Epidemiology Biomarkers and Prevention","14","3",,"605","608",,44,10.1158/1055-9965.EPI-04-0058,"http://www.scopus.com/inward/record.url?eid=2-s2.0-16844381852&partnerID=40&md5=dcd6231f4c7f9f75163518d815d30bf5",Article,Scopus,2-s2.0-16844381852
"Alberts, D.S., Potter, J.D., Martinez, M.E., Hess, L.M., Stopeck, A., Lance, P.","What happened to the coxibs on the way to the cardiologist?",2005,"Cancer Epidemiology Biomarkers and Prevention","14","3",,"555","556",,4,10.1158/1055-9965.EPI-14-3-EDA,"http://www.scopus.com/inward/record.url?eid=2-s2.0-16844368035&partnerID=40&md5=be0a560c8dfbd7da052c0d580daabf81",Editorial,Scopus,2-s2.0-16844368035
"Potter, J.D., Alberts, D.S.","The state of CEBP 2005",2005,"Cancer Epidemiology Biomarkers and Prevention","14","1",,"1","",,,,"http://www.scopus.com/inward/record.url?eid=2-s2.0-12844272785&partnerID=40&md5=60b2fc1dede7f0efde18f3ed8e1d1781",Editorial,Scopus,2-s2.0-12844272785
"Robien, K., Ulrich, C.M., Bigler, J., Yasui, Y., Gooley, T., Bruemmer, B., Potter, J.D., Radich, J.P.","Methylenetetrahydrofolate reductase genotype affects risk of relapse after hematopoietic cell transplantation for chronic myelogenous leukemia",2004,"Clinical Cancer Research","10","22",,"7592","7598",,39,10.1158/1078-0432.CCR-04-1057,"http://www.scopus.com/inward/record.url?eid=2-s2.0-9344266353&partnerID=40&md5=7bf8e9287cb1540e14e518c8472606a9",Article,Scopus,2-s2.0-9344266353
"Aiello, E.J., Yasui, Y., Tworoger, S.S., Ulrich, C.M., Irwin, M.L., Bowen, D., Schwartz, R.S., Kumai, C., Potter, J.D., McTiernan, A.","Effect of a yearlong, moderate-intensity exercise intervention on the occurrence and severity of menopause symptoms in postmenopausal women",2004,"Menopause","11","4",,"382","388",,74,10.1097/01.GME.0000113932.56832.27,"http://www.scopus.com/inward/record.url?eid=2-s2.0-4644363381&partnerID=40&md5=4e8620a3b2be6c69782c71d17765683f",Article,Scopus,2-s2.0-4644363381
"Robien, K., Schubert, M.M., Bruemmer, B., Lloid, M.E., Potter, J.D., Ulrich, C.M.","Predictors of oral mucositis in patients receiving hematopoietic cell transplants for chronic myelogenous leukemia",2004,"Journal of Clinical Oncology","22","7",,"1268","1275",,95,10.1200/JCO.2004.05.147,"http://www.scopus.com/inward/record.url?eid=2-s2.0-2142820811&partnerID=40&md5=8dd4aef39cefb7fa5acac4e89fcf3164",Article,Scopus,2-s2.0-2142820811
"Tworoger, S.S., Chubak, J., Aiello, E.J., Yasui, Y., Ulrich, C.M., Farin, F.M., Stapleton, P.L., Irwin, M.L., Potter, J.D., Schwartz, R.S., McTiernan, A.","The effect of CYP19 and COMT polymorphisms on exercise-induced fat loss in postmenopausal women",2004,"Obesity Research","12","6",,"972","981",,30,,"http://www.scopus.com/inward/record.url?eid=2-s2.0-4644338633&partnerID=40&md5=08a00fc31204cc1cb8cf84375b63511f",Article,Scopus,2-s2.0-4644338633
"Rebbeck, T.R., Martínez, M.E., Sellers, T.A., Shields, P.G., Wild, C.P., Potter, J.D.","Genetic variation and cancer: Improving the environment for publication of association studies",2004,"Cancer Epidemiology Biomarkers and Prevention","13","12",,"1985","1986",,62,,"http://www.scopus.com/inward/record.url?eid=2-s2.0-11144234071&partnerID=40&md5=6c177662ba85e293f9147238392b55bf",Editorial,Scopus,2-s2.0-11144234071
"Boland, C.R., Bigler, J., Newcomb, P.A., Lampe, J.W., Potter, J.D.","Evidence for an association between JC virus and colorectal neoplasia (multiple letters)",2004,"Cancer Epidemiology Biomarkers and Prevention","13","12",,"2285","2286",,9,,"http://www.scopus.com/inward/record.url?eid=2-s2.0-11144248929&partnerID=40&md5=d8cddf33b769185eb7d2d902d88fccd8",Letter,Scopus,2-s2.0-11144248929
"Irwin, M.L., Tworoger, S.S., Yasui, Y., Rajan, B., McVarish, L., LaCroix, K., Ulrich, C.M., Bowen, D., Schwartz, R.S., Potter, J.D., McTiernan, A.","Influence of demographic, physiologic, and psychosocial variables on adherence to a yearlong moderate-intensity exercise trial in postmenopausal women",2004,"Preventive Medicine","39","6",,"1080","1086",,33,10.1016/j.ypmed.2004.04.017,"http://www.scopus.com/inward/record.url?eid=2-s2.0-20844458249&partnerID=40&md5=296fda65fbf23cc732c29ce25ecfe8e1",Article,Scopus,2-s2.0-20844458249
"Slattery, M.L., Ballard-Barbash, R., Potter, J.D., Ma, K.-N., Caan, B.J., Anderson, K., Samowitz, W.","Sex-specific differences in colon cancer associated with p53 mutations",2004,"Nutrition and Cancer","49","1",,"41","48",,8,,"http://www.scopus.com/inward/record.url?eid=2-s2.0-4644276333&partnerID=40&md5=dc7d3a73e5a9dec88b6e3144aa37f38a",Article,Scopus,2-s2.0-4644276333
"Sparks, R., Bigler, J., Sibert, J.G., Potter, J.D., Yasui, Y., Ulrich, C.M.","TGFβ1 polymorphism (L10P) and risk of colorectal adenomatous and hyperplastic polyps",2004,"International Journal of Epidemiology","33","5",,"955","961",,17,10.1093/ije/dyh102,"http://www.scopus.com/inward/record.url?eid=2-s2.0-5444254947&partnerID=40&md5=865194698ef5a680fd73973060a58bd6",Article,Scopus,2-s2.0-5444254947
"Mertens, A.C., Mitby, P.A., Radloff, G., Jones, I.M., Perentesis, J., Kiffmeyer, W.R., Neglia, J.P., Meadows, A., Potter, J.D., Friedman, D., Yasui, Y., Robison, L.L., Davies, S.M.","XRCC1 and glutathione-S-transferase gene polymorphisms and susceptibility to radiotherapy-related malignancies in survivors of Hodgkin disease: A report from the Childhood Cancer Survivor Study",2004,"Cancer","101","6",,"1463","1472",,41,10.1002/cncr.20520,"http://www.scopus.com/inward/record.url?eid=2-s2.0-4444264021&partnerID=40&md5=78d2f116e7b647a6c086174d95a67e47",Article,Scopus,2-s2.0-4444264021
"Mertens, A.C., Walls, R.S., Taylor, L., Mitby, P.A., Whitton, J., Inskip, P.D., Potter, J.D., Robison, L.L.","Characteristics of childhood cancer survivors predicted their successful tracing",2004,"Journal of Clinical Epidemiology","57","9",,"933","944",,35,10.1016/j.jclinepi.2004.01.005,"http://www.scopus.com/inward/record.url?eid=2-s2.0-7044269129&partnerID=40&md5=bb614c6711742449c0f919709c4b9abf",Article,Scopus,2-s2.0-7044269129
"Link, L.B., Potter, J.D.","Raw versus cooked vegetables and cancer risk",2004,"Cancer Epidemiology Biomarkers and Prevention","13","9",,"1422","1435",,29,,"http://www.scopus.com/inward/record.url?eid=2-s2.0-4444323260&partnerID=40&md5=76f5874eb4c969f50528c3d21da77309",Review,Scopus,2-s2.0-4444323260
"Prentice, R.L., Willet, W.C., Greenwald, P., Alberts, D., Bernstein, L., Boyd, N.F., Byers, T., Clinton, S.K., Fraser, G., Freedman, L., Hunter, D., Kipnis, V., Kolonel, L.N., Kristal, B.S., Kristal, A., Lampe, J.W., McTiernan, A., Milner, J., Patterson, R.E., Potter, J.D., Riboli, E., Schatzkin, A., Yates, A., Yetley, E.","Nutrition and physical activity and chronic disease prevention: Research strategies and recommendations",2004,"Journal of the National Cancer Institute","96","17",,"1276","1287",,50,10.1093/jnci/djh240,"http://www.scopus.com/inward/record.url?eid=2-s2.0-4444377711&partnerID=40&md5=b940c958134b6230b4e538648f611417",Article,Scopus,2-s2.0-4444377711
"Cho, E., Smith-Warner, S.A., Spiegelman, D., Beeson, W.L., van den Brandt, P.A., Colditz, G.A., Folsom, A.R., Fraser, G.E., Freudenheim, J.L., Giovannucci, E., Goldbohm, R.A., Graham, S., Miller, A.B., Pietinen, P., Potter, J.D., Rohan, T.E., Terry, P., Toniolo, P., Virtanen, M.J., Willet, W.C., Wolk, A., Wu, K., Yaun, S.-S., Zeleniuch-Jacquotte, A., Hunter, D.J.","Dairy foods, calcium, and colorectal cancer: A pooled analysis of 10 cohort studies",2004,"Journal of the National Cancer Institute","96","13",,"1015","1022",,273,,"http://www.scopus.com/inward/record.url?eid=2-s2.0-3242656606&partnerID=40&md5=2dee26a6fcc9b7e6a102dc78077da7b9",Article,Scopus,2-s2.0-3242656606
"Borugian, M.J., Sheps, S.B., Kim-Sing, C., Van Patten, C., Potter, J.D., Dunn, B., Gallagher, R.P., Hislop, T.G.","Insulin, macronutrient intake, and physical activity: Are potential indicators of insulin resistance associated with mortality from breast cancer?",2004,"Cancer Epidemiology Biomarkers and Prevention","13","7",,"1163","1172",,65,,"http://www.scopus.com/inward/record.url?eid=2-s2.0-3142733747&partnerID=40&md5=42b550cf89ab7e234a26ce7f04ba5365",Article,Scopus,2-s2.0-3142733747
"Cerhan, J.R., Potter, J.D., Gilmore, J.M.E., Janney, C.A., Kushi, L.H., Lazovich, D., Anderson, K.E., Sellers, T.A., Folsom, A.R.","Adherence to the AICR cancer prevention recommendations and subsequent morbidity and mortality in the Iowa women's health study cohort",2004,"Cancer Epidemiology Biomarkers and Prevention","13","7",,"1114","1120",,43,,"http://www.scopus.com/inward/record.url?eid=2-s2.0-3142776511&partnerID=40&md5=669b4244516c17836478bf48b63cd2f6",Article,Scopus,2-s2.0-3142776511
"McTiernan, A., Tworoger, S.S., Rajan, K.B., Yasui, Y., Sorenson, B., Ulrich, C.M., Chubak, J., Stanczyk, F.Z., Bowen, D., Irwin, M.L., Rudolph, R.E., Potter, J.D., Schwartz, R.S.","Effect of exercise on serum androgens in postmenopausal women: A 12-month randomized clinical trial",2004,"Cancer Epidemiology Biomarkers and Prevention","13","7",,"1099","1105",,85,,"http://www.scopus.com/inward/record.url?eid=2-s2.0-3142703018&partnerID=40&md5=21beffdba67e66a616c97876317b806e",Article,Scopus,2-s2.0-3142703018
"Shear, N.H., Redelmeier, D.A., Callen, J.P., Bickers, D.R., Bigby, M.E., Reed, B.R., Shear, N.H., Strauss, J.S., Harpe, S.E., Lyman, G.H., Culakova, E., Griggs, J., Velicer, C.M., Heckbert, S.R., Potter, J.D., Taplin, S.H.","Use of antibiotics and risk of cancer [1] (multiple letters)",2004,"Journal of the American Medical Association","291","22",,"2699","2700",,1,,"http://www.scopus.com/inward/record.url?eid=2-s2.0-2642544996&partnerID=40&md5=7dffe4d31b0dff2a80b377979a2b6455",Letter,Scopus,2-s2.0-2642544996
"Potter, J.D.","Toward the last cohort",2004,"Cancer Epidemiology Biomarkers and Prevention","13","6",,"895","897",,31,,"http://www.scopus.com/inward/record.url?eid=2-s2.0-2942585054&partnerID=40&md5=0f69e60271c1227a07eed4bf3aa0d34e",Editorial,Scopus,2-s2.0-2942585054
"Shade, E.D., Ulrich, C.M., Wener, M.H., Wood, B., Yasui, Y., LaCroix, K., Potter, J.D., McTiernan, A.","Frequent intentional weight loss is associated with lower natural killer cell cytotoxicity in postmenopausal women: Possible long-term immune effects",2004,"Journal of the American Dietetic Association","104","6",,"903","912",,43,10.1016/j.jada.2004.03.018,"http://www.scopus.com/inward/record.url?eid=2-s2.0-2542632691&partnerID=40&md5=cce8e5a8dcad02fd2448a50266004c01",Article,Scopus,2-s2.0-2542632691
"Velicer, C.M., Heckbert, S.R., Lampe, J.W., Potter, J.D., Robertson, C.A., Taplin, S.H., Chung, M.A.","Antibiotic use in relation to the risk of breast cancer",2004,"Women's Oncology Review","4","2",,"151","152",,,10.1080/1473340410001732361,"http://www.scopus.com/inward/record.url?eid=2-s2.0-4644322819&partnerID=40&md5=f934edbd934c0b02e7b4911468694682",Article,Scopus,2-s2.0-4644322819
"Ulrich, C., Bigler, J., Sparks, R., Whitton, J., Sibert, J.G., Goode, E.L., Yasui, Y., Potter, J.D., Ulrich, N.","Polymorphisms in PTGS1 (=COX-1) and risk of colorectal polyps",2004,"Cancer Epidemiology Biomarkers and Prevention","13","5",,"889","893",,48,,"http://www.scopus.com/inward/record.url?eid=2-s2.0-2942571203&partnerID=40&md5=0c77d174952ece3f984d17c6cc2980bb",Article,Scopus,2-s2.0-2942571203
"Atkinson, C., Lampe, J.W., Tworoger, S.S., Ulrich, C.M., Bowen, D., Irwin, M.L., Schwartz, R.S., Rajan, B.K., Yasui, Y., Potter, J.D., McTiernan, A.","Effects of a moderate intensity exercise intervention on estrogen metabolism in postmenopausal women",2004,"Cancer Epidemiology Biomarkers and Prevention","13","5",,"868","874",,31,,"http://www.scopus.com/inward/record.url?eid=2-s2.0-2942514443&partnerID=40&md5=fe843527fbfa3f842c764b8454f4510b",Article,Scopus,2-s2.0-2942514443
"McTiernan, A., Tworoger, S.S., Ulrich, C.M., Yasui, Y., Irwin, M.L., Rajan, K.B., Sorensen, B., Rudolph, R.E., Bowen, D., Stanczyk, F.Z., Potter, J.D., Schwartz, R.S.","Effect of Exercise on Serum Estrogens in Postmenopausal Women: A 12-Month Randomized Clinical Trial",2004,"Cancer Research","64","8",,"2923","2928",,183,10.1158/0008-5472.CAN-03-3393,"http://www.scopus.com/inward/record.url?eid=2-s2.0-4644329157&partnerID=40&md5=6f683bf6d18560168cb0e48ada707ae8",Article,Scopus,2-s2.0-4644329157
"Newcomb, P.A., Bush, A.C., Stoner, G.L., Lampe, J.W., Potter, J.D., Bigler, J.","No evidence of an association of JC virus and colon neoplasia",2004,"Cancer Epidemiology Biomarkers and Prevention","13","4",,"662","666",,41,,"http://www.scopus.com/inward/record.url?eid=2-s2.0-2942572771&partnerID=40&md5=679d4703078d7da5e31746417949be4d",Article,Scopus,2-s2.0-2942572771
"Adams, K.F., Chen, C., Newton, K.M., Potter, J.D., Lampe, J.W.","Soy isoflavones do not modulate prostate-specific antigen concentrations in older men in a randomized controlled trial",2004,"Cancer Epidemiology Biomarkers and Prevention","13","4",,"644","648",,38,,"http://www.scopus.com/inward/record.url?eid=2-s2.0-2942514438&partnerID=40&md5=51e34639648a3a19923e7cb99a63c72d",Article,Scopus,2-s2.0-2942514438
"Ramirez, C.J., Fleming, M.A., Potter, J.D., Ostrander, G.K., Ostrander, E.A.","Marsupial BRCA1: Conserved regions in mammals and the potential effect of missense changes",2004,"Oncogene","23","9",,"1780","1788",,12,10.1038/sj.onc.1207292,"http://www.scopus.com/inward/record.url?eid=2-s2.0-1642373326&partnerID=40&md5=71db292b0fd9dce8f04b99ded8f31ade",Article,Scopus,2-s2.0-1642373326
"Lampe, J.W., Stepaniants, S.B., Mao, M., Radich, J.P., Dai, H., Linsley, P.S., Friend, S.H., Potter, J.D.","Signatures of environmental exposures using peripheral leukocyte gene expression: Tobacco smoke",2004,"Cancer Epidemiology Biomarkers and Prevention","13","3",,"445","453",,82,,"http://www.scopus.com/inward/record.url?eid=2-s2.0-2442708081&partnerID=40&md5=e639243cc4b8faf1d9eb3f32035e440b",Article,Scopus,2-s2.0-2442708081
"Velicer, C.M., Heckbert, S.R., Lampe, J.W., Potter, J.D., Robertson, C.A., Taplin, S.H.","Antibiotic Use in Relation to the Risk of Breast Cancer",2004,"Journal of the American Medical Association","291","7",,"827","835",,133,10.1001/jama.291.7.827,"http://www.scopus.com/inward/record.url?eid=2-s2.0-1442309705&partnerID=40&md5=d62237e5d177df073014c3ef2cfad098",Article,Scopus,2-s2.0-1442309705
"Curtin, K., Bigler, J., Slattery, M.L., Caan, B., Potter, J.D., Ulrich, C.M.","MTHFR C677T and A1298C Polymorphisms: Diet, Estrogen, and Risk of Colon Cancer",2004,"Cancer Epidemiology Biomarkers and Prevention","13","2",,"285","292",,96,10.1158/1055-9965.EPI-03-0083,"http://www.scopus.com/inward/record.url?eid=2-s2.0-1242336874&partnerID=40&md5=402ff73b417a44b5cad432a1b49851b1",Article,Scopus,2-s2.0-1242336874
"Tworoger, S.S., Chubak, J., Aiello, E.J., Ulrich, C.M., Atkinson, C., Potter, J.D., Yasui, Y., Stapleton, P.L., Lampe, J.W., Farin, F.M., Stanczyk, F.Z., McTiernan, A.","Association of CYP17, CYP19, CYP1B1, and COMT Polymorphisms with Serum and Urinary Sex Hormone Concentrations in Postmenopausal Women",2004,"Cancer Epidemiology Biomarkers and Prevention","13","1",,"94","101",,104,10.1158/1055-9965.EPI-03-0026,"http://www.scopus.com/inward/record.url?eid=2-s2.0-9144240392&partnerID=40&md5=9a84e3c0ce787b28b7949579f34aae9e",Article,Scopus,2-s2.0-9144240392
"Littman, A.J., White, E., Kristal, A.R., Patterson, R.E., Satia-Abouta, J., Potter, J.D.","Assessment of a one-page questionnaire on long-term recreational physical activity",2004,"Epidemiology","15","1",,"105","113",,32,10.1097/01.ede.0000091604.32542.97,"http://www.scopus.com/inward/record.url?eid=2-s2.0-1542506133&partnerID=40&md5=03060259fc6dc18a65255f85dcc3b67a",Article,Scopus,2-s2.0-1542506133
"Goode, E.L., Potter, J.D., Bigler, J., Ulrich, C.M.","Methionine Synthase D919G Polymorphism, Folate Metabolism, and Colorectal Adenoma Risk",2004,"Cancer Epidemiology Biomarkers and Prevention","13","1",,"157","162",,40,10.1158/1055-9965.EPI-03-0097,"http://www.scopus.com/inward/record.url?eid=2-s2.0-1642568671&partnerID=40&md5=139dbec68c705c2568e1aac390b34016",Article,Scopus,2-s2.0-1642568671
"White, E., Patterson, R.E., Kristal, A.R., Thornquist, M., King, I., Shattuck, A.L., Evans, I., Satia-Abouta, J., Littman, A.J., Potter, J.D.","VITamins and Lifestyle Cohort Study: Study Design and Characteristics of Supplement Users",2004,"American Journal of Epidemiology","159","1",,"83","93",,139,10.1093/aje/kwh010,"http://www.scopus.com/inward/record.url?eid=2-s2.0-9144228668&partnerID=40&md5=0bd6f049924fca496469b2e65f71294a",Article,Scopus,2-s2.0-9144228668
"Potter, J.D., Alberts, D.S.","One Year and Counting: A Status Report from John and Dave",2004,"Cancer Epidemiology Biomarkers and Prevention","13","1",,"1","",,,,"http://www.scopus.com/inward/record.url?eid=2-s2.0-1642528001&partnerID=40&md5=f553c5e6eac523c06328c3691be1e249",Editorial,Scopus,2-s2.0-1642528001
"Potter, J.D.","Epidemiology, cancer genetics and microarrays: Making correct inferences, using appropriate designs",2003,"Trends in Genetics","19","12",,"690","695",,35,10.1016/j.tig.2003.10.005,"http://www.scopus.com/inward/record.url?eid=2-s2.0-0345293169&partnerID=40&md5=16e6c25814c760fc0cca10179dbb23da",Review,Scopus,2-s2.0-0345293169
"Mandelson, M.T., Miglioretti, D., Newcomb, P.A., Harrison, R., Potter, J.D.","Hormone replacement therapy in relation to survival in women diagnosed with colon cancer",2003,"Cancer Causes and Control","14","10",,"979","984",,37,10.1023/B:CACO.0000007970.04094.76,"http://www.scopus.com/inward/record.url?eid=2-s2.0-0347720639&partnerID=40&md5=589444486c1dd48cd22b3e63d8e50098",Article,Scopus,2-s2.0-0347720639
"Borugian, M.J., Sheps, S.B., Kim-Sing, C., Olivotto, I.A., Van Patten, C., Dunn, B.P., Coldman, A.J., Potter, J.D., Gallagher, R.P., Hislop, T.G.","Waist-to-Hip Ratio and Breast Cancer Mortality",2003,"American Journal of Epidemiology","158","10",,"963","968",,76,10.1093/aje/kwg236,"http://www.scopus.com/inward/record.url?eid=2-s2.0-0242442697&partnerID=40&md5=17ded2f789b35e2760e1e71ae1d8cc1f",Article,Scopus,2-s2.0-0242442697
