Authors,Title,Year,Source title,Volume,Issue,Art. No.,Page start,Page end,Page count,Cited by,DOI,Link,Document Type,Source,EID
"Ben Ali, S.-E., Madi, Z.E., Hochegger, R., Quist, D., Prewein, B., Haslberger, A.G., Brandes, C.","Mutation scanning in a single and a stacked genetically modified (GM) event by real-time PCR and high resolution melting (HRM) analysis",2014,"International Journal of Molecular Sciences","15","11",,"19898","19923",,,10.3390/ijms151119898,"http://www.scopus.com/inward/record.url?eid=2-s2.0-84908346752&partnerID=40&md5=68e1484b86b580da13de2f61e36b026a",Article,Scopus,2-s2.0-84908346752
"McGlade, J., Quist, D., Gee, D.","Policy: Social responsibility for new technologies",2013,"Nature","497","7449",,"317","",,,10.1038/497317a,"http://www.scopus.com/inward/record.url?eid=2-s2.0-84878079827&partnerID=40&md5=d9c6f21c7ba52d194e0bfddddef6a740",Letter,Scopus,2-s2.0-84878079827
"Madi, Z.E., Brandes, C., Neumann, G., Quist, D., Ruppitsch, W., Hochegger, R.","Evaluation of Adh1 alleles and transgenic soybean seeds using Scorpion PCR and HRM analysis",2013,"European Food Research and Technology","237","2",,"125","135",,2,10.1007/s00217-013-1969-y,"http://www.scopus.com/inward/record.url?eid=2-s2.0-84880816825&partnerID=40&md5=0657da5b3680795105a923f40de914d5",Article,Scopus,2-s2.0-84880816825
"Graef, F., Römbke, J., Binimelis, R., Myhr, A.I., Hilbeck, A., Breckling, B., Dalgaard, T., Stachow, U., Catacora-Vargas, G., Bøhn, T., Quist, D., Darvas, B., Dudel, G., Oehen, B., Meyer, H., Henle, K., Wynne, B., Metzger, M.J., Knäbe, S., Settele, J., Székács, A., Wurbs, A., Bernard, J., Murphy-Bokern, D., Buiatti, M., Giovannetti, M., Debeljak, M., Andersen, E., Paetz, A., Dzeroski, S., Tappeser, B., van Gestel, C.A.M., Wosniok, W., Séralini, G.-E., Aslaksen, I., Pesch, R., Maly, S., Werner, A.","A framework for a European network for a systematic environmental impact assessment of genetically modified organisms (GMO)",2012,"BioRisk",,"7",,"73","97",,4,10.3897/biorisk.7.1969,"http://www.scopus.com/inward/record.url?eid=2-s2.0-84873568185&partnerID=40&md5=f524d14eadbf7d3786347bf426aeb8fb",Article,Scopus,2-s2.0-84873568185
"Székács, A., Weiss, G., Quist, D., Takács, E., Darvas, B., Meier, M., Swain, T., Hilbeck, A.","Inter-laboratory comparison of Cry1Ab toxin quantification in MON 810 maize by enzyme-immunoassay",2012,"Food and Agricultural Immunology","23","2",,"99","121",,10,10.1080/09540105.2011.604773,"http://www.scopus.com/inward/record.url?eid=2-s2.0-84861212362&partnerID=40&md5=c527fa50d5f61cc12dce8471e78ac1ef",Article,Scopus,2-s2.0-84861212362
"Heinemann, J.A., Kurenbach, B., Quist, D.","Molecular profiling - a tool for addressing emerging gaps in the comparative risk assessment of GMOs",2011,"Environment International","37","7",,"1285","1293",,13,10.1016/j.envint.2011.05.006,"http://www.scopus.com/inward/record.url?eid=2-s2.0-79960049594&partnerID=40&md5=3ed3c6db9fdc9cf7311f6a029f607bb4",Review,Scopus,2-s2.0-79960049594
"Quist, D., Chapela, I.H.","Transgenic DNA introgressed into traditional maize landraces in Oaxaca, Mexico",2001,"Nature","414","6863",,"541","543",,309,10.1038/35107068,"http://www.scopus.com/inward/record.url?eid=2-s2.0-0035969540&partnerID=40&md5=27cdf94c8b2b89ef84a17c7c2ae37434",Article,Scopus,2-s2.0-0035969540
