Authors,Title,Year,Source title,Volume,Issue,Art. No.,Page start,Page end,Page count,Cited by,DOI,Link,Document Type,Source,EID
"Gahlot, S., Joshi, A., Singh, P., Tuteja, R., Dua, M., Jogawat, A., Kumar, M., Raj, S., Dayaman, V., Johri, A.K., Tuteja, N.","Isolation of genes conferring salt tolerance from Piriformospora indica by random overexpression in Escherichia coli",2015,"World Journal of Microbiology and Biotechnology","31","8",,"1195","1209",,,10.1007/s11274-015-1867-5,"http://www.scopus.com/inward/record.url?eid=2-s2.0-84933672416&partnerID=40&md5=5b91350e25b0f8c899b8b53e5cc83aa3",Article,Scopus,2-s2.0-84933672416
"Nath, M., Tuteja, N.","NPKS uptake, sensing, and signaling and miRNAs in plant nutrient stress",2015,"Protoplasma",,,,"","",20,,10.1007/s00709-015-0845-y,"http://www.scopus.com/inward/record.url?eid=2-s2.0-84931449891&partnerID=40&md5=cc25642486cbe815b44e12d460849f4f",Article in Press,Scopus,2-s2.0-84931449891
"Rizvi, I., Choudhury, N.R., Tuteja, N.","Arabidopsis thaliana MCM3 single subunit of MCM2–7 complex functions as 3′ to 5′ DNA helicase",2015,"Protoplasma",,,,"","",9,,10.1007/s00709-015-0825-2,"http://www.scopus.com/inward/record.url?eid=2-s2.0-84928966772&partnerID=40&md5=4c9ca776884f7784f0209a1a4542418f",Article in Press,Scopus,2-s2.0-84928966772
"Augustine, S.M., Ashwin Narayan, J., Syamaladevi, D.P., Appunu, C., Chakravarthi, M., Ravichandran, V., Tuteja, N., Subramonian, N.","Introduction of Pea DNA Helicase 45 into Sugarcane (Saccharum spp. Hybrid) Enhances Cell Membrane Thermostability and Upregulation of Stress-Responsive Genes Leads to Abiotic Stress Tolerance",2015,"Molecular Biotechnology","57","5",,"475","488",,,10.1007/s12033-015-9841-x,"http://www.scopus.com/inward/record.url?eid=2-s2.0-84939953458&partnerID=40&md5=f9448ee5544317d1d17772876f3d9587",Article,Scopus,2-s2.0-84939953458
"Vaid, N., Pandey, P., Srivastava, V.K., Tuteja, N.","Pea lectin receptor-like kinase functions in salinity adaptation without yield penalty, by alleviating osmotic and ionic stresses and upregulating stress-responsive genes",2015,"Plant Molecular Biology","88","1-2",,"193","206",,,10.1007/s11103-015-0319-9,"http://www.scopus.com/inward/record.url?eid=2-s2.0-84936756078&partnerID=40&md5=c5c0e29c6ea1298aa89554cc22bb857e",Article,Scopus,2-s2.0-84936756078
"Gill, S.S., Anjum, N.A., Gill, R., Yadav, S., Hasanuzzaman, M., Fujita, M., Mishra, P., Sabat, S.C., Tuteja, N.","Superoxide dismutase—mentor of abiotic stress tolerance in crop plants",2015,"Environmental Science and Pollution Research",,,,"","",20,1,10.1007/s11356-015-4532-5,"http://www.scopus.com/inward/record.url?eid=2-s2.0-84928630131&partnerID=40&md5=9d8783380f72e2fafcc899578d04f160",Article in Press,Scopus,2-s2.0-84928630131
"Anjum, N.A., Gill, R., Kaushik, M., Hasanuzzaman, M., Pereira, E., Ahmad, I., Tuteja, N., Gill, S.S.","ATP-sulfurylase, sulfur-compounds, and plant stress tolerance",2015,"Frontiers in Plant Science","6","APR", 210,"","",9,,10.3389/fpls.2015.00210,"http://www.scopus.com/inward/record.url?eid=2-s2.0-84928111263&partnerID=40&md5=00823531a32eb1b6a360129a1352c06b",Article,Scopus,2-s2.0-84928111263
"Tuteja, N., Tarique, M., Trivedi, D.K., Sahoo, R.K., Tuteja, R.","Stress-induced Oryza sativa BAT1 dual helicase exhibits unique bipolar translocation",2015,"Protoplasma","252","6",,"1563","1574",,,10.1007/s00709-015-0791-8,"http://www.scopus.com/inward/record.url?eid=2-s2.0-84946486964&partnerID=40&md5=9c542f02c10571ea21382c5d8af339bd",Article,Scopus,2-s2.0-84946486964
"Tuteja, N., Mishra, P., Yadav, S., Tajrishi, M., Baral, S., Sabat, S.C.","Heterologous expression and biochemical characterization of a highly active and stable chloroplastic CuZn-superoxide dismutase from Pisum sativum",2015,"BMC Biotechnology",,,,"1","14",,,10.1186/s12896-015-0117-0,"http://www.scopus.com/inward/record.url?eid=2-s2.0-84928747258&partnerID=40&md5=ad73088c74b7a30d1d73b9ff2dee34aa",Article in Press,Scopus,2-s2.0-84928747258
"Ansari, M.W., Rani, V., Shukla, A., Bains, G., Pant, R.C., Tuteja, N.","Mango (Mangifera indica L.) malformation: a malady of stress ethylene origin",2015,"Physiology and Molecular Biology of Plants",,,,"","",8,,10.1007/s12298-014-0258-y,"http://www.scopus.com/inward/record.url?eid=2-s2.0-84921891523&partnerID=40&md5=cd63d5ec72842e96cc23dc97f1159319",Article in Press,Scopus,2-s2.0-84921891523
"Phuong, N.D., Tuteja, N., Nghia, P.T., Hoi, P.X.","Identification and characterization of a stress-inducible gene OsNLI-IF enhancing drought tolerance in transgenic tobacco",2015,"Current Science","109","3",,"541","551",,,,"http://www.scopus.com/inward/record.url?eid=2-s2.0-84940765999&partnerID=40&md5=3542f6f8defe5934e7bf313f317cb2f7",Article,Scopus,2-s2.0-84940765999
"Gill, S.S., Anjum, N.A., Gill, R., Mahajan, M., Tuteja, N.","Abiotic stress tolerance and sustainable agriculture: A functional genomics perspective",2015,"Elucidation of Abiotic Stress Signaling in Plants: Functional Genomics Perspectives, Volume 2",,,,"439","472",,,10.1007/978-1-4939-2540-7_16,"http://www.scopus.com/inward/record.url?eid=2-s2.0-84944620884&partnerID=40&md5=7866e0a185313f0692f7ff1881f7d5a9",Book Chapter,Scopus,2-s2.0-84944620884
"Ramu, V.S., Swetha, T.N., Sheela, S.H., Babitha, C.K., Rohini, S., Reddy, M.K., Tuteja, N., Reddy, C.P., Prasad, T.G., Udayakumar, M.","Simultaneous expression of regulatory genes associated with specific drought-adaptive traits improves drought adaptation in peanut",2015,"Plant Biotechnology Journal",,,,"","",,,10.1111/pbi.12461,"http://www.scopus.com/inward/record.url?eid=2-s2.0-84941926636&partnerID=40&md5=5724067e23481fd924d15f387d1a7844",Article in Press,Scopus,2-s2.0-84941926636
"Sahoo, R.K., Ansari, M.W., Tuteja, R., Tuteja, N.","Salt tolerant SUV3 overexpressing transgenic rice plants conserve physicochemical properties and microbial communities of rhizosphere",2015,"Chemosphere","119",,,"1040","1047",,,10.1016/j.chemosphere.2014.08.011,"http://www.scopus.com/inward/record.url?eid=2-s2.0-84919754787&partnerID=40&md5=edb86e9aa22293fdd1aa1b91728a665c",Article,Scopus,2-s2.0-84919754787
"Gill, S.S., Anjum, N.A., Gill, R., Jha, M., Tuteja, N.","DNA damage and repair in plants under ultraviolet and ionizing radiations",2015,"Scientific World Journal","2015",, 250158,"","",,1,10.1155/2015/250158,"http://www.scopus.com/inward/record.url?eid=2-s2.0-84924243183&partnerID=40&md5=f272eb89cb49bba2207b46d032f8e175",Review,Scopus,2-s2.0-84924243183
"Srivastava, V.K., Tuteja, R., Tuteja, N.","Calcium-energized motor protein forisome controls damage in phloem: Potential applications as biomimetic ""smart"" material",2015,"Critical Reviews in Biotechnology","35","2",,"173","183",,,10.3109/07388551.2013.823598,"http://www.scopus.com/inward/record.url?eid=2-s2.0-84932184229&partnerID=40&md5=0c7673349757719f118a889934187950",Review,Scopus,2-s2.0-84932184229
"Siddique, A.B., Ara, I., Shahinul Islam, S.M., Tuteja, N.","Effect of air desiccation and salt stress factors on in vitro regeneration of rice (Oryza sativa L.)",2014,"Plant Signaling and Behavior","9","12", e977209,"e977209-1","e977209-10",,,10.4161/15592324.2014.977209,"http://www.scopus.com/inward/record.url?eid=2-s2.0-84922309751&partnerID=40&md5=0b9240f7dd103481e0b7cd9a8096413e",Article,Scopus,2-s2.0-84922309751
"Sahoo, R.K., Ansari, M.W., Tuteja, R., Tuteja, N.","OsSUV3 transgenic rice maintains higher endogenous levels of plant hormones that mitigates adverse effects of salinity and sustains crop productivity",2014,"Rice","7","1",,"1","3",,,10.1186/s12284-014-0017-2,"http://www.scopus.com/inward/record.url?eid=2-s2.0-84946123835&partnerID=40&md5=5939e12e778d6e468d4a8e8b0afd248d",Article,Scopus,2-s2.0-84946123835
"Tuteja, N., Sahoo, R.K., Huda, K.M.K., Tula, S., Tuteja, R.","OsBAT1 Augments Salinity Stress Tolerance by Enhancing Detoxification of ROS and Expression of Stress-Responsive Genes in Transgenic Rice",2014,"Plant Molecular Biology Reporter","33","5",,"1192","1209",,1,10.1007/s11105-014-0827-9,"http://www.scopus.com/inward/record.url?eid=2-s2.0-84940461883&partnerID=40&md5=2b363917309ae1ae14cf6a503972ddea",Article,Scopus,2-s2.0-84940461883
"Anjum, N.A., Ahmad, I., Válega, M., Mohmood, I., Gill, S.S., Tuteja, N., Duarte, A.C., Pereira, E.","Salt marsh halophyte services to metal-metalloid remediation: Assessment of the processes and underlying mechanisms",2014,"Critical Reviews in Environmental Science and Technology","44","18",,"2038","2106",,4,10.1080/10643389.2013.828271,"http://www.scopus.com/inward/record.url?eid=2-s2.0-84900837741&partnerID=40&md5=714ca7cf98842911b2ba79378eafec78",Article,Scopus,2-s2.0-84900837741
"Verma, A.K., Kumar, S., Chaudhari, B.P., Tuteja, N., Das, M., Dwivedi, P.D.","Allergenicity Assessment of Genetically-modified Tobacco Expressing Salt Tolerance cbl Gene",2014,"Plant Foods for Human Nutrition",,,,"","",,,10.1007/s11130-014-0435-8,"http://www.scopus.com/inward/record.url?eid=2-s2.0-84905316285&partnerID=40&md5=48799a18f993903cd3e5c8ba3c622d4b",Article in Press,Scopus,2-s2.0-84905316285
"Srivastava, V.K., Raikwar, S., Tuteja, N.","Cloning and functional characterization of the promoter of PsSEOF1 gene from Pisum sativum under different stress conditions using Agrobacterium-mediated transient assay",2014,"Plant Signaling and Behavior","9","JUN", e29626,"e29526","1-e29526-10",,,10.4161/psb.29626,"http://www.scopus.com/inward/record.url?eid=2-s2.0-84924251168&partnerID=40&md5=3e622a443c6ec77b2484fe2a88664eb1",Article,Scopus,2-s2.0-84924251168
"Banu, M.S.A., Huda, K.M.K., Sahoo, R.K., Garg, B., Tula, S., Islam, S.M.S., Tuteja, R., Tuteja, N.","Pea p68 Imparts Salinity Stress Tolerance in Rice by Scavenging of ROS-Mediated H2O2 and Interacts with Argonaute",2014,"Plant Molecular Biology Reporter",,,,"","",,2,10.1007/s11105-014-0748-7,"http://www.scopus.com/inward/record.url?eid=2-s2.0-84901888279&partnerID=40&md5=afe327875a255ddfaa62886416610dc6",Article in Press,Scopus,2-s2.0-84901888279
"Srivastava, V.K., Tuteja, N.","Calcium powered phloem protein of SEO gene family ""Forisome"" functions in wound sealing and act as biomimetic smart materials",2014,"Plant Signaling and Behavior","9","JUN", e29438,"e29438","1-e29438-8",,,10.4161/psb.29438,"http://www.scopus.com/inward/record.url?eid=2-s2.0-84924242466&partnerID=40&md5=611ed004e99e134dd64c44e5b32b5cf3",Review,Scopus,2-s2.0-84924242466
"Tuteja, N., Banu, Mst.S.A., Huda, K.Md.K., Gill, S.S., Jain, P., Pham, X.H., Tuteja, R.","Pea p68, a DEAD-box helicase, provides salinity stress tolerance in transgenic tobacco by reducing oxidative stress and improving photosynthesis machinery",2014,"PLoS ONE","9","5", e98287,"","",,4,10.1371/journal.pone.0098287,"http://www.scopus.com/inward/record.url?eid=2-s2.0-84902352112&partnerID=40&md5=d0cb5721b736a84a981cf2b5825bf620",Article,Scopus,2-s2.0-84902352112
"Sahoo, R.K., Ansari, M.W., Pradhan, M., Dangar, T.K., Mohanty, S., Tuteja, N.","A novel azotobacter vinellandii (SRIAz3) functions in salinity stress tolerance in rice",2014,"Plant Signaling and Behavior","9","7", e29377,"","",4,,10.4161/psb.29377,"http://www.scopus.com/inward/record.url?eid=2-s2.0-84924264893&partnerID=40&md5=83b24f494ec56f4698782af7b30e91f0",Article,Scopus,2-s2.0-84924264893
"Bhardwaj, D., Ansari, M.W., Sahoo, R.K., Tuteja, N.","Biofertilizers function as key player in sustainable agriculture by improving soil fertility, plant tolerance and crop productivity",2014,"Microbial Cell Factories","13","1", 66,"","",,6,10.1186/1475-2859-13-66,"http://www.scopus.com/inward/record.url?eid=2-s2.0-84900523852&partnerID=40&md5=e1900a7d5c7c54756ecbb025e80a5fab",Review,Scopus,2-s2.0-84900523852
"Banu, S.A., Huda, K.M.K., Tuteja, N.","Isolation and functional characterization of the promoter of a DEAD-box helicase Psp68 using Agrobacterium-mediated transient assay",2014,"Plant Signaling and Behavior","9","6", e28992,"","",8,1,10.4161/psb.28992,"http://www.scopus.com/inward/record.url?eid=2-s2.0-84904547290&partnerID=40&md5=662de1a526e7a685528fd86e2a878634",Article,Scopus,2-s2.0-84904547290
"Yadav, D.K., Shukla, D., Tuteja, N.","Isolation, in silico characterization, localization and expression analysis of abiotic stressresponsive rice g-protein β subunit (Rgb1)",2014,"Plant Signaling and Behavior","9","5", e28890,"","",12,,10.4161/psb.28824,"http://www.scopus.com/inward/record.url?eid=2-s2.0-84924281293&partnerID=40&md5=1c39b96293ab6e7ddc35fdaa2b427493",Article,Scopus,2-s2.0-84924281293
"Yadav, D.K., Shukla, D., Tuteja, N.","Isolation, in silico characterization, localization and expression analysis of abiotic stressresponsive rice G-protein β subunit (RGB1)",2014,"Plant Signaling and Behavior","9","APR",,"","",,3,10.4161/psb.28890,"http://www.scopus.com/inward/record.url?eid=2-s2.0-84900434406&partnerID=40&md5=784a837225ae4aa95776787183358ff2",Article,Scopus,2-s2.0-84900434406
"Gill, S.S., Gill, R., Tuteja, R., Tuteja, N.","Genetic engineering of crops: A ray of hope for enhanced food security",2014,"Plant Signaling and Behavior","9","3", e28545,"","",3,,10.4161/psb.28545,"http://www.scopus.com/inward/record.url?eid=2-s2.0-84924113149&partnerID=40&md5=1d11c88e52f4c80f5b88fbcd1140192e",Article,Scopus,2-s2.0-84924113149
"Macovei, A., Garg, B., Raikwar, S., Balestrazzi, A., Carbonera, D., Buttafava, A., Bremont, J.F.J., Gill, S.S., Tuteja, N.","Synergistic exposure of rice seeds to different doses of γ -ray and salinity stress resulted in increased antioxidant enzyme activities and gene-specific modulation of TC-NER pathway",2014,"BioMed Research International","2014",, 676934,"","",,5,10.1155/2014/676934,"http://www.scopus.com/inward/record.url?eid=2-s2.0-84893728535&partnerID=40&md5=70d5b2a54f6c73c33886adf949803545",Article,Scopus,2-s2.0-84893728535
"Garg, B., Vaid, N., Tuteja, N.","In-silico analysis and expression profiling implicate diverse role of EPSPS family genes in regulating developmental and metabolic processes",2014,"BMC Research Notes","7","1", 58,"","",,2,10.1186/1756-0500-7-58,"http://www.scopus.com/inward/record.url?eid=2-s2.0-84892645409&partnerID=40&md5=e94689c7f354e0c134b7c8d1269ad070",Article,Scopus,2-s2.0-84892645409
"Sahoo, R.K., Tuteja, N.","OsSUV3 functions in cadmium and zinc stress tolerance in rice (Oryza sativa L. cv IR64)",2014,"Plant Signaling and Behavior","9","JAN",,"","",,1,10.4161/psb.27389,"http://www.scopus.com/inward/record.url?eid=2-s2.0-84899157256&partnerID=40&md5=ccc46b4e2100854660fbec8e315256b9",Article,Scopus,2-s2.0-84899157256
"Trivedi, D.K., Ansari, M.W., Bhavesh, N.S., Johri, A.K., Tuteja, N.","Response of PiCypA tobacco T2 transgenic matured plant to potential tolerance to salinity stress",2014,"Plant Signaling and Behavior","9","JAN",,"","",,3,10.4161/psb.27538,"http://www.scopus.com/inward/record.url?eid=2-s2.0-84899130962&partnerID=40&md5=4b0d3cb11149e5050bf04e24fcee4cd5",Article,Scopus,2-s2.0-84899130962
"Kamrul Huda, K.M., Akhter Banu, M.S., Yadav, S., Sahoo, R.K., Tuteja, R., Tuteja, N.","Salinity and drought tolerant OsACA6 enhances cold tolerance in transgenic tobacco by interacting with stress-inducible proteins",2014,"Plant Physiology and Biochemistry","82",,,"229","238",,,10.1016/j.plaphy.2014.06.007,"http://www.scopus.com/inward/record.url?eid=2-s2.0-84903596118&partnerID=40&md5=4fb467a441634ec563e8f92dfcf9f1e2",Article,Scopus,2-s2.0-84903596118
"Ahmad, M., Tarique, M., Afrin, F., Tuteja, N., Tuteja, R.","Identification of inhibitors of Plasmodium falciparum RuvB1 helicase using biochemical assays",2014,"Protoplasma","252","1",,"117","125",,,10.1007/s00709-014-0664-6,"http://www.scopus.com/inward/record.url?eid=2-s2.0-84939895760&partnerID=40&md5=9fc20675741108826387ba3fffc94b0d",Article,Scopus,2-s2.0-84939895760
"Yadav, D.K., Shukla, D., Tuteja, N.","Isolation, in silico characterization, localization and expression analysis of abiotic stress-responsive rice G-protein β subunit (RGB1).",2014,"Plant signaling & behavior","9",,,"","",,,10.4161/psb.28890,"http://www.scopus.com/inward/record.url?eid=2-s2.0-84904890539&partnerID=40&md5=842e1d7211fe9af3c8ecd9df6b93099c",Article,Scopus,2-s2.0-84904890539
"Augustine, S.M., Ashwin Narayan, J., Syamaladevi, D.P., Appunu, C., Chakravarthi, M., Ravichandran, V., Tuteja, N., Subramonian, N.","Overexpression of EaDREB2 and pyramiding of EaDREB2 with the pea DNA helicase gene (PDH45) enhance drought and salinity tolerance in sugarcane (Saccharum spp. hybrid)",2014,"Plant Cell Reports","34","2",,"247","263",,,10.1007/s00299-014-1704-6,"http://www.scopus.com/inward/record.url?eid=2-s2.0-84925483899&partnerID=40&md5=d95aabe312a6b466a2de8e4362739acd",Article,Scopus,2-s2.0-84925483899
"Rizvi, I., Choudhury, N.R., Tuteja, N.","Insights into the functional characteristics of geminivirus rolling-circle replication initiator protein and its interaction with host factors affecting viral DNA replication",2014,"Archives of Virology","160","2",,"375","387",,,10.1007/s00705-014-2297-7,"http://www.scopus.com/inward/record.url?eid=2-s2.0-84925537761&partnerID=40&md5=00cf702b4a678c5ef7717162e478f5d3",Review,Scopus,2-s2.0-84925537761
"Anjum, N.A., Gill, S.S., Gill, R., Hasanuzzaman, M., Duarte, A.C., Pereira, E., Ahmad, I., Tuteja, R., Tuteja, N.","Metal/metalloid stress tolerance in plants: role of ascorbate, its redox couple, and associated enzymes",2014,"Protoplasma","251","6",,"1265","1283",,4,10.1007/s00709-014-0636-x,"http://www.scopus.com/inward/record.url?eid=2-s2.0-84919448371&partnerID=40&md5=e8389df97a10a5e11f2b3f18a051c2d0",Review,Scopus,2-s2.0-84919448371
"Manjulatha, M., Sreevathsa, R., Kumar, A.M., Sudhakar, C., Prasad, T.G., Tuteja, N., Udayakumar, M.","Overexpression of a pea DNA helicase (PDH45) in peanut (Arachis hypogaea L.) confers improvement of cellular level tolerance and productivity under drought stress",2014,"Molecular Biotechnology","56","2",,"111","125",,6,10.1007/s12033-013-9687-z,"http://www.scopus.com/inward/record.url?eid=2-s2.0-84899123409&partnerID=40&md5=d401dedf4e31cd626075cc9bb88ce3fd",Article,Scopus,2-s2.0-84899123409
"Joshi, B., Ansari, M.W., Bains, G., Pant, R.C., Shukla, A., Tuteja, N., Kumar, J.","Fusarium mangiferae associated with mango malformation in the tarai region of the Uttarakhand state of India",2014,"Plant Signaling and Behavior","9","APR", e28715,"","",,,10.4161/psb.28715,"http://www.scopus.com/inward/record.url?eid=2-s2.0-84899422176&partnerID=40&md5=50fef5fee8de342667f5dffcc470ddaa",Article,Scopus,2-s2.0-84899422176
"Sahoo, R.K., Ansari, M.W., Pradhan, M., Dangar, T.K., Mohanty, S., Tuteja, N.","Phenotypic and molecular characterization of native Azospirillum strains from rice fields to improve crop productivity",2014,"Protoplasma","251","4",,"943","953",,1,10.1007/s00709-013-0607-7,"http://www.scopus.com/inward/record.url?eid=2-s2.0-84902778956&partnerID=40&md5=0b77c96fc600abf721fffe38386759e9",Article,Scopus,2-s2.0-84902778956
"Siddique, A.B., Ara, I., Islam, S.M., Tuteja, N.","Effect of air desiccation and salt stress factors on in vitro regeneration of rice (Oryza sativa L.)",2014,"Plant signaling & behavior","9","12",,"e977209","",,,10.4161/15592324.2014.977209,"http://www.scopus.com/inward/record.url?eid=2-s2.0-84940996421&partnerID=40&md5=acc2900b83b78933aa728e29bb6d13fe",Article,Scopus,2-s2.0-84940996421
"Shukla, D., Kamrul Huda, K.M., Banu, M.S.A., Gill, S.S., Tuteja, R., Tuteja, N.","Erratum: OsACA6, a P-type 2B Ca2+ ATPase functions in cadmium stress tolerance in tobacco by reducing the oxidative stress load [Planta, DOI 10.1007/s00425-014-2133-z]",2014,"Planta","240","4",,"825","",,,10.1007/s00425-014-2145-8,"http://www.scopus.com/inward/record.url?eid=2-s2.0-84907682321&partnerID=40&md5=2a217e5c75d2feea7e6a874f6ea28dad",Erratum,Scopus,2-s2.0-84907682321
"Singh, A., Ansari, M.W., Rani, V., Singh, C.P., Shukla, A., Pant, R.C., Tuteja, N., Bains, G.","First evidence of putrescine involvement in mitigating the floral malformation in mangoes: A scanning electron microscope study",2014,"Protoplasma","251","5",,"1255","1261",,1,10.1007/s00709-014-0611-6,"http://www.scopus.com/inward/record.url?eid=2-s2.0-84905705397&partnerID=40&md5=50185854fdd5aedf39d742866fc4bcdb",Article,Scopus,2-s2.0-84905705397
"Ansari, M.W., Tuteja, N.","Post-harvest quality risks by stress/ethylene: management to mitigate",2014,"Protoplasma","252","1",,"21","32",,1,10.1007/s00709-014-0678-0,"http://www.scopus.com/inward/record.url?eid=2-s2.0-84939883622&partnerID=40&md5=be53a7552de70ecd8566a3b17ba44ac0",Review,Scopus,2-s2.0-84939883622
"Tuteja, N., Tarique, M., Banu, M.S.A., Ahmad, M., Tuteja, R.","Pisum sativum p68 DEAD-box protein is ATP-dependent RNA helicase and unique bipolar DNA helicase",2014,"Plant Molecular Biology","85","6",,"639","651",,1,10.1007/s11103-014-0209-6,"http://www.scopus.com/inward/record.url?eid=2-s2.0-84904552235&partnerID=40&md5=2922982c230c4e06b03249b03826acae",Article,Scopus,2-s2.0-84904552235
"Shukla, D., Huda, K.M.K., Banu, M.S.A., Gill, S.S., Tuteja, R., Tuteja, N.","OsACA6, a P-type 2B Ca2+ ATPase functions in cadmium stress tolerance in tobacco by reducing the oxidative stress load",2014,"Planta","240","4",,"809","824",,1,10.1007/s00425-014-2133-z,"http://www.scopus.com/inward/record.url?eid=2-s2.0-84907707846&partnerID=40&md5=d80da37dad2b8058296605722c95d397",Article,Scopus,2-s2.0-84907707846
"Ansari, M.W., Gill, S.S., Tuteja, N.","Piriformospora indica a powerful tool for crop improvement",2014,"Proceedings of the Indian National Science Academy","80","2",,"317","324",,,,"http://www.scopus.com/inward/record.url?eid=2-s2.0-84905989293&partnerID=40&md5=8abfcefc6067d7c87f119a18e06758a2",Review,Scopus,2-s2.0-84905989293
"Trivedi, D.K., Ansari, M.W., Dutta, T., Singh, P., Tuteja, N.","Molecular characterization of cyclophilin A-like protein from Piriformospora indica for its potential role to abiotic stress tolerance in E. coli",2013,"BMC Research Notes","6","1", 555,"","",,1,10.1186/1756-0500-6-555,"http://www.scopus.com/inward/record.url?eid=2-s2.0-84890698789&partnerID=40&md5=211b56af18dc2685945dd14b8ff5b388",Article,Scopus,2-s2.0-84890698789
"Ansari, M.W., Tuteja, N.","Stress-induced ethylene in postharvest losses of perishable products",2013,"Stewart Postharvest Review","9","4",,"1","5",,1,,"http://www.scopus.com/inward/record.url?eid=2-s2.0-84891140588&partnerID=40&md5=9795e46fb299221d9e7064df05d163a2",Article,Scopus,2-s2.0-84891140588
"Ansari, M.W., Tula, S., Shukla, A., Pant, R.C., Tuteja, N.","In vitro: Response of plant growth regulators and antimalformins on conidia germination of Fusarium mangiferae and incidence of mango malformation",2013,"Communicative and Integrative Biology","6","6", e25659,"","",,1,10.4161/cib.25659,"http://www.scopus.com/inward/record.url?eid=2-s2.0-84894036298&partnerID=40&md5=469c311af9cb8729afa41c991faebc7e",Article,Scopus,2-s2.0-84894036298
"Huda, K.M.K., Banu, M.S.A., Garg, B., Tula, S., Tuteja, R., Tuteja, N.","OsACA6, a P-type IIB Ca2+ATPase promotes salinity and drought stress tolerance in tobacco by ROS scavenging and enhancing the expression of stress-responsive genes",2013,"Plant Journal","76","6",,"997","1015",,8,10.1111/tpj.12352,"http://www.scopus.com/inward/record.url?eid=2-s2.0-84890313520&partnerID=40&md5=175c4610f0bd8fd7341b22fb829409fe",Article,Scopus,2-s2.0-84890313520
"Jogawat, A., Saha, S., Bakshi, M., Dayaman, V., Kumar, M., Dua, M., Varma, A., Oelmüller, R., Tuteja, N., Johri, A.K.","Piriformospora indica rescues growth diminution of rice seedlings during high salt stress",2013,"Plant Signaling and Behavior","8","10", e26891,"","",,3,10.4161/psb.26891,"http://www.scopus.com/inward/record.url?eid=2-s2.0-84887976613&partnerID=40&md5=40ed6d4815fde45d888212f772664b88",Article,Scopus,2-s2.0-84887976613
"Islam, S.M.S., Tuteja, N.","Production of abiotic stress tolerant fertile transgenic plants using androgenesis and genetic transformation methods in cereal crops",2013,"Crop Improvement Under Adverse Conditions",,,,"213","229",,2,10.1007/978-1-4614-4633-0_9,"http://www.scopus.com/inward/record.url?eid=2-s2.0-84922333251&partnerID=40&md5=82edcb9d32b96691ecc28a1a2487b19d",Book Chapter,Scopus,2-s2.0-84922333251
"Gill, S.S., Anjum, N.A., Gill, R., Hasanuzzaman, M., Sharma, P., Tuteja, N.","Mechanism of cadmium toxicity and tolerance in crop plants",2013,"Crop Improvement Under Adverse Conditions",,,,"361","365",,1,10.1007/978-1-4614-4633-0_17,"http://www.scopus.com/inward/record.url?eid=2-s2.0-84906307042&partnerID=40&md5=fba82485ebb16c8c7b3cdb834fa49d94",Book Chapter,Scopus,2-s2.0-84906307042
"Ahmed, F., Arshi, N., Kumar, S., Gill, S.S., Gill, R., Tuteja, N., Koo, B.H.","Nanobiotechnology: Scope and potential for crop improvement",2013,"Crop Improvement Under Adverse Conditions",,,,"245","269",,3,10.1007/978-1-4614-4633-0_11,"http://www.scopus.com/inward/record.url?eid=2-s2.0-84884908743&partnerID=40&md5=f6d9d7dad241033d430d64351f26d988",Book Chapter,Scopus,2-s2.0-84884908743
"Trivedi, D.K., Bhatt, H., Pal, R.K., Tuteja, R., Garg, B., Johri, A.K., Bhavesh, N.S., Tuteja, N.","Structure of RNA-interacting Cyclophilin A-like protein from Piriformospora indica that provides salinity-stress tolerance in plants",2013,"Scientific Reports","3",, 3001,"","",,3,10.1038/srep03001,"http://www.scopus.com/inward/record.url?eid=2-s2.0-84886260314&partnerID=40&md5=f641c9922d290ed8bba125a8edb70e8a",Article,Scopus,2-s2.0-84886260314
"Vivek, P.J., Tuteja, N., Soniya, E.V.","CDPK1 from Ginger Promotes Salinity and Drought Stress Tolerance without Yield Penalty by Improving Growth and Photosynthesis in Nicotiana tabacum",2013,"PLoS ONE","8","10", e76392,"","",,10,10.1371/journal.pone.0076392,"http://www.scopus.com/inward/record.url?eid=2-s2.0-84885981466&partnerID=40&md5=261da8f94a49d89dec07e455c6c41e65",Article,Scopus,2-s2.0-84885981466
