Authors,Title,Year,Source title,Volume,Issue,Art. No.,Page start,Page end,Page count,Cited by,DOI,Link,Document Type,Source,EID
"Saxena, S.C., Salvi, P., Kaur, H., Verma, P., Petla, B.P., Rao, V., Kamble, N., Majee, M.","Differentially expressed myo-inositol monophosphatase gene (CaIMP) in chickpea (Cicer arietinum L.) encodes a lithium-sensitive phosphatase enzyme with broad substrate specificity and improves seed germination and seedling growth under abiotic stresses",2013,"Journal of Experimental Botany","64","18",,"5623","5639",,2,10.1093/jxb/ert336,"http://www.scopus.com/inward/record.url?eid=2-s2.0-84891524137&partnerID=40&md5=064fb936c952e041328c52ab1f5f0874",Article,Scopus,2-s2.0-84891524137
"Verma, P., Kaur, H., Petla, B.P., Rao, V., Saxena, S.C., Majee, M.","PROTEIN L-ISOASPARTYL METHYLTRANSFERASE2 Is Differentially expressed in chickpea and enhances seed vigor and longevity by reducing abnormal isoaspartyl accumulation predominantly in seed nuclear proteins",2013,"Plant Physiology","161","3",,"1141","1157",,10,10.1104/pp.112.206243,"http://www.scopus.com/inward/record.url?eid=2-s2.0-84874624120&partnerID=40&md5=42b21d9b17468bc2ee21987c2f36fca3",Article,Scopus,2-s2.0-84874624120
"Kaur, H., Verma, P., Petla, B.P., Rao, V., Saxena, S.C., Majee, M.","Ectopic expression of the ABA-inducible dehydration-responsive chickpea l-myo-inositol 1-phosphate synthase 2 (CaMIPS2) in Arabidopsis enhances tolerance to salinity and dehydration stress",2013,"Planta","237","1",,"321","335",,4,10.1007/s00425-012-1781-0,"http://www.scopus.com/inward/record.url?eid=2-s2.0-84871920931&partnerID=40&md5=3792d47e5c03e554ec47a285c6c307da",Article,Scopus,2-s2.0-84871920931
"Basu Baul, T.S., Paul, A., Pellerito, L., Scopelliti, M., Singh, P., Verma, P., Duthie, A., De Vos, D., Tiekink, E.R.T.","Dibutyltin(IV) complexes containing arylazobenzoate ligands: Chemistry, in vitro cytotoxic effects on human tumor cell lines and mode of interaction with some enzymes",2011,"Investigational New Drugs","29","2",,"285","299",,14,10.1007/s10637-009-9360-3,"http://www.scopus.com/inward/record.url?eid=2-s2.0-79957555617&partnerID=40&md5=a5ad453325f4b9a9f99249a09a78b601",Article,Scopus,2-s2.0-79957555617
"Basu Baul, T.S., Paul, A., Pellerito, L., Scopelliti, M., Singh, P., Verma, P., De Vos, D.","Triphenyltin(IV) 2-[(E)-2-(aryl)-1-diazenyl]benzoates as anticancer drugs: Synthesis, structural characterization, in vitro cytotoxicity and study of its influence towards the mechanistic role of some key enzymes",2010,"Investigational New Drugs","28","5",,"587","599",,7,10.1007/s10637-009-9293-x,"http://www.scopus.com/inward/record.url?eid=2-s2.0-77956059024&partnerID=40&md5=b465b380906878b0b154df36131cb308",Article,Scopus,2-s2.0-77956059024
"Basu Baul, T.S., Paul, A., Pellerito, L., Scopelliti, M., Pellerito, C., Singh, P., Verma, P., Duthie, A., de Vos, D., Verma, R.P., Englert, U.","Molecular basis of the interaction of novel tributyltin(IV) 2/4-[(E)-2-(aryl)-1-diazenyl]benzoates endowed with an improved cytotoxic profile: Synthesis, structure, biological efficacy and QSAR studies",2010,"Journal of Inorganic Biochemistry","104","9",,"950","966",,14,10.1016/j.jinorgbio.2010.05.001,"http://www.scopus.com/inward/record.url?eid=2-s2.0-77955090207&partnerID=40&md5=b137079de5d48387b60604afe9f6cc44",Article,Scopus,2-s2.0-77955090207
"Verma, P., Singh, A., Kaur, H., Majee, M.","PROTEIN L-ISOASPARTYL METHYLTRANSFERASE1 (CaPIMT1) from chickpea mitigates oxidative stress-induced growth inhibition of Escherichia coli",2010,"Planta","231","2",,"329","336",,7,10.1007/s00425-009-1050-z,"http://www.scopus.com/inward/record.url?eid=2-s2.0-77949772436&partnerID=40&md5=f7ee56d53dba6f05eaa90d6f49d052a1",Article,Scopus,2-s2.0-77949772436
"Singh, P., Kaur, M., Verma, P.","Design, synthesis and anticancer activities of hybrids of indole and barbituric acids-Identification of highly promising leads",2009,"Bioorganic and Medicinal Chemistry Letters","19","11",,"3054","3058",,43,10.1016/j.bmcl.2009.04.014,"http://www.scopus.com/inward/record.url?eid=2-s2.0-65149100170&partnerID=40&md5=5878174c4e53b8a62299f882f7b0c16e",Article,Scopus,2-s2.0-65149100170
"Srivastava, K.K., Verma, P.K., Srivastava, R.","A recombinant cellulolytic Escherichia coli: Cloning of the cellulase gene and characterization of a bifunctional cellulase",1999,"Biotechnology Letters","21","4",,"293","297",,4,10.1023/A:1005443902262,"http://www.scopus.com/inward/record.url?eid=2-s2.0-0032960527&partnerID=40&md5=49925a3e31fe34a57b8fb682e6bd008f",Article,Scopus,2-s2.0-0032960527
